match,date,time,venue,over,ball,bowler,batsman,ball_event,event_info,extract_time
16_RRvsRCB,May 04,13:29:25,Barsapara Cricket Stadium,17,1,Sandeep Sharma,Rajat Patidar,out Caught by Donovan Ferreira!! A fine knock by Rajat Patidar comes to an end. This was a cross-seamer on a fuller length,Rajat Patidar looks to go big. He swings hard and miscues it towards deep mid-wicket. Donovan Ferreira in the deep settles under the skier and makes sure to latch onto it. Sandeep Sharma with a unique celebration as he writes something pointing towards skyward. Rajat Patidar c Donovan Ferreira b Sandeep Sharma 63(40) [4s-4 6s-4],2026-05-04 13:32:58.701198
16_RRvsRCB,May 04,13:29:25,Barsapara Cricket Stadium,17,2,Sandeep Sharma,Bhuvneshwar Kumar,wide,fired down the leg-side; that's a wide ball by Sandeep Sharma,2026-05-04 13:32:58.701434
16_RRvsRCB,May 04,13:29:25,Barsapara Cricket Stadium,17,2,Sandeep Sharma,Bhuvneshwar Kumar,1 run,overthrow. Back of a length outside off; Bhuvneshwar Kumar taps it towards backward point and sets off for a single. He is sent back though and an overthrow at the batsman's end; results in one,2026-05-04 13:32:58.701699
16_RRvsRCB,May 04,13:29:25,Barsapara Cricket Stadium,17,3,Sandeep Sharma,Venkatesh Iyer,1 run,almost chopped on! On a length around off; Venkatesh Iyer swings early and gets an inside edge past the stumps. Almost ricocheted onto the stumps this one,2026-05-04 13:32:58.701950
16_RRvsRCB,May 04,13:29:25,Barsapara Cricket Stadium,17,4,Sandeep Sharma,Bhuvneshwar Kumar,no run,length ball on middle and leg; Bhuvneshwar Kumar nudges it towards mid-wicket,2026-05-04 13:32:58.702167
16_RRvsRCB,May 04,13:29:25,Barsapara Cricket Stadium,17,5,Sandeep Sharma,Bhuvneshwar Kumar,1 run,drifting on the pads; worked through mid-wicket for a single by Bhuvneshwar Kumar,2026-05-04 13:32:58.702413
16_RRvsRCB,May 04,13:29:25,Barsapara Cricket Stadium,17,6,Sandeep Sharma,Venkatesh Iyer,1 run,good length delivery around off; knocked to long-off for a single,2026-05-04 13:32:58.702673
16_RRvsRCB,May 04,13:29:25,Barsapara Cricket Stadium,18,1,Brijesh Sharma,Venkatesh Iyer,1 run,on the fuller side as Venkatesh Iyer drives this towards long-on for one,2026-05-04 13:32:58.702929
16_RRvsRCB,May 04,13:29:25,Barsapara Cricket Stadium,18,2,Brijesh Sharma,Bhuvneshwar Kumar,no run,banged in short by Brijesh Sharma outside off; it's a slower bouncer as Bhuvneshwar Kumar ducks underneath,2026-05-04 13:32:58.703157
16_RRvsRCB,May 04,13:29:25,Barsapara Cricket Stadium,18,3,Brijesh Sharma,Bhuvneshwar Kumar,FOUR,smashed away! Slight width on offer outside off; Bhuvneshwar Kumar makes room and thumps this over covers as the ball races away to the fence,2026-05-04 13:32:58.703326
16_RRvsRCB,May 04,13:29:25,Barsapara Cricket Stadium,18,4,Brijesh Sharma,Bhuvneshwar Kumar,1 run,good length delivery around middle and leg; keeps a tad low as Bhuvneshwar Kumar bunts it towards long-on,2026-05-04 13:32:58.703449
16_RRvsRCB,May 04,13:29:25,Barsapara Cricket Stadium,18,5,Brijesh Sharma,Venkatesh Iyer,1 run,short and wide outside off; Venkatesh Iyer goes for a cut; miscues it towards the off-side,2026-05-04 13:32:58.703566
16_RRvsRCB,May 04,13:29:25,Barsapara Cricket Stadium,18,6,Brijesh Sharma,Bhuvneshwar Kumar,2 runs,good running between the wickets. A low full toss by Brijesh Sharma and Bhuvneshwar Kumar swings early. Mistimes it towards deep mid-on and that allows them to come back for two. Hetmyer with a direct-hit at the bowler's end; but Iyer was inside the crease as he dragged his bat with a sprint,2026-05-04 13:32:58.703707
16_RRvsRCB,May 04,13:29:25,Barsapara Cricket Stadium,19,1,Sandeep Sharma,Venkatesh Iyer,FOUR,cheeky! Good length delivery outside off; Venkatesh Iyer improvises and reverse laps this towards the third man fence. There was a fielder inside the ring; but he could do nothing about it,2026-05-04 13:32:58.703814
16_RRvsRCB,May 04,13:29:25,Barsapara Cricket Stadium,19,2,Sandeep Sharma,Venkatesh Iyer,SIX,good length delivery; right into the slot; Venkatesh Iyer stays in the crease and swings it over deep mid-wicket for half-a-dozen. That was a clean strike as it was a 82m maximum,2026-05-04 13:32:58.703921
16_RRvsRCB,May 04,13:29:25,Barsapara Cricket Stadium,19,3,Sandeep Sharma,Venkatesh Iyer,no run,yorker length ball outside off; Venkatesh Iyer looks to swipe this across the line; gets beaten,2026-05-04 13:32:58.704059
16_RRvsRCB,May 04,13:29:25,Barsapara Cricket Stadium,19,4,Sandeep Sharma,Venkatesh Iyer,2 runs,short and wide outside off; Venkatesh Iyer slaps it over the infield at covers; challenges the fielder's arm and comes back for two,2026-05-04 13:32:58.704211
16_RRvsRCB,May 04,13:29:25,Barsapara Cricket Stadium,19,5,Sandeep Sharma,Venkatesh Iyer,wide,attempts a wide yorker; but misses the tramline outside off. Called a wide by the umpire,2026-05-04 13:32:58.704407
16_RRvsRCB,May 04,13:29:25,Barsapara Cricket Stadium,19,5,Sandeep Sharma,Venkatesh Iyer,2 runs,on the shorter side; tad slower; Venkatesh Iyer swings across the line early; gets a top edge over square leg. A couple of runs taken,2026-05-04 13:32:58.704539
16_RRvsRCB,May 04,13:29:25,Barsapara Cricket Stadium,19,6,Sandeep Sharma,Venkatesh Iyer,SIX,an impactful knock by the Impact sub. He powers this length delivery over long-off and takes RCB past the 200-run mark. That was a really expensive over by Sandeep Sharma; concedes 21 runs in the 20th over,2026-05-04 13:32:58.704737
16_RRvsRCB,May 04,13:29:25,Barsapara Cricket Stadium,0,1,Bhuvneshwar Kumar,Yashasvi Jaiswal,no run,short of a leng5th outside off; Yashasvi Jaiswal steers it to short third man,2026-05-04 13:32:58.704874
16_RRvsRCB,May 04,13:29:25,Barsapara Cricket Stadium,0,2,Bhuvneshwar Kumar,Yashasvi Jaiswal,1 run,short of a length outside off; Yashasvi Jaiswal carves it through backward point to get going,2026-05-04 13:32:58.704985
16_RRvsRCB,May 04,13:29:25,Barsapara Cricket Stadium,0,3,Bhuvneshwar Kumar,Vaibhav Sooryavanshi,FOUR,Vaibhav Sooryavanshi is off the mark with a boundary! That's an inswinging yorker from round the wicket and Vaibhav Sooryavanshi brings his bat down in a jiffy and drills it straight past the bowler. Patidar chases it all the way to the boundary and puts in a dive; but fails to stop the boundary,2026-05-04 13:32:58.705099
16_RRvsRCB,May 04,13:29:25,Barsapara Cricket Stadium,0,4,Bhuvneshwar Kumar,Vaibhav Sooryavanshi,no run,from over the wicket angle; back of a length delivery as Vaibhav Sooryavanshi swings early; getting an inside edge towards mid-wicket,2026-05-04 13:32:58.705209
16_RRvsRCB,May 04,13:29:25,Barsapara Cricket Stadium,0,5,Bhuvneshwar Kumar,Vaibhav Sooryavanshi,no run,banged in short by Bhuvneshwar Kumar; Vaibhav Sooryavanshi goes for an upper cut and misses,2026-05-04 13:32:58.705315
16_RRvsRCB,May 04,13:29:25,Barsapara Cricket Stadium,0,6,Bhuvneshwar Kumar,Vaibhav Sooryavanshi,FOUR,width on offer outside off; Vaibhav Sooryavanshi throws the kitchen sink at it. Slashes it powerfully and gets enough elevation to clear the infield. Bounces a couple of times and lobs past the boundary. 9 runs from the opening over for RR,2026-05-04 13:32:58.705425
16_RRvsRCB,May 04,13:29:25,Barsapara Cricket Stadium,1,1,Josh Hazlewood,Yashasvi Jaiswal,SIX,Yashasvi Jaiswal joins the act! Width on offer outside off; Yashasvi Jaiswal throws his hands at it and slashes it over deep backward point. Salt in the deep sprints across to his left; but this one clears him comfortably. That's the first maximum of the chase,2026-05-04 13:32:58.705539
16_RRvsRCB,May 04,13:29:25,Barsapara Cricket Stadium,1,2,Josh Hazlewood,Yashasvi Jaiswal,no run,back of a length around off; Yashasvi Jaiswal pats it down,2026-05-04 13:32:58.705666
16_RRvsRCB,May 04,13:29:25,Barsapara Cricket Stadium,1,3,Josh Hazlewood,Yashasvi Jaiswal,no run,141.5kph; back of a length outside off; Yashasvi Jaiswal attempts a cut and misses,2026-05-04 13:32:58.705779
16_RRvsRCB,May 04,13:29:25,Barsapara Cricket Stadium,1,4,Josh Hazlewood,Yashasvi Jaiswal,no run,short of a length outside off; angled away from the batter as Yashasvi Jaiswal plays it on the rise; taps it towards the keeper with soft hands,2026-05-04 13:32:58.705892
16_RRvsRCB,May 04,13:29:25,Barsapara Cricket Stadium,1,5,Josh Hazlewood,Yashasvi Jaiswal,SIX,pulled away! Banged in short by Josh Hazlewood; Yashasvi Jaiswal gets into a good position; rocks back in the crease and pulls it over deep mid-wicket for half-a-dozen. Plenty of RR flags in the stands,2026-05-04 13:32:58.706008
16_RRvsRCB,May 04,13:29:25,Barsapara Cricket Stadium,1,6,Josh Hazlewood,Yashasvi Jaiswal,out Caught by Jitesh Sharma!! Josh Hazlewood has the last laugh! That's a huge wicket as he gets the in-form opener. Short of a length outside off,a cross-seam delivery and Yashasvi Jaiswal looks to cut it away. That was too close to the body and the outside edge has been taken by the keeper; diving to his left. Josh Hazlewood is back in the playing XI and among the wickets; right in his 1st over. Yashasvi Jaiswal c Jitesh Sharma b Josh Hazlewood 13(8) [6s-2],2026-05-04 13:32:58.706126
16_RRvsRCB,May 04,13:29:25,Barsapara Cricket Stadium,2,1,Abhinandan Singh,Vaibhav Sooryavanshi,no run,good length delivery around leg; Vaibhav Sooryavanshi looks to flick it away; gets hit on the pads though,2026-05-04 13:32:58.706238
16_RRvsRCB,May 04,13:29:25,Barsapara Cricket Stadium,2,2,Abhinandan Singh,Vaibhav Sooryavanshi,FOUR,smashed down the ground! Pitched up by the bowler and Vaibhav Sooryavanshi has drilled it straight past the bowler with a powerful swing of his bat. No need to run for those,2026-05-04 13:32:58.706347
16_RRvsRCB,May 04,13:29:25,Barsapara Cricket Stadium,2,3,Abhinandan Singh,Vaibhav Sooryavanshi,FOUR,and now some luck with him. This was a back of a length delivery outside off; Vaibhav Sooryavanshi swings early and the inside edge misses the off-stump; beats the keeper's dive and races away to the fence. Back-to-back boundaries for the flamboyant young opener,2026-05-04 13:32:58.706458
16_RRvsRCB,May 04,13:29:25,Barsapara Cricket Stadium,2,4,Abhinandan Singh,Vaibhav Sooryavanshi,1 run,length delivery around middle and leg; Vaibhav Sooryavanshi swipes across the line; gets an inside edge through backward square leg,2026-05-04 13:32:58.706568
16_RRvsRCB,May 04,13:29:25,Barsapara Cricket Stadium,2,5,Abhinandan Singh,Dhruv Jurel,1 run,fraction short outside off; Dhruv Jurel chops it over backward point for one,2026-05-04 13:32:58.706703
16_RRvsRCB,May 04,13:29:25,Barsapara Cricket Stadium,2,6,Abhinandan Singh,Vaibhav Sooryavanshi,SIX,flicked away! Pitched up by the bowler and Vaibhav Sooryavanshi flicks it over deep mid-wicket for a maximum. He's playing a video game out there in the middle. Makes batting look so easy and effortless,2026-05-04 13:32:58.706807
16_RRvsRCB,May 04,13:29:25,Barsapara Cricket Stadium,3,1,Josh Hazlewood,Dhruv Jurel,no run,on a length around off; Dhruv Jurel pats this in front of point and sets off for a single; only to be sent back,2026-05-04 13:32:58.706909
16_RRvsRCB,May 04,13:29:25,Barsapara Cricket Stadium,3,2,Josh Hazlewood,Dhruv Jurel,1 run,back of a length outside off; Dhruv Jurel steers it towards short third man for one,2026-05-04 13:32:58.707023
16_RRvsRCB,May 04,13:29:25,Barsapara Cricket Stadium,3,3,Josh Hazlewood,Vaibhav Sooryavanshi,FOUR,that shaped back in sharply from back of a length; Vaibhav Sooryavanshi plays it late; chopping it towards square third man for a boundary. Adjusted late to chop that away,2026-05-04 13:32:58.707153
16_RRvsRCB,May 04,13:29:25,Barsapara Cricket Stadium,3,4,Josh Hazlewood,Vaibhav Sooryavanshi,FOUR,more runs! On a length around middle and leg; Vaibhav Sooryavanshi stands tall and tonks it over mid-on. On the bounce and over the fence for four runs,2026-05-04 13:32:58.707258
16_RRvsRCB,May 04,13:29:25,Barsapara Cricket Stadium,3,5,Josh Hazlewood,Vaibhav Sooryavanshi,FOUR,make that a hat-trick of boundaries. This was pitched up by the bowler and Vaibhav Sooryavanshi creams it through covers for the third boundary in as many deliveries. When was the last time you saw Josh Hazlewood being treated like that,2026-05-04 13:32:58.707364
16_RRvsRCB,May 04,13:29:25,Barsapara Cricket Stadium,3,6,Josh Hazlewood,Vaibhav Sooryavanshi,SIX,19 runs from that Josh Hazlewood over! A short ball to end the over as Vaibhav Sooryavanshi pulls it over deep square leg for half-a-dozen. Josh Hazlewood look skywards and starts walking back,2026-05-04 13:32:58.707471
16_RRvsRCB,May 04,13:29:25,Barsapara Cricket Stadium,4,1,Bhuvneshwar Kumar,Dhruv Jurel,1 run,driven towards mid-off by Dhruv Jurel for a single,2026-05-04 13:32:58.707684
16_RRvsRCB,May 04,13:29:25,Barsapara Cricket Stadium,4,2,Bhuvneshwar Kumar,Vaibhav Sooryavanshi,SIX,ain't going to spare anyone! Back of a length around off; Vaibhav Sooryavanshi rocks back in the crease and thumps it over wide long-on for a 80m six. RCB bowlers have no answers to this onslaught,2026-05-04 13:32:58.707892
16_RRvsRCB,May 04,13:29:25,Barsapara Cricket Stadium,4,3,Bhuvneshwar Kumar,Vaibhav Sooryavanshi,SIX,fifty off 15 balls! What a rollicking knock this has been. He goes for a pull and gets a top edge towards fine leg. Salt in the deep takes the catch; but he overhauls the boundary eventually. The RR dugout is on its feet; giving him a standing ovation. Jurel gives him a hug,2026-05-04 13:32:58.708034
16_RRvsRCB,May 04,13:29:25,Barsapara Cricket Stadium,4,4,Bhuvneshwar Kumar,Vaibhav Sooryavanshi,no run,on the fuller side as Vaibhav Sooryavanshi squeezes it towards mid-off,2026-05-04 13:32:58.708141
16_RRvsRCB,May 04,13:29:25,Barsapara Cricket Stadium,4,5,Bhuvneshwar Kumar,Vaibhav Sooryavanshi,no run,a length delivery around middle and leg; Vaibhav Sooryavanshi knocks it down the pitch,2026-05-04 13:32:58.708242
16_RRvsRCB,May 04,13:29:25,Barsapara Cricket Stadium,4,6,Bhuvneshwar Kumar,Vaibhav Sooryavanshi,FOUR,50-run stand up! RR have raced away to 73/1 in 5 overs. This was a short ball outside off and Vaibhav Sooryavanshi slashed it over backward point to end the 5th over with a boundary again. So difficult to contain him. He can play shots all across the park,2026-05-04 13:32:58.708352
16_RRvsRCB,May 04,13:29:25,Barsapara Cricket Stadium,5,1,Abhinandan Singh,Dhruv Jurel,FOUR,runs continue to flow. Back of a length delivery around middle and leg; Dhruv Jurel swings early and gets an inside edge towards the fine leg fence. There was a fielder; but inside the circle; nothing much he could do about it,2026-05-04 13:32:58.708464
16_RRvsRCB,May 04,13:29:25,Barsapara Cricket Stadium,5,2,Abhinandan Singh,Dhruv Jurel,SIX,proper shot. Right into the slot; it's a length delivery and Dhruv Jurel picks the bones out of it. Stands tall and pummels it over wide long-on for a flat six,2026-05-04 13:32:58.708576
16_RRvsRCB,May 04,13:29:25,Barsapara Cricket Stadium,5,3,Abhinandan Singh,Dhruv Jurel,FOUR,they're making the most of the powerplay. Back of a length delivery outside off; Dhruv Jurel plays it late; carving this through the gap between backward point and short third man,2026-05-04 13:32:58.708720
16_RRvsRCB,May 04,13:29:25,Barsapara Cricket Stadium,5,4,Abhinandan Singh,Dhruv Jurel,no run,some relief for RCB. A rare dot ball. Was a length ball that was driven to the fielder at cover,2026-05-04 13:32:58.708844
16_RRvsRCB,May 04,13:29:25,Barsapara Cricket Stadium,5,5,Abhinandan Singh,Dhruv Jurel,SIX,that was a gift of a delivery by Abhinandan Singh. Juicy full toss on leg; Dhruv Jurel accepts the full toss with both arms and flicks it over fine leg for a nonchalant six. RR into the 90s already,2026-05-04 13:32:58.708948
16_RRvsRCB,May 04,13:29:25,Barsapara Cricket Stadium,5,6,Abhinandan Singh,Dhruv Jurel,FOUR,make that 97 off the powerplay! RCB need a break; reckons Ian Bishop on air. This was a back of a length delivery around middle and leg; Dhruv Jurel drags it through the leg-side and bisects a couple of fielders converging across in the deep,2026-05-04 13:32:58.709055
16_RRvsRCB,May 04,13:29:25,Barsapara Cricket Stadium,6,1,Krunal Pandya,Vaibhav Sooryavanshi,1 run,flatter around middle and leg; nudged through mid-wicket for a single,2026-05-04 13:32:58.709157
16_RRvsRCB,May 04,13:29:25,Barsapara Cricket Stadium,6,2,Krunal Pandya,Dhruv Jurel,FOUR,short and punished! Rocks back in the crease and hammers this short ball over mid-wicket. Away to the fence in a jiffy; more runs for RR. 100 up for them,2026-05-04 13:32:58.709263
16_RRvsRCB,May 04,13:29:25,Barsapara Cricket Stadium,6,3,Krunal Pandya,Dhruv Jurel,1 run,knocked to long-on for one,2026-05-04 13:32:58.709364
16_RRvsRCB,May 04,13:29:25,Barsapara Cricket Stadium,6,4,Krunal Pandya,Vaibhav Sooryavanshi,1 run,drifting on the pads; worked through mid-wicket for a single,2026-05-04 13:32:58.709464
16_RRvsRCB,May 04,13:29:25,Barsapara Cricket Stadium,6,5,Krunal Pandya,Dhruv Jurel,1 run,on the pads; Dhruv Jurel works it through the on-side for one,2026-05-04 13:32:58.709567
16_RRvsRCB,May 04,13:29:25,Barsapara Cricket Stadium,6,6,Krunal Pandya,Vaibhav Sooryavanshi,SIX,111 off 7 overs! Unbelievable hitting. This was on the batter's pads and Vaibhav Sooryavanshi flicked it over deep square leg for a towering six. Krunal Pandya getting belted as well,2026-05-04 13:32:58.709713
16_RRvsRCB,May 04,13:29:25,Barsapara Cricket Stadium,7,1,Tim David,Dhruv Jurel,FOUR,no stopping this pair. This was fraction short outside off; Dhruv Jurel rocks back in the crease and cuts it through backward point. Manages to beat the fielder in the deep comfortably,2026-05-04 13:32:58.709820
16_RRvsRCB,May 04,13:29:25,Barsapara Cricket Stadium,7,2,Tim David,Dhruv Jurel,1 run,on the pads; Dhruv Jurel clips it through mid-wicket,2026-05-04 13:32:58.709921
16_RRvsRCB,May 04,13:29:25,Barsapara Cricket Stadium,7,3,Tim David,Vaibhav Sooryavanshi,no run,pushed back to the bowler by Vaibhav Sooryavanshi,2026-05-04 13:32:58.710020
16_RRvsRCB,May 04,13:29:25,Barsapara Cricket Stadium,7,4,Tim David,Vaibhav Sooryavanshi,SIX,100-run stand up! This was on the shorter side; Vaibhav Sooryavanshi rocks back and pulls it over deep mid-wicket and just manages to clear the fielders,2026-05-04 13:32:58.710125
16_RRvsRCB,May 04,13:29:25,Barsapara Cricket Stadium,7,5,Tim David,Vaibhav Sooryavanshi,SIX,loss of words. This is carnage. Was on the pads and Vaibhav Sooryavanshi flicked it over deep mid-wicket for yet another six,2026-05-04 13:32:58.710228
16_RRvsRCB,May 04,13:29:25,Barsapara Cricket Stadium,7,6,Tim David,Vaibhav Sooryavanshi,1 run,flatter through the air as Vaibhav Sooryavanshi knocks it to long-on for one. 18 runs from the over,2026-05-04 13:32:58.710330
16_RRvsRCB,May 04,13:29:25,Barsapara Cricket Stadium,8,1,Krunal Pandya,Vaibhav Sooryavanshi,out Caught by Virat Kohli!! End of a prolific knock by Vaibhav Sooryavanshi. This was tad short and Vaibhav Sooryavanshi flat-bats this towards long-on. Kohli in the deep takes a good low catch and the young opener misses out a well-deserved century. Has got the required run rate down to run-a-ball almost. He walks back to a standing ovation from the spectators and his teammates in the dugout welcome him with a standing ovation too. RR need only 73 runs more off 71 balls. Vaibhav Sooryavanshi c Virat Kohli b Krunal Pandya 78(26) [4s-8 6s-7],out Caught by Virat Kohli!! End of a prolific knock by Vaibhav Sooryavanshi. This was tad short and Vaibhav Sooryavanshi flat-bats this towards long-on. Kohli in the deep takes a good low catch and the young opener misses out a well-deserved century. Has got the required run rate down to run-a-ball almost. He walks back to a standing ovation from the spectators and his teammates in the dugout welcome him with a standing ovation too. RR need only 73 runs more off 71 balls. Vaibhav Sooryavanshi c Virat Kohli b Krunal Pandya 78(26) [4s-8 6s-7],2026-05-04 13:32:58.710439
16_RRvsRCB,May 04,13:29:25,Barsapara Cricket Stadium,8,2,Krunal Pandya,Shimron Hetmyer,out Caught by Josh Hazlewood!! Two in two for Krunal Pandya. He's on a hat-trick. A slower bouncer by Krunal Pandya outside off and Shimron Hetmyer guides it straight to the fielder at short third man. Shimron Hetmyer has a sorry look on his face. He tries to hide it with a smile. Shimron Hetmyer c Josh Hazlewood b Krunal Pandya 0(1),out Caught by Josh Hazlewood!! Two in two for Krunal Pandya. He's on a hat-trick. A slower bouncer by Krunal Pandya outside off and Shimron Hetmyer guides it straight to the fielder at short third man. Shimron Hetmyer has a sorry look on his face. He tries to hide it with a smile. Shimron Hetmyer c Josh Hazlewood b Krunal Pandya 0(1),2026-05-04 13:32:58.710552
16_RRvsRCB,May 04,13:29:25,Barsapara Cricket Stadium,8,3,Krunal Pandya,Riyan Parag,1 run,flatter through the air on off; knocked to long-off for one,2026-05-04 13:32:58.710679
16_RRvsRCB,May 04,13:29:25,Barsapara Cricket Stadium,8,4,Krunal Pandya,Dhruv Jurel,1 run,length delivery at the stumps; pushed to long-off for one,2026-05-04 13:32:58.710799
16_RRvsRCB,May 04,13:29:25,Barsapara Cricket Stadium,8,5,Krunal Pandya,Riyan Parag,no run,a lot slower through the air; Riyan Parag defends it,2026-05-04 13:32:58.710925
16_RRvsRCB,May 04,13:29:25,Barsapara Cricket Stadium,8,6,Krunal Pandya,Riyan Parag,1 run,on the pads; clipped towards the leg-side for one,2026-05-04 13:32:58.711026
16_RRvsRCB,May 04,13:29:25,Barsapara Cricket Stadium,9,1,Josh Hazlewood,Riyan Parag,1 run,short of length on off; Riyan Parag goes on the back foot and defends to the mid-on region; easy single as short mid-wicket tries to go to his left and cut it off,2026-05-04 13:32:58.711129
16_RRvsRCB,May 04,13:29:25,Barsapara Cricket Stadium,9,2,Josh Hazlewood,Dhruv Jurel,no run,short of length and skids on to middle; Dhruv Jurel goes on the back foot to pull and misses; looks like he is hit on the box. Crouches low and takes time out. A break in play,2026-05-04 13:32:58.711229
16_RRvsRCB,May 04,13:29:25,Barsapara Cricket Stadium,9,3,Josh Hazlewood,Dhruv Jurel,1 run,short of length on the stumps; Dhruv Jurel goes on the back foot and pulls to deep square-leg,2026-05-04 13:32:58.711329
16_RRvsRCB,May 04,13:29:25,Barsapara Cricket Stadium,9,4,Josh Hazlewood,Riyan Parag,out Caught by Krunal Pandya!! Another one and RCB are fighting back. It's a short of length delivery on off,Parag gets forward to loft; lots of bottom-hand but no elevation; good catch as Krunal goes to his right at long-on and takes it well before tumbling. Was the cross-seamer and Hazlewood is all smiles. Riyan Parag c Krunal Pandya b Josh Hazlewood 3(5),2026-05-04 13:32:58.711489
16_RRvsRCB,May 04,13:29:25,Barsapara Cricket Stadium,9,5,Josh Hazlewood,Ravindra Jadeja,2 runs,short of length just outside off; Ravindra Jadeja goes on the back foot and tucks to deep mid-wicket; placed in front of the fielder and they come back for a quick two,2026-05-04 13:32:58.711593
16_RRvsRCB,May 04,13:29:25,Barsapara Cricket Stadium,9,6,Josh Hazlewood,Ravindra Jadeja,1 run,short of length on off; Ravindra Jadeja goes on the back foot and punches it down to long-on,2026-05-04 13:32:58.711734
16_RRvsRCB,May 04,13:29:25,Barsapara Cricket Stadium,10,1,Krunal Pandya,Ravindra Jadeja,2 runs,tossed up full just outside off; Ravindra Jadeja gets low and paddles it fine to fine-leg for two,2026-05-04 13:32:58.711837
16_RRvsRCB,May 04,13:29:25,Barsapara Cricket Stadium,10,2,Krunal Pandya,Ravindra Jadeja,no run,that's the bouncer which surprises everyone. Ravindra Jadeja is quick to go down. Wants a wide; but called as one short delivery for the over,2026-05-04 13:32:58.711942
16_RRvsRCB,May 04,13:29:25,Barsapara Cricket Stadium,10,3,Krunal Pandya,Ravindra Jadeja,no run,another bouncer and again Ravindra Jadeja ducks; called as the second short delivery of the over,2026-05-04 13:32:58.712046
16_RRvsRCB,May 04,13:29:25,Barsapara Cricket Stadium,10,4,Krunal Pandya,Ravindra Jadeja,1 run,tossed up full on middle; Ravindra Jadeja gets forward to drive to the left of Krunal Pandya who dives and parries it wide of short mid-wicket; they steal a quick single,2026-05-04 13:32:58.712148
16_RRvsRCB,May 04,13:29:25,Barsapara Cricket Stadium,10,5,Krunal Pandya,Dhruv Jurel,no run,the arm-ball and Krunal Pandya has his hands on his head. Because Dhruv Jurel went back to this middle-stump delivery and tried to cut; did well to get bat and avoid the pad; finds backward point,2026-05-04 13:32:58.712249
16_RRvsRCB,May 04,13:29:25,Barsapara Cricket Stadium,10,6,Krunal Pandya,Dhruv Jurel,1 run,flat back of a length around off; Dhruv Jurel goes on the back foot and pulls to deep mid-wicket,2026-05-04 13:32:58.712351
16_RRvsRCB,May 04,13:29:25,Barsapara Cricket Stadium,11,1,Bhuvneshwar Kumar,Dhruv Jurel,1 run,short of length on off; Dhruv Jurel goes on the back foot and high-elbows the punch to long-on,2026-05-04 13:32:58.712451
16_RRvsRCB,May 04,13:29:25,Barsapara Cricket Stadium,11,2,Bhuvneshwar Kumar,Ravindra Jadeja,no run,short of length just outside off; Ravindra Jadeja goes on the back foot and punches it back to Bhuvneshwar Kumar; off the thick inside half,2026-05-04 13:32:58.712551
16_RRvsRCB,May 04,13:29:25,Barsapara Cricket Stadium,11,3,Bhuvneshwar Kumar,Ravindra Jadeja,no run,short of length and tight on off; Ravindra Jadeja goes on the back foot and high-elbows the punch; finds Bhuvneshwar Kumar,2026-05-04 13:32:58.712682
16_RRvsRCB,May 04,13:29:25,Barsapara Cricket Stadium,11,4,Bhuvneshwar Kumar,Ravindra Jadeja,2 runs,good length on middle and leg; Ravindra Jadeja goes on the back foot and tucks it wide of deep mid-wicket; they come back for two,2026-05-04 13:32:58.712797
16_RRvsRCB,May 04,13:29:25,Barsapara Cricket Stadium,11,5,Bhuvneshwar Kumar,Ravindra Jadeja,no run,short of length and rising on off; Ravindra Jadeja goes on the back foot and wrists it straight to the fielder at mid-wicket,2026-05-04 13:32:58.712898
