match,date,time,venue,over,ball,bowler,batsman,ball_event,event_info,extract_time
42_GTvsRCB,May 04,16:33:57,Narendra Modi Stadium,10,1,Romario Shepherd,Shahrukh Khan,out Caught by Josh Hazlewood!! Fat top-edge and Hazlewood at fine-leg takes a good catch. It's a short of length delivery outside off,Shahrukh Khan goes on the back foot to pull; but the top-edge flies and Hazlewood sinks on one knee and dives forward to take it with two hands. Almost misjudged that but took it well. RCB keep themselves in it with wickets. Shahrukh Khan c Josh Hazlewood b Romario Shepherd 8(8) [4s-1],2026-05-04 16:39:37.991420
42_GTvsRCB,May 04,16:33:57,Narendra Modi Stadium,10,2,Romario Shepherd,Rahul Tewatia,wide,short and too short on the stumps; Rahul Tewatia lets it go and takes the wide,2026-05-04 16:39:37.992190
42_GTvsRCB,May 04,16:33:57,Narendra Modi Stadium,10,2,Romario Shepherd,Rahul Tewatia,1 run,short of length on middle; Rahul Tewatia goes on the back foot and turns it to the vacant forward short-leg area,2026-05-04 16:39:37.993068
42_GTvsRCB,May 04,16:33:57,Narendra Modi Stadium,10,3,Romario Shepherd,Washington Sundar,out Lbw!! Even the normally "placid" Bhuvi roars once he sees the big screen. That's what this means to RCB. And Kohli is punching the air and roaring as usual. It's a length delivery and on off,Washington Sundar gets forward to drive and misses; hit on the back leg. No bat as UltraEdge shows and it's three reds. Romario Shepherd was almost pleading with KN Anantha Padmanabhan to give it who stayed calm. Kohli and Jitesh Sharma convinced Patidar to take the review and it has worked. That was plumb. Wondwer why the ump didn't give it. RCB know they have a good chance now even though GT have batting left still. Washington Sundar lbw b Romario Shepherd 12(12) [6s-1],2026-05-04 16:39:37.994198
42_GTvsRCB,May 04,16:33:57,Narendra Modi Stadium,10,4,Romario Shepherd,Jason Holder,SIX,the battle between the Guyanese and the Barbadian and it's the latter who lands the first blow. It's a short delivery at the tall Jason Holder who shuffles across slightly and hooks; Hazlewood was there; but it sails over his head. That was well-hit,2026-05-04 16:39:37.995473
42_GTvsRCB,May 04,16:33:57,Narendra Modi Stadium,10,5,Romario Shepherd,Jason Holder,1 run,length delivery outside off; Jason Holder gets forward and opens the face of the bat to guide it to third man. At the end; the two West Indians have a chat and a big smile from Romario Shepherd,2026-05-04 16:39:37.996215
42_GTvsRCB,May 04,16:33:57,Narendra Modi Stadium,10,6,Romario Shepherd,Rahul Tewatia,FOUR,full and down leg; Rahul Tewatia glances as he gets forward and plays it fine. Runs away to the fine-leg fence. Kohli is not happy with that delivery. Curses under his breath,2026-05-04 16:39:37.996931
42_GTvsRCB,May 04,16:33:57,Narendra Modi Stadium,11,1,Suyash Sharma,Jason Holder,1 run,full on middle; Jason Holder gets forward to drive to long-on,2026-05-04 16:39:37.998174
42_GTvsRCB,May 04,16:33:57,Narendra Modi Stadium,11,2,Suyash Sharma,Rahul Tewatia,no run,a slip waits. It's tossed up full outside off; Rahul Tewatia gets forward to defend to the left of slip. Wants a quick single; but Jason Holder is not interested,2026-05-04 16:39:38.001188
42_GTvsRCB,May 04,16:33:57,Narendra Modi Stadium,11,3,Suyash Sharma,Rahul Tewatia,no run,missing off and Patidar knows it. Was the tossed up googly; full and it's spinning away from off; Rahul Tewatia sinks low to sweep and misses. He's rapped on the pads,2026-05-04 16:39:38.004107
42_GTvsRCB,May 04,16:33:57,Narendra Modi Stadium,11,4,Suyash Sharma,Rahul Tewatia,FOUR,short and down leg; Rahul Tewatia has it easy; he goes on the back foot and pulls flat to the deep square-leg fence. Suyash Sharma with one or two local expletives as he is not happy with himself,2026-05-04 16:39:38.017933
42_GTvsRCB,May 04,16:33:57,Narendra Modi Stadium,11,5,Suyash Sharma,Rahul Tewatia,FOUR,that's risky but Rahul Tewatia has got bat on that. Premeditated and the reverse-sweep works. Turns around and takes it from middle-stump; hits it wide of backward point; to his right; no dive and the ball runs away,2026-05-04 16:39:38.024232
42_GTvsRCB,May 04,16:33:57,Narendra Modi Stadium,11,6,Suyash Sharma,Rahul Tewatia,1 run,Suyash Sharma round the wicket. It's flat and short outside off; Rahul Tewatia goes on the back foot and cuts to deep point,2026-05-04 16:39:38.026157
42_GTvsRCB,May 04,16:33:57,Narendra Modi Stadium,12,1,Romario Shepherd,Rahul Tewatia,1 run,full outside off; Rahul Tewatia gets forward to drive; the thick inside-edge runs away well wide of leg-stump; that could've gone so easily back on,2026-05-04 16:39:38.027241
42_GTvsRCB,May 04,16:33:57,Narendra Modi Stadium,12,2,Romario Shepherd,Jason Holder,no run,good inswinging yorker on middle; Jason Holder gets forward to dig it out,2026-05-04 16:39:38.027843
42_GTvsRCB,May 04,16:33:57,Narendra Modi Stadium,12,3,Romario Shepherd,Jason Holder,1 run,low full-toss and angling into the right-hander on middle; Jason Holder gets forward and shows the full face of the bat to drive to long-on,2026-05-04 16:39:38.028401
42_GTvsRCB,May 04,16:33:57,Narendra Modi Stadium,12,4,Romario Shepherd,Rahul Tewatia,1 run,short of length outside off; Rahul Tewatia goes on the back foot and cuts to sweeper cover,2026-05-04 16:39:38.028987
42_GTvsRCB,May 04,16:33:57,Narendra Modi Stadium,12,5,Romario Shepherd,Jason Holder,no run,short outside off; Jason Holder goes on the back foot and pulls; misses; flies over the bat,2026-05-04 16:39:38.030042
42_GTvsRCB,May 04,16:33:57,Narendra Modi Stadium,12,6,Romario Shepherd,Jason Holder,2 runs,short outside off; Jason Holder goes on the back foot and pulls; was in the air but wide of the dive of mid-wicket. To his right. They take an easy two,2026-05-04 16:39:38.035177
42_GTvsRCB,May 04,16:33:57,Narendra Modi Stadium,13,1,Suyash Sharma,Rahul Tewatia,1 run,flat back of a length on off; Rahul Tewatia goes on the back foot and nudges it to the vacant mid-wicket area,2026-05-04 16:39:38.036022
42_GTvsRCB,May 04,16:33:57,Narendra Modi Stadium,13,2,Suyash Sharma,Jason Holder,no run,tossed up googly on a good length on off; Jason Holder gets forward to defend to the right of Suyash Sharma,2026-05-04 16:39:38.036780
42_GTvsRCB,May 04,16:33:57,Narendra Modi Stadium,13,3,Suyash Sharma,Jason Holder,1 run,tossed up full on off; turns a bit; quicker; Jason Holder gets forward to push; the thick outside-edge rolls away to short third man; they take a quick single,2026-05-04 16:39:38.037385
42_GTvsRCB,May 04,16:33:57,Narendra Modi Stadium,13,4,Suyash Sharma,Rahul Tewatia,wide,Jitesh Sharma looks at his right thumb. It's a flat delivery down leg; Rahul Tewatia wants to sweep that away; misses and Jitesh can't glove it. Did Tewatia's bat hit Jitesh?,2026-05-04 16:39:38.038185
42_GTvsRCB,May 04,16:33:57,Narendra Modi Stadium,13,4,Suyash Sharma,Rahul Tewatia,1 run,on a length outside off; drop and run to the point region,2026-05-04 16:39:38.038868
42_GTvsRCB,May 04,16:33:57,Narendra Modi Stadium,13,5,Suyash Sharma,Jason Holder,out Caught by Devdutt Padikkal at deep mid-wicket!! Jason Holder holes out in trying for the big hit. It's a tossed up googly on middle,Holder uses his long reach to get forward and heave; but doesn't have the elevation and picks out Padikkal to perfection. He didn't have to move an inch. Jason Holder c Devdutt Padikkal b Suyash Sharma 12(10) [6s-1],2026-05-04 16:39:38.040039
42_GTvsRCB,May 04,16:33:57,Narendra Modi Stadium,13,6,Suyash Sharma,Rashid Khan,no run,nicely tossed up googly; spins into off and middle; Rashid Khan gets forward to defend and the thick inside-edge hits the pad and stays near his feet,2026-05-04 16:39:38.040663
42_GTvsRCB,May 04,16:33:57,Narendra Modi Stadium,14,1,Romario Shepherd,Rahul Tewatia,wide,dug in short and wide signalled by Adrian Holdstock. RCB can't believe that and Patidar reviews. Rahul Tewatia lets it go and is it over the head? Yes it is. RCB will lose this. They are waiting to check the ball-tracking on this. Tewatia's head is 1.75m and the ball is at 1.79m. Good call from Holdstock from square-leg,2026-05-04 16:39:38.041315
42_GTvsRCB,May 04,16:33:57,Narendra Modi Stadium,14,1,Romario Shepherd,Rahul Tewatia,no run,good length and tight on off; Rahul Tewatia gets forward to defend to backward point. No run there,2026-05-04 16:39:38.042132
42_GTvsRCB,May 04,16:33:57,Narendra Modi Stadium,14,2,Romario Shepherd,Rahul Tewatia,1 run,short of length just outside off; Rahul Tewatia goes on the back foot and opens the face of the bat to guide it to third man,2026-05-04 16:39:38.046297
42_GTvsRCB,May 04,16:33:57,Narendra Modi Stadium,14,3,Romario Shepherd,Rashid Khan,1 run,full on off; Rashid Khan gets forward to drive to mid-off. They take a quick single,2026-05-04 16:39:38.049406
42_GTvsRCB,May 04,16:33:57,Narendra Modi Stadium,14,4,Romario Shepherd,Rahul Tewatia,1 run,Romario Shepherd round the wicket. It's a short of length and angling into the left-hander on off; gently nudged to the vacant square-leg off the back foot,2026-05-04 16:39:38.051047
42_GTvsRCB,May 04,16:33:57,Narendra Modi Stadium,14,5,Romario Shepherd,Rashid Khan,no run,tight length delivery just outside off; Rashid Khan goes on the back foot and high-elbows the punch back to Romario Shepherd,2026-05-04 16:39:38.052763
42_GTvsRCB,May 04,16:33:57,Narendra Modi Stadium,14,6,Romario Shepherd,Rashid Khan,no run,short on the stumps; Rashid Khan ducks and lets it go,2026-05-04 16:39:38.054806
42_GTvsRCB,May 04,16:33:57,Narendra Modi Stadium,15,1,Suyash Sharma,Rahul Tewatia,FOUR,tossed up and full outside off; the off-side field is up. Easy for Rahul Tewatia; he gets forward and lofts over extra-cover; runs away,2026-05-04 16:39:38.055900
42_GTvsRCB,May 04,16:33:57,Narendra Modi Stadium,15,2,Suyash Sharma,Rahul Tewatia,2 runs,flat good length and quicker outside off; Rahul Tewatia goes on the back foot and cuts wide of deep point; David runs across and cuts it off to his right,2026-05-04 16:39:38.058453
42_GTvsRCB,May 04,16:33:57,Narendra Modi Stadium,15,3,Suyash Sharma,Rahul Tewatia,1 run,flat back of a length on middle; still quick; Rahul Tewatia goes on the back foot and pulls to deep backward square-leg,2026-05-04 16:39:38.060805
42_GTvsRCB,May 04,16:33:57,Narendra Modi Stadium,15,4,Suyash Sharma,Rashid Khan,2 runs,tossed up full outside off; Rashid Khan gets low and sweeps; Shepherd at square-leg dives to his left and gets a hand on it; prevents the four. David runs across and cuts it off from deep mid-wicket,2026-05-04 16:39:38.061628
42_GTvsRCB,May 04,16:33:57,Narendra Modi Stadium,15,5,Suyash Sharma,Rashid Khan,FOUR,Rashid Khan ends this. It's a flat length delivery outside off; he comes down the track and even though he is not to the pitch of the ball; he flat-bats that and it's one bounce over the ropes at deep extra-cover. A big hug and smile from Kohli to Rashid,2026-05-04 16:39:38.062263
