match,date,time,venue,over,ball,bowler,batsman,ball_event,event_info,extract_time
42_GTvsRCB,May 04,16:33:57,Narendra Modi Stadium,0,1,Mohammed Siraj,Jacob Bethell,no run,short of a length around off; shaping away from the batter; Jacob Bethell has a poke at it; gets beaten due to the movement,2026-05-04 16:39:37.789263
42_GTvsRCB,May 04,16:33:57,Narendra Modi Stadium,0,2,Mohammed Siraj,Jacob Bethell,1 run,on the shorter side outside off; Jacob Bethell rides the bounce; steering it away for the first run of the match,2026-05-04 16:39:37.792145
42_GTvsRCB,May 04,16:33:57,Narendra Modi Stadium,0,3,Mohammed Siraj,Virat Kohli,no run,that's a lovely delivery by Mohammed Siraj; outside off and shaping away from the batter; Virat Kohli has a poke and gets beaten,2026-05-04 16:39:37.792862
42_GTvsRCB,May 04,16:33:57,Narendra Modi Stadium,0,4,Mohammed Siraj,Virat Kohli,1 run,almost chopped on. Back of a length delivery around off; shapes in slightly as Virat Kohli plays it with soft hands. The ball almost ricochets onto the stumps. They take a single by the time the keeper moves forward to gather it,2026-05-04 16:39:37.793297
42_GTvsRCB,May 04,16:33:57,Narendra Modi Stadium,0,5,Mohammed Siraj,Jacob Bethell,no run,drifting on the pads; it's a length delivery that Jacob Bethell clips towards mid-wicket,2026-05-04 16:39:37.793707
42_GTvsRCB,May 04,16:33:57,Narendra Modi Stadium,0,6,Mohammed Siraj,Jacob Bethell,FOUR,first boundary of the match! Short and wide outside off; Jacob Bethell throws the kitchen sink at it; slashing it away to the deep backward point boundary. No chance of stopping that as the fielder at third man was pretty fine. A decent over by Mohammed Siraj; barring this boundary ball,2026-05-04 16:39:37.794093
42_GTvsRCB,May 04,16:33:57,Narendra Modi Stadium,1,1,Kagiso Rabada,Virat Kohli,FOUR,short and punished! Virat Kohli into the act now. This was on the shorter side; Virat Kohli pulls it over mid-wicket for a boundary. Kagiso Rabada being greeted with a boundary,2026-05-04 16:39:37.794575
42_GTvsRCB,May 04,16:33:57,Narendra Modi Stadium,1,2,Kagiso Rabada,Virat Kohli,FOUR,back-to-back boundaries! Back of a length delivery around off; Virat Kohli plays it on the rise; lofting it over wide mid-off. Clears the infield comfortably and that's four more,2026-05-04 16:39:37.795112
42_GTvsRCB,May 04,16:33:57,Narendra Modi Stadium,1,3,Kagiso Rabada,Virat Kohli,FOUR,hat-trick of boundaries! Virat Kohli on the charge. Short of a length delivery outside off; Virat Kohli plays it late; carving this away to the deep point fence,2026-05-04 16:39:37.795630
42_GTvsRCB,May 04,16:33:57,Narendra Modi Stadium,1,4,Kagiso Rabada,Virat Kohli,FOUR,4;4;4;4. Now towards the left side of the fielder at square third man. Back of a length delivery outside off; Virat Kohli carves it away to the fence once again. The fielder in the deep couldn't do much about it,2026-05-04 16:39:37.796260
42_GTvsRCB,May 04,16:33:57,Narendra Modi Stadium,1,5,Kagiso Rabada,Virat Kohli,FOUR,make that five in a row. All class. This was pitched up by the bowler outside off and Virat Kohli creamed it through covers for the 5th consecutive boundary. Kagiso Rabada has been among the wickets this season; but Kohli has absolutely torn him apart in his 1st over itself,2026-05-04 16:39:37.796787
42_GTvsRCB,May 04,16:33:57,Narendra Modi Stadium,1,6,Kagiso Rabada,Virat Kohli,1 run,pitched up by the bowler as Virat Kohli drives it right down the pitch; as Kagiso Rabada gets his shoe to it; deflecting it away towards mid-on,2026-05-04 16:39:37.797272
42_GTvsRCB,May 04,16:33:57,Narendra Modi Stadium,2,1,Mohammed Siraj,Virat Kohli,no run,back of a length around middle and leg; keeps a touch low; Virat Kohli looks to nudge it away; gets an inside edge onto the pads. That inside edge has saved him; else it looked an lbw dismissal,2026-05-04 16:39:37.797878
42_GTvsRCB,May 04,16:33:57,Narendra Modi Stadium,2,2,Mohammed Siraj,Virat Kohli,SIX,more runs for Virat Kohli! He advances down the wicket and tonks the length delivery over long-on for the first maximum of the evening. RCB; RCB chants all across the Narendra Modi Stadium,2026-05-04 16:39:37.798440
42_GTvsRCB,May 04,16:33:57,Narendra Modi Stadium,2,3,Mohammed Siraj,Virat Kohli,leg byes,1 run; fired on leg; it's a length delivery; Virat Kohli looks to whip it away; gets hit on the pads though. A leg bye taken,2026-05-04 16:39:37.798997
42_GTvsRCB,May 04,16:33:57,Narendra Modi Stadium,2,4,Mohammed Siraj,Jacob Bethell,out Caught by Rashid Khan!! Mohammed Siraj draws first blood. Runs were coming thick and fast,but Mohammed Siraj takes a wicket. That was a pretty soft dismissal though. Was a length delivery on middle and leg; Jacob Bethell flicks it straight to the man at mid-wicket. Rashid Khan takes a safe catch; and the left-handed opener is going without making an impact. Think Bethell was dismissed by Siraj in the reverse fixture at the Chinnaswamy too. Jacob Bethell c Rashid Khan b Mohammed Siraj 5(5) [4s-1],2026-05-04 16:39:37.799501
42_GTvsRCB,May 04,16:33:57,Narendra Modi Stadium,2,5,Mohammed Siraj,Devdutt Padikkal,no run,short and wide outside off; some extra bounce; Devdutt Padikkal looks to cut it on the rise; gets beaten due to the bounce though. Good amount of carry,2026-05-04 16:39:37.800051
42_GTvsRCB,May 04,16:33:57,Narendra Modi Stadium,2,6,Mohammed Siraj,Devdutt Padikkal,no run,fraction short around off; Devdutt Padikkal plays it on the up; knocking it towards mid-off,2026-05-04 16:39:37.800549
42_GTvsRCB,May 04,16:33:57,Narendra Modi Stadium,3,1,Kagiso Rabada,Virat Kohli,wide,not a great line as Kagiso Rabada sprays it down the leg-side. A gentle glance would have fetched Virat Kohli a boundary; but he fails to make contact,2026-05-04 16:39:37.801199
42_GTvsRCB,May 04,16:33:57,Narendra Modi Stadium,3,1,Kagiso Rabada,Virat Kohli,no run,good length delivery that skids along the deck; Virat Kohli looks to defend; gets an inside edge onto the pads,2026-05-04 16:39:37.801804
42_GTvsRCB,May 04,16:33:57,Narendra Modi Stadium,3,2,Kagiso Rabada,Virat Kohli,out Caught by Rashid Khan!! Kagiso Rabada has the last laugh! After conceding five boundaries in his 1st over,Kagiso Rabada roars back in style. He looks animated as soon as Rashid Khan takes this catch. That's the quality he has. Didn't get bogged down despite VK taking him on. This was a short and quick delivery around middle and leg; Virat Kohli gets hurried up due to the pace and bounce as he advances down the wicket. Loses his shape while playing this across the line and the top edge has been taken by the fielder at mid-wicket. Gives the batsman as a stare on his way back to the pavilion. Virat Kohli c Rashid Khan b Kagiso Rabada 28(13) [4s-5 6s-1],2026-05-04 16:39:37.802423
42_GTvsRCB,May 04,16:33:57,Narendra Modi Stadium,3,3,Kagiso Rabada,Rajat Patidar,no run,defended watchfully by Rajat Patidar,2026-05-04 16:39:37.803093
42_GTvsRCB,May 04,16:33:57,Narendra Modi Stadium,3,4,Kagiso Rabada,Rajat Patidar,FOUR,Rajat Patidar is off the mark in style. This was pitched up by the bowler and Rajat Patidar drives it straight past KG. Played it as straight as an arrow and gets going with a boundary,2026-05-04 16:39:37.803879
42_GTvsRCB,May 04,16:33:57,Narendra Modi Stadium,3,5,Kagiso Rabada,Rajat Patidar,no run,drags back his length slightly; Rajat Patidar defends it from within the crease,2026-05-04 16:39:37.804530
42_GTvsRCB,May 04,16:33:57,Narendra Modi Stadium,3,6,Kagiso Rabada,Rajat Patidar,no run,defends it on the rise; knocking it back to the pacer. A much better over by Rabada as compared to the previous one,2026-05-04 16:39:37.805602
42_GTvsRCB,May 04,16:33:57,Narendra Modi Stadium,4,1,Mohammed Siraj,Devdutt Padikkal,no run,on a length around off; Devdutt Padikkal drives it to the fielder at cover,2026-05-04 16:39:37.806187
42_GTvsRCB,May 04,16:33:57,Narendra Modi Stadium,4,2,Mohammed Siraj,Devdutt Padikkal,SIX,smoked over deep mid-wicket! Fraction short; Devdutt Padikkal picks the length early and hoicks it over the deep mid-wicket fence for a 73m maximum. Mohammed Siraj immediately changes his direction after delivering that; starts walking backing to his run-up mark,2026-05-04 16:39:37.806776
42_GTvsRCB,May 04,16:33:57,Narendra Modi Stadium,4,3,Mohammed Siraj,Devdutt Padikkal,FOUR,slashed away! Short in length outside off; Devdutt Padikkal makes room and throws the kitchen sink at it; gets a top edge that flies down to the third man fence,2026-05-04 16:39:37.807290
42_GTvsRCB,May 04,16:33:57,Narendra Modi Stadium,4,4,Mohammed Siraj,Devdutt Padikkal,no run,fraction short outside off; Devdutt Padikkal steers it towards cover-point,2026-05-04 16:39:37.807904
42_GTvsRCB,May 04,16:33:57,Narendra Modi Stadium,4,5,Mohammed Siraj,Devdutt Padikkal,no run,on the shorter side around middle and leg; Devdutt Padikkal advances down the wicket and clips this towards mid-wicket,2026-05-04 16:39:37.808601
42_GTvsRCB,May 04,16:33:57,Narendra Modi Stadium,4,6,Mohammed Siraj,Devdutt Padikkal,FOUR,50 up for RCB! This was short again; Devdutt Padikkal gets hurried up due to the pace; goes for the pull and manages to clear Rashid Khan at mid-wicket. He chases it all the way to the fence and puts in a dive; but can't stop the boundary,2026-05-04 16:39:37.810438
42_GTvsRCB,May 04,16:33:57,Narendra Modi Stadium,5,1,Kagiso Rabada,Rajat Patidar,no run,146 clicks; short and quick outside off; Rajat Patidar looks to cut this on the rise; gets beaten on the outside edge though,2026-05-04 16:39:37.811316
42_GTvsRCB,May 04,16:33:57,Narendra Modi Stadium,5,2,Kagiso Rabada,Rajat Patidar,FOUR,Kagiso Rabada almost with his 2nd wicket. That's a ripper of a delivery. Short and quick around middle; Rajat Patidar had no clue about this one. Ends up getting a top edge towards third man; and manages to beat the fielder who was converging across from third man. Some other day; this would've been a catch,2026-05-04 16:39:37.812172
42_GTvsRCB,May 04,16:33:57,Narendra Modi Stadium,5,3,Kagiso Rabada,Rajat Patidar,no run,steered towards short third man as he opens the bat face to play it,2026-05-04 16:39:37.812789
42_GTvsRCB,May 04,16:33:57,Narendra Modi Stadium,5,4,Kagiso Rabada,Rajat Patidar,no run,defended by the batsman from within the crease,2026-05-04 16:39:37.813396
42_GTvsRCB,May 04,16:33:57,Narendra Modi Stadium,5,5,Kagiso Rabada,Rajat Patidar,1 run,back of a length delivery around off; Rajat Patidar plays it late; steering it to backward point,2026-05-04 16:39:37.814178
42_GTvsRCB,May 04,16:33:57,Narendra Modi Stadium,5,6,Kagiso Rabada,Devdutt Padikkal,1 run,at the batter's hips as Devdutt Padikkal tucks it through square leg for a single,2026-05-04 16:39:37.821153
42_GTvsRCB,May 04,16:33:57,Narendra Modi Stadium,6,1,Jason Holder,Devdutt Padikkal,FOUR,the approach is going to be the same. That shot by Devdutt Padikkal is an evidence. He makes room by moving away and carves this short and wide ball over backward point. No chance of stopping that,2026-05-04 16:39:37.822770
42_GTvsRCB,May 04,16:33:57,Narendra Modi Stadium,6,2,Jason Holder,Devdutt Padikkal,FOUR,more runs! This was a short and wide delivery outside off; Devdutt Padikkal throws his hands at it; punching it powerfully through the off-side. Once again the fielder couldn't do much about it; he had to cover quite some ground,2026-05-04 16:39:37.823511
42_GTvsRCB,May 04,16:33:57,Narendra Modi Stadium,6,3,Jason Holder,Devdutt Padikkal,1 run,better stop by third man. Was fraction short and slow outside off; Devdutt Padikkal steers it soft hands and has to settle for one,2026-05-04 16:39:37.824346
42_GTvsRCB,May 04,16:33:57,Narendra Modi Stadium,6,4,Jason Holder,Rajat Patidar,1 run,short of a length outside off; Rajat Patidar glides it down to third man,2026-05-04 16:39:37.827739
42_GTvsRCB,May 04,16:33:57,Narendra Modi Stadium,6,5,Jason Holder,Devdutt Padikkal,1 run,down the wicket Devdutt Padikkal advances; nudging this through backward square leg,2026-05-04 16:39:37.828949
42_GTvsRCB,May 04,16:33:57,Narendra Modi Stadium,6,6,Jason Holder,Rajat Patidar,1 run,nudged to long-on by Rajat Patidar for a single,2026-05-04 16:39:37.830045
42_GTvsRCB,May 04,16:33:57,Narendra Modi Stadium,7,1,Arshad Khan,Rajat Patidar,SIX,Arshad Khan being greeted with a maximum. He goes short and Rajat Patidar picks the length early; transfers his weight onto the back foot and pulls it over deep mid-wicket for a flat six does the RCB skipper,2026-05-04 16:39:37.835322
42_GTvsRCB,May 04,16:33:57,Narendra Modi Stadium,7,2,Arshad Khan,Rajat Patidar,2 runs,tad short on middle and leg; Rajat Patidar nudges it towards mid-wicket for a couple of runs,2026-05-04 16:39:37.836507
42_GTvsRCB,May 04,16:33:57,Narendra Modi Stadium,7,3,Arshad Khan,Rajat Patidar,no run,short and quick on leg; Rajat Patidar sways away from its line,2026-05-04 16:39:37.839088
42_GTvsRCB,May 04,16:33:57,Narendra Modi Stadium,7,4,Arshad Khan,Rajat Patidar,out Caught by Jason Holder!! That's a fantastic catch by Holder. One of the best of IPL 2026,probably. Was a short ball by Arshad Khan and Rajat Patidar went for a pull; gets a top edge towards deep backward square leg. Holder stationed there charges to his right and takes a fine low catch. Rabada too was charging across to take it; but Holder managed to ignore that. RCB players are having an argument with the umpires. They think Holder wasn't in control of the catch and had touched the turf. But the umpires reckon otherwise. Andy Flower still having a chat with the fourth umpire. Rajat Patidar c Jason Holder b Arshad Khan 19(15) [4s-2 6s-1],2026-05-04 16:39:37.840010
42_GTvsRCB,May 04,16:33:57,Narendra Modi Stadium,7,5,Arshad Khan,Jitesh Sharma,no run,back of a length around off; Jitesh Sharma defends it from within the crease,2026-05-04 16:39:37.840681
42_GTvsRCB,May 04,16:33:57,Narendra Modi Stadium,7,6,Arshad Khan,Jitesh Sharma,1 run,steered towards backward point by Jitesh Sharma for a single,2026-05-04 16:39:37.841150
42_GTvsRCB,May 04,16:33:57,Narendra Modi Stadium,8,1,Jason Holder,Jitesh Sharma,out Caught by Jos Buttler!! Jitesh Sharma's poor run in IPL 2026 continues. Holder into the act again. Took a fabulous catch in the previous over,takes a wicket in this over. And he's absolutely pumped up. This was pitched up by him outside off and the batter was enticed into a drive. A thick outside edge is induced and Buttler behind the wickets completes a well-judged catch moving to his right. They're scoring at a brisk rate; but are losing wickets simultaneously. Jitesh Sharma c Jos Buttler b Jason Holder 1(3),2026-05-04 16:39:37.841713
42_GTvsRCB,May 04,16:33:57,Narendra Modi Stadium,8,2,Jason Holder,Tim David,1 run,on the shorter side outside off; slapped into the off-side by Tim David,2026-05-04 16:39:37.842330
42_GTvsRCB,May 04,16:33:57,Narendra Modi Stadium,8,3,Jason Holder,Devdutt Padikkal,no run,at the hips; nudged towards short fine leg,2026-05-04 16:39:37.842960
42_GTvsRCB,May 04,16:33:57,Narendra Modi Stadium,8,4,Jason Holder,Devdutt Padikkal,1 run,Jason Holder goes short and quick from over the wicket; Devdutt Padikkal slaps it over the bowler; a single taken at long-on,2026-05-04 16:39:37.843681
42_GTvsRCB,May 04,16:33:57,Narendra Modi Stadium,8,5,Jason Holder,Tim David,SIX,brutal! Shot of an absolutely powerful batsman. This was on the shorter side and Tim David muscles it over deep mid-wicket for a flat six. Looks like he was batting somewhere in the nets before coming in,2026-05-04 16:39:37.844396
42_GTvsRCB,May 04,16:33:57,Narendra Modi Stadium,8,6,Jason Holder,Tim David,1 run,tad short outside off; Tim David slaps it through the off-side for a single,2026-05-04 16:39:37.845405
42_GTvsRCB,May 04,16:33:57,Narendra Modi Stadium,9,1,Rashid Khan,Tim David,no run,fraction short outside off; Tim David plays a late cut; straight to Siraj on the bounce at short third,2026-05-04 16:39:37.846358
42_GTvsRCB,May 04,16:33:57,Narendra Modi Stadium,9,2,Rashid Khan,Tim David,1 run,Rashid Khan goes full as Tim David drills it along the carpet to long-off,2026-05-04 16:39:37.846982
42_GTvsRCB,May 04,16:33:57,Narendra Modi Stadium,9,3,Rashid Khan,Devdutt Padikkal,1 run,on the shorter side; Devdutt Padikkal rocks back and drags it through mid-wicket for a single,2026-05-04 16:39:37.847599
42_GTvsRCB,May 04,16:33:57,Narendra Modi Stadium,9,4,Rashid Khan,Tim David,out Caught by Jason Holder!! Holder on a roll. He's turning this game on his head,his catching has been extraordinary today. That catch of Patidar earlier; and now this sharp take at mid-wicket. Rashid Khan with a wicket in his first over. This was whipped hard by the batsman and Holder took a sharp grab towards his right-side. Hardly had any time to reach; so that's quite impressive. RCB have lost half their side in Ahmedabad. Momentum shifting like the pendulum of a clock. Tim David c Jason Holder b Rashid Khan 9(6) [6s-1],2026-05-04 16:39:37.848367
42_GTvsRCB,May 04,16:33:57,Narendra Modi Stadium,9,5,Rashid Khan,Krunal Pandya,no run,full and straight on leg; Krunal Pandya looks to nudge it away; gets hit on the pads though,2026-05-04 16:39:37.849145
42_GTvsRCB,May 04,16:33:57,Narendra Modi Stadium,9,6,Rashid Khan,Krunal Pandya,no run,clipped with soft hands towards the on-side by Krunal Pandya. A successful over by Rashid Khan. Only a couple of runs and a wicket in it,2026-05-04 16:39:37.849899
42_GTvsRCB,May 04,16:33:57,Narendra Modi Stadium,10,1,Arshad Khan,Devdutt Padikkal,1 run,tad short on middle and leg; Devdutt Padikkal clips it towards long-on,2026-05-04 16:39:37.851299
42_GTvsRCB,May 04,16:33:57,Narendra Modi Stadium,10,2,Arshad Khan,Krunal Pandya,FOUR,tad short outside off; Krunal Pandya plays it late; carving it away to the square third man fence. Even he gets going with a boundary just like most of the RCB batters today,2026-05-04 16:39:37.855505
42_GTvsRCB,May 04,16:33:57,Narendra Modi Stadium,10,3,Arshad Khan,Krunal Pandya,out Caught by Jason Holder!! Holder is everywhere. A length delivery around middle and leg,Krunal Pandya flicks it straight to mid-wicket where the big man takes it again. Arshad Khan has his arms wide open as he takes his second wicket. RCB will likely need an impact sub in the form of Venkatesh Iyer today. They've faced this issue earlier in the tournament; where Venky Iyer was required. That might be the case even in this match. Meanwhile; GT on top as they are taking wickets at regular intervals. Krunal Pandya c Jason Holder b Arshad Khan 4(4) [4s-1],2026-05-04 16:39:37.856623
42_GTvsRCB,May 04,16:33:57,Narendra Modi Stadium,10,4,Arshad Khan,Romario Shepherd,no run,pitched up by the bowler outside off; Romario Shepherd square drives it towards point,2026-05-04 16:39:37.857317
42_GTvsRCB,May 04,16:33:57,Narendra Modi Stadium,10,5,Arshad Khan,Romario Shepherd,no run,drifting on the pads; clipped to mid-on by Romario Shepherd,2026-05-04 16:39:37.857979
42_GTvsRCB,May 04,16:33:57,Narendra Modi Stadium,10,6,Arshad Khan,Romario Shepherd,1 run,short ball on leg; Romario Shepherd pulls it through backward square leg,2026-05-04 16:39:37.858684
42_GTvsRCB,May 04,16:33:57,Narendra Modi Stadium,11,1,Rashid Khan,Romario Shepherd,1 run,tossed up delivery by Rashid Khan as Romario Shepherd drives this to long-on for a single,2026-05-04 16:39:37.859924
42_GTvsRCB,May 04,16:33:57,Narendra Modi Stadium,11,2,Rashid Khan,Devdutt Padikkal,no run,on the fuller side around leg; Devdutt Padikkal looks to flick it away; gets his on the pads though,2026-05-04 16:39:37.861246
42_GTvsRCB,May 04,16:33:57,Narendra Modi Stadium,11,3,Rashid Khan,Devdutt Padikkal,1 run,driven along the carpet to long-on for one,2026-05-04 16:39:37.864499
42_GTvsRCB,May 04,16:33:57,Narendra Modi Stadium,11,4,Rashid Khan,Romario Shepherd,no run,fraction short outside off; Romario Shepherd has a poke at it; gets beaten on the outside edge,2026-05-04 16:39:37.865878
42_GTvsRCB,May 04,16:33:57,Narendra Modi Stadium,11,5,Rashid Khan,Romario Shepherd,1 run,100 up for RCB. Romario Shepherd bludgeons this towards long-on for one,2026-05-04 16:39:37.866658
42_GTvsRCB,May 04,16:33:57,Narendra Modi Stadium,11,6,Rashid Khan,Devdutt Padikkal,no run,full and straight outside off; Devdutt Padikkal push-drives it towards cover. Another wily over by Rashid Khan - he has gone for 5 runs in 2 overs; add a wicket to that,2026-05-04 16:39:37.867814
42_GTvsRCB,May 04,16:33:57,Narendra Modi Stadium,12,1,Kagiso Rabada,Romario Shepherd,leg byes,1 run; length delivery around middle and leg; Romario Shepherd looks to nudge it away; gets hit on the pads though; and they've taken a leg bye,2026-05-04 16:39:37.868511
42_GTvsRCB,May 04,16:33:57,Narendra Modi Stadium,12,2,Kagiso Rabada,Devdutt Padikkal,FOUR,a good effort by Gill in the deep; but I think he was in contact with the cushions. Devdutt Padikkal had punched it through wide mid-off and Gill tried to chase it and flick it away; but he was in contact with the boundary at the same time,2026-05-04 16:39:37.869305
42_GTvsRCB,May 04,16:33:57,Narendra Modi Stadium,12,3,Kagiso Rabada,Devdutt Padikkal,SIX,that has gone all the way. Devdutt Padikkal took his eyes off the ball while playing this short ball. Somehow manages to connect it and clears the boundary at fine leg. It was due to Rabada's raw pace that the ball flew away,2026-05-04 16:39:37.870142
42_GTvsRCB,May 04,16:33:57,Narendra Modi Stadium,12,4,Kagiso Rabada,Devdutt Padikkal,1 run,steered towards short third man for a single,2026-05-04 16:39:37.871204
42_GTvsRCB,May 04,16:33:57,Narendra Modi Stadium,12,5,Kagiso Rabada,Romario Shepherd,no run,good length delivery outside off; Romario Shepherd opens the bat face; steering it towards backward point,2026-05-04 16:39:37.872213
42_GTvsRCB,May 04,16:33:57,Narendra Modi Stadium,12,6,Kagiso Rabada,Romario Shepherd,1 run,fraction short outside off; Romario Shepherd opens the bat face; steering this towards point for one,2026-05-04 16:39:37.873208
42_GTvsRCB,May 04,16:33:57,Narendra Modi Stadium,13,1,Rashid Khan,Romario Shepherd,no run,sharp leg-break outside off; Romario Shepherd looks to defend; gets beaten on the outside edge,2026-05-04 16:39:37.873968
42_GTvsRCB,May 04,16:33:57,Narendra Modi Stadium,13,2,Rashid Khan,Romario Shepherd,SIX,smoked into the sightscreen! Rashid Khan goes full and Romario Shepherd has launched it for a handsome six. He's got ability; just that he needs to be wary against Rashid. Can always shift gears against rest of the GT bowlers,2026-05-04 16:39:37.874667
42_GTvsRCB,May 04,16:33:57,Narendra Modi Stadium,13,3,Rashid Khan,Romario Shepherd,no run,flatter and trifle short; Shepherd pushes it back to the bowler,2026-05-04 16:39:37.875540
42_GTvsRCB,May 04,16:33:57,Narendra Modi Stadium,13,4,Rashid Khan,Romario Shepherd,SIX,another biggie; he's picking Khan well; tossed up and on middle; Shepherd picks it and smashes it across the line over deep mid-wicket; bit too full from Rashid,2026-05-04 16:39:37.876316
42_GTvsRCB,May 04,16:33:57,Narendra Modi Stadium,13,5,Rashid Khan,Romario Shepherd,1 run,tossed up and touch slower; Shepherd was beaten by the pace and drags it down to long-on,2026-05-04 16:39:37.881575
42_GTvsRCB,May 04,16:33:57,Narendra Modi Stadium,13,6,Rashid Khan,Devdutt Padikkal,out Bowled!! There's the big strike,Dev was deprived of strike as he was losing partners at the other end and now he departs; this one was pushed through quicker on middle; Dev rocks back to defend; but gets into a tangle; as he edges it onto the pads and then the ball ricochets onto the stumps. Devdutt Padikkal b Rashid Khan 40(24) [4s-5 6s-2],2026-05-04 16:39:37.882903
42_GTvsRCB,May 04,16:33:57,Narendra Modi Stadium,14,1,Jason Holder,Romario Shepherd,out Caught by Sai Sudharsan!! It's Holder again,you can't keep him out of action tonight; back of a length and outside off; Shepherd was shaping in to pull; but didn't get it off the middle of the bat and hits it straight into the hands of Sai in the deep; RCB sink further. Romario Shepherd c Sai Sudharsan b Jason Holder 17(15) [6s-2],2026-05-04 16:39:37.889375
42_GTvsRCB,May 04,16:33:57,Narendra Modi Stadium,14,2,Jason Holder,Bhuvneshwar Kumar,3 runs,he's off the mark; full and outside off; Kumar flicks it along the ground to deep mid-wicket; Siraj puts in the dive and pulls it back; but it was going towards the ropes and another fielder puts in the dive and saves a run,2026-05-04 16:39:37.890047
42_GTvsRCB,May 04,16:33:57,Narendra Modi Stadium,14,3,Jason Holder,Venkatesh Iyer,1 run,full and outside off; Iyer pushes it down to mid-off,2026-05-04 16:39:37.893272
42_GTvsRCB,May 04,16:33:57,Narendra Modi Stadium,14,4,Jason Holder,Bhuvneshwar Kumar,no run,back of a length and outside off; Kumar gets right behind and defends it,2026-05-04 16:39:37.896630
42_GTvsRCB,May 04,16:33:57,Narendra Modi Stadium,14,5,Jason Holder,Bhuvneshwar Kumar,1 run,back of a length and outside off; Kumar taps it to cover point,2026-05-04 16:39:37.897324
42_GTvsRCB,May 04,16:33:57,Narendra Modi Stadium,14,6,Jason Holder,Venkatesh Iyer,1 run,short and outside off; Iyer hangs back and guides it down to third man,2026-05-04 16:39:37.897921
42_GTvsRCB,May 04,16:33:57,Narendra Modi Stadium,15,1,Rashid Khan,Venkatesh Iyer,no run,tossed up delivery on the pads; Iyer misses out on the flick shot,2026-05-04 16:39:37.898363
42_GTvsRCB,May 04,16:33:57,Narendra Modi Stadium,15,2,Rashid Khan,Venkatesh Iyer,no run,this one hurried onto him as he was struck on the back foot; he's hit high on the pads; stifle appeal for an LBW,2026-05-04 16:39:37.899829
42_GTvsRCB,May 04,16:33:57,Narendra Modi Stadium,15,3,Rashid Khan,Venkatesh Iyer,1 run,turning into the pads; Iyer is not picking Rashid here; flicks it to square leg,2026-05-04 16:39:37.900422
42_GTvsRCB,May 04,16:33:57,Narendra Modi Stadium,15,4,Rashid Khan,Bhuvneshwar Kumar,no run,tossed up and on middle; this one turned away; Kumar defends it to the off side,2026-05-04 16:39:37.901034
