match,date,time,venue,over,ball,bowler,batsman,ball_event,event_info,extract_time
22_CSKvsKKR,May 04,13:29:25,MA Chidambaram Stadium,16,5,Sunil Narine,Dewald Brevis,FOUR,he's put it away; Brevis had backed away to the leg side; Narine bowls it flatter and shorter outside off; Brevis slaps it to deep extra cover; Narine is lived with himself for giving him width,2026-05-04 13:38:06.864399
22_CSKvsKKR,May 04,13:29:25,MA Chidambaram Stadium,16,6,Sunil Narine,Dewald Brevis,no run,slightly shorter outside off; Brevis punches it to extra cover,2026-05-04 13:38:06.864527
22_CSKvsKKR,May 04,13:29:25,MA Chidambaram Stadium,17,1,Kartik Tyagi,Shivam Dube,1 run,full and angled across; Dube drives it to extra cover; a shy at the non-strikers end; but it was off target,2026-05-04 13:38:06.864668
22_CSKvsKKR,May 04,13:29:25,MA Chidambaram Stadium,17,2,Kartik Tyagi,Dewald Brevis,no run,he's missed out on this one; a juicy full-toss outside off; Brevis mistimes it straight to the fielder at covers,2026-05-04 13:38:06.864793
22_CSKvsKKR,May 04,13:29:25,MA Chidambaram Stadium,17,3,Kartik Tyagi,Dewald Brevis,wide,full and wide way outside off; he's to bowl again,2026-05-04 13:38:06.864897
22_CSKvsKKR,May 04,13:29:25,MA Chidambaram Stadium,17,3,Kartik Tyagi,Dewald Brevis,out Caught by Vaibhav Arora!! The wide line has worked,clever bowling from Tyagi; slower and wider outside off; Brevis goes for the wild swipe; was beaten by the pace and manages to edge it towards short third; where Vaibhav takes it inches from the ground as the ball was dying on him. Dewald Brevis c Vaibhav Arora b Kartik Tyagi 41(29) [4s-4 6s-2],2026-05-04 13:38:06.865004
22_CSKvsKKR,May 04,13:29:25,MA Chidambaram Stadium,17,4,Kartik Tyagi,Jamie Overton,no run,full and wide; just inside the wide line; Overton leaves it alone and they don't go for the review,2026-05-04 13:38:06.865107
22_CSKvsKKR,May 04,13:29:25,MA Chidambaram Stadium,17,5,Kartik Tyagi,Jamie Overton,FOUR,he's put it away; slower and shorter outside off; Overton had ample time to stay in the crease and smashes it to deep backward point,2026-05-04 13:38:06.865213
22_CSKvsKKR,May 04,13:29:25,MA Chidambaram Stadium,17,6,Kartik Tyagi,Jamie Overton,no run,he can't connect this time; excellent death bowling from Tyagi; just 6 off it; another slower delivery outside off; Overton was early into the shot and misses it completely,2026-05-04 13:38:06.865318
22_CSKvsKKR,May 04,13:29:25,MA Chidambaram Stadium,18,1,Vaibhav Arora,Shivam Dube,no run,full and wide outside off; just close to the wide line; in fact it went on the line; the umpire has to reverse his decision; good review from KKR,2026-05-04 13:38:06.865425
22_CSKvsKKR,May 04,13:29:25,MA Chidambaram Stadium,18,2,Vaibhav Arora,Shivam Dube,no run,full and outside off; Dube smashes it straight down the track and it hits the stumps at the non striker's end,2026-05-04 13:38:06.865527
22_CSKvsKKR,May 04,13:29:25,MA Chidambaram Stadium,18,3,Vaibhav Arora,Shivam Dube,wide,slower and shorter way outside off; another wide,2026-05-04 13:38:06.865632
22_CSKvsKKR,May 04,13:29:25,MA Chidambaram Stadium,18,3,Vaibhav Arora,Shivam Dube,FOUR,he's helped it nicely; banged in slower and shorter; Dube waits for it and pulls it over the fielder to backward square leg; he palyed it late and found the gap,2026-05-04 13:38:06.865778
22_CSKvsKKR,May 04,13:29:25,MA Chidambaram Stadium,18,4,Vaibhav Arora,Shivam Dube,no run,wide yorker outside off; no room for Dube as he digs it to the off side,2026-05-04 13:38:06.865923
22_CSKvsKKR,May 04,13:29:25,MA Chidambaram Stadium,18,5,Vaibhav Arora,Shivam Dube,wide,oh another widish yorker way outside off; Dube leaves it alone,2026-05-04 13:38:06.866026
22_CSKvsKKR,May 04,13:29:25,MA Chidambaram Stadium,18,5,Vaibhav Arora,Shivam Dube,wide,another one; he's under pressure; full and wide outside off stump,2026-05-04 13:38:06.866131
22_CSKvsKKR,May 04,13:29:25,MA Chidambaram Stadium,18,5,Vaibhav Arora,Shivam Dube,1 run,finally he's bowled a legal delivery; full-toss outside off; Dube drills it to long-off; can't find the gap,2026-05-04 13:38:06.866234
22_CSKvsKKR,May 04,13:29:25,MA Chidambaram Stadium,18,6,Vaibhav Arora,Jamie Overton,1 run,comes from round the wicket and bowls a widish yorker outside off; no room for Overton as he jams it down to long-off; just 9 runs off it considering he bowled many wides in the over,2026-05-04 13:38:06.866351
22_CSKvsKKR,May 04,13:29:25,MA Chidambaram Stadium,19,1,Kartik Tyagi,Jamie Overton,1 run,full and wide outside off; no width; Overton slices it to sweeper cover,2026-05-04 13:38:06.866466
22_CSKvsKKR,May 04,13:29:25,MA Chidambaram Stadium,19,2,Kartik Tyagi,Shivam Dube,2 runs,he's bowling well here; giving nothing away; full and on middle; Dube drills it down to long-on and they run well for the second,2026-05-04 13:38:06.866580
22_CSKvsKKR,May 04,13:29:25,MA Chidambaram Stadium,19,3,Kartik Tyagi,Shivam Dube,2 runs,slower short delivery; Dube was early into the shot and mistimes a pull to square leg; the fielder threw the ball back to the bowler as he misses the direct hit and they get an extra run,2026-05-04 13:38:06.866704
22_CSKvsKKR,May 04,13:29:25,MA Chidambaram Stadium,19,4,Kartik Tyagi,Shivam Dube,1 run,speared in full; Dube drives it down to long-off,2026-05-04 13:38:06.866817
22_CSKvsKKR,May 04,13:29:25,MA Chidambaram Stadium,19,5,Kartik Tyagi,Jamie Overton,1 run,pacy full-toss; Overton drives it to deep extra cover; can't find the gap as he was looking for the second run,2026-05-04 13:38:06.866974
22_CSKvsKKR,May 04,13:29:25,MA Chidambaram Stadium,19,6,Kartik Tyagi,Shivam Dube,1 run,pace again; well bowled Tyagi; full-toss outside off; Dube still can't time it as he hits it to sweeper cover,2026-05-04 13:38:06.867189
22_CSKvsKKR,May 04,13:29:25,MA Chidambaram Stadium,0,1,Khaleel Ahmed,Finn Allen,leg byes,Khaleel starts with a poor line; but no harm done. Allen misses the tuck and the ball rolls down to fine leg for a leg-bye,2026-05-04 13:38:06.867362
22_CSKvsKKR,May 04,13:29:25,MA Chidambaram Stadium,0,2,Khaleel Ahmed,Sunil Narine,no run,Narine wants to go big straightaway. Clears his front foot and looks to tonk it over mid-off. Misses the ball by a long way,2026-05-04 13:38:06.867482
22_CSKvsKKR,May 04,13:29:25,MA Chidambaram Stadium,0,3,Khaleel Ahmed,Sunil Narine,no run,another play and a miss. Shorter this time just outside off; Narine looks to slog and misses. Wasn't far away from knocking the off-stump,2026-05-04 13:38:06.867695
22_CSKvsKKR,May 04,13:29:25,MA Chidambaram Stadium,0,4,Khaleel Ahmed,Sunil Narine,no run,full and swinging away from Khaleel. Narine is a long way outside the line and lets it go,2026-05-04 13:38:06.867822
22_CSKvsKKR,May 04,13:29:25,MA Chidambaram Stadium,0,5,Khaleel Ahmed,Sunil Narine,SIX,Narine was looking for this from ball one. Gets the line and length he needs. Short on middle; Narine stands tall and pulls it over mid-wicket for the first maximum,2026-05-04 13:38:06.867927
22_CSKvsKKR,May 04,13:29:25,MA Chidambaram Stadium,0,6,Khaleel Ahmed,Sunil Narine,no run,good length delivery outside off; Narine looks to slash and misses,2026-05-04 13:38:06.868031
22_CSKvsKKR,May 04,13:29:25,MA Chidambaram Stadium,1,1,Anshul Kamboj,Finn Allen,1 run,swing on offer for Kamboj. Outswinger outside off; Allen gets a thick inside edge on the drive to deep mid-wicket,2026-05-04 13:38:06.868134
22_CSKvsKKR,May 04,13:29:25,MA Chidambaram Stadium,1,2,Anshul Kamboj,Sunil Narine,FOUR,Narine has got that fine. Probably came off the glove. The line was down leg; Narine gets inside the line of the ball and pulls it fine for four. Short fine had no chance,2026-05-04 13:38:06.868239
22_CSKvsKKR,May 04,13:29:25,MA Chidambaram Stadium,1,3,Anshul Kamboj,Sunil Narine,1 run,full and swinging in on middle and leg; Narine digs it out to mid-on,2026-05-04 13:38:06.868341
22_CSKvsKKR,May 04,13:29:25,MA Chidambaram Stadium,1,4,Anshul Kamboj,Finn Allen,out Caught by Shivam Dube!! That's up in the air and its the big wicket of Finn Allen. CSK needed this breakthrough early on and they get it. The crowd erupts. Coming to the ball,it was full and Kamboj got it to swing away from the right-hander. Allen walks across and looks to slog it on the on-side. Plays it against the line and gets a leading edge that goes to Dube at cover-point. Finn Allen c Shivam Dube b Anshul Kamboj 1(3),2026-05-04 13:38:06.868455
22_CSKvsKKR,May 04,13:29:25,MA Chidambaram Stadium,1,5,Anshul Kamboj,Ajinkya Rahane,no run,fullish length delivery on off; driven straight to mid-off,2026-05-04 13:38:06.868560
22_CSKvsKKR,May 04,13:29:25,MA Chidambaram Stadium,1,6,Anshul Kamboj,Ajinkya Rahane,1 run,Rahane drops it to point and sets off for a quick single,2026-05-04 13:38:06.868698
22_CSKvsKKR,May 04,13:29:25,MA Chidambaram Stadium,2,1,Khaleel Ahmed,Ajinkya Rahane,no run,angling across the right-hander; Rahane chops the cut to cover-point,2026-05-04 13:38:06.868801
22_CSKvsKKR,May 04,13:29:25,MA Chidambaram Stadium,2,2,Khaleel Ahmed,Ajinkya Rahane,no run,half-volley outside off; Rahane drives it to mid-off,2026-05-04 13:38:06.868902
22_CSKvsKKR,May 04,13:29:25,MA Chidambaram Stadium,2,3,Khaleel Ahmed,Ajinkya Rahane,1 run,slashed hard from Rahane. Was short and wide outside off; Rahane cuts it to the right of deep point. The ball bounces just in front of the fielder at a good height; who stops it cleanly and keeps it down to a single,2026-05-04 13:38:06.869002
22_CSKvsKKR,May 04,13:29:25,MA Chidambaram Stadium,2,4,Khaleel Ahmed,Sunil Narine,SIX,Narine keeps going at the other end. Sits deep in the crease and goes through with the shot. Was on a length on middle; Narine thumps it wide of long-on. Just clears the fielder's reach,2026-05-04 13:38:06.869107
22_CSKvsKKR,May 04,13:29:25,MA Chidambaram Stadium,2,5,Khaleel Ahmed,Sunil Narine,no run,Khaleel comes round the wicket and angles it away from Narine. He goes for the pull and misses,2026-05-04 13:38:06.869212
22_CSKvsKKR,May 04,13:29:25,MA Chidambaram Stadium,2,6,Khaleel Ahmed,Sunil Narine,1 run,good length delivery on off; pushed in front of mid-off for a quick single,2026-05-04 13:38:06.869313
22_CSKvsKKR,May 04,13:29:25,MA Chidambaram Stadium,3,1,Anshul Kamboj,Sunil Narine,no run,angling away past the left-hander; Narine is nowhere close to the ball as he makes room to heave it on the on-side,2026-05-04 13:38:06.869430
22_CSKvsKKR,May 04,13:29:25,MA Chidambaram Stadium,3,2,Anshul Kamboj,Sunil Narine,no run,CSK skipper has dropped a sitter at mid-off. This was an attempted yorker on middle. Narine looks to go over mid-off. Gets it off the toe end and lobs straight to Ruturaj; who drops a sitter. Sanju can't believe that the catch falls to ground,2026-05-04 13:38:06.869618
22_CSKvsKKR,May 04,13:29:25,MA Chidambaram Stadium,3,3,Anshul Kamboj,Sunil Narine,no run,swinging across the left-hander; Narine swings hard and misses,2026-05-04 13:38:06.869784
22_CSKvsKKR,May 04,13:29:25,MA Chidambaram Stadium,3,4,Anshul Kamboj,Sunil Narine,FOUR,short on middle; Narine drags the pull wide of cow corner. The fielder in the deep had no chance of stopping that,2026-05-04 13:38:06.869894
22_CSKvsKKR,May 04,13:29:25,MA Chidambaram Stadium,3,5,Anshul Kamboj,Sunil Narine,2 runs,this time Narine has no room to extend his arms. Was short at his body. Narine mistimes the pull to deep square leg,2026-05-04 13:38:06.869996
22_CSKvsKKR,May 04,13:29:25,MA Chidambaram Stadium,3,6,Anshul Kamboj,Sunil Narine,no run,fullish outside off; driven uppishly to mid-off. The ball goes on the bounce to the fielder,2026-05-04 13:38:06.870097
22_CSKvsKKR,May 04,13:29:25,MA Chidambaram Stadium,4,1,Khaleel Ahmed,Ajinkya Rahane,1 run,wild slog across the line to a length delivery angling into the right-hander from round the wicket; the thick inside-edge goes on to the back leg; rolls to the left of Khaleel Ahmed; they take one,2026-05-04 13:38:06.870217
22_CSKvsKKR,May 04,13:29:25,MA Chidambaram Stadium,4,2,Khaleel Ahmed,Sunil Narine,out Caught by Gurjapneet Singh!! Contrasting emotions in both camps. Fleming uncharacteristically is excited while Abhishek Nayar is glum. The angle from round the wicket works. It's full and outside the leg-stump,cramps Sunil Narine who has made room to flick; the thick leading-edge loops to short third man and Gurjanpeet is happy to accept it with glee. Narine never got going despite the two sixes and falls inside the powerplay. Sunil Narine c Gurjapneet Singh b Khaleel Ahmed 24(17) [4s-2 6s-2],2026-05-04 13:38:06.870371
22_CSKvsKKR,May 04,13:29:25,MA Chidambaram Stadium,4,3,Khaleel Ahmed,Angkrish Raghuvanshi,no run,full outside off; Angkrish Raghuvanshi gets forward to drive and he opens the face of the bat; finds short third man. Raghuvanshi is sent back by Ajinkya Rahane in time,2026-05-04 13:38:06.870490
22_CSKvsKKR,May 04,13:29:25,MA Chidambaram Stadium,4,4,Khaleel Ahmed,Angkrish Raghuvanshi,no run,full and outside off; Angkrish Raghuvanshi comes down the track to loft; off the bottom of the bat and it doesn't carry to Gaikwad at mid-off. On the bounce,2026-05-04 13:38:06.870697
22_CSKvsKKR,May 04,13:29:25,MA Chidambaram Stadium,4,5,Khaleel Ahmed,Angkrish Raghuvanshi,1 run,short of length outside off; Angkrish Raghuvanshi waits and cuts the off-pace delivery to deep point,2026-05-04 13:38:06.870816
22_CSKvsKKR,May 04,13:29:25,MA Chidambaram Stadium,4,6,Khaleel Ahmed,Ajinkya Rahane,1 run,slower-ball and the off-cutter and full outside off; Ajinkya Rahane gets forward and opens the face of the bat to drive to sweeper cover,2026-05-04 13:38:06.870928
22_CSKvsKKR,May 04,13:29:25,MA Chidambaram Stadium,5,1,Akeal Hosein,Ajinkya Rahane,1 run,flat back of a length on middle; sort of grips in the surface; Ajinkya Rahane goes on the back foot and mistimes the pull to deep mid-wicket; they are happy with one,2026-05-04 13:38:06.871041
22_CSKvsKKR,May 04,13:29:25,MA Chidambaram Stadium,5,2,Akeal Hosein,Angkrish Raghuvanshi,no run,Angkrish Raghuvanshi backs away; flat good length on middle; he cuts and finds the fielder at extra-cover,2026-05-04 13:38:06.871156
22_CSKvsKKR,May 04,13:29:25,MA Chidambaram Stadium,5,3,Akeal Hosein,Angkrish Raghuvanshi,no run,flat good length and Angkrish Raghuvanshi is struck just outside off; as he misses the sweep. Sanju Samson goes aaahhhhhhhhhhh in appeal. More of screaming than anything else. Comical appeal that. It's a flat delivery and skids on straight; Raghuvanshi misses and is hit on the back leg; but he ensured he got outside off. The ump got that right. CSK don't review,2026-05-04 13:38:06.871272
22_CSKvsKKR,May 04,13:29:25,MA Chidambaram Stadium,5,4,Akeal Hosein,Angkrish Raghuvanshi,FOUR,good shot. Angkrish Raghuvanshi backs away outside the leg-stump; this is a good length delivery and a hint of turn away; he cuts well and beats the dive of Kamboj at cover-point who went to his left,2026-05-04 13:38:06.871385
22_CSKvsKKR,May 04,13:29:25,MA Chidambaram Stadium,5,5,Akeal Hosein,Angkrish Raghuvanshi,no run,flat good length on leg-stump; Angkrish Raghuvanshi makes room and cuts; but picks out Kamboj at cover-point; straight to the fielder,2026-05-04 13:38:06.871495
22_CSKvsKKR,May 04,13:29:25,MA Chidambaram Stadium,5,6,Akeal Hosein,Angkrish Raghuvanshi,no run,the one-finger seam-up delivery and it swings in like an inswinger to leg-stump; Angkrish Raghuvanshi backs away slightly; drives it straight back to Akeal Hosein. Played with a high-elbow,2026-05-04 13:38:06.871603
22_CSKvsKKR,May 04,13:29:25,MA Chidambaram Stadium,6,1,Noor Ahmad,Ajinkya Rahane,1 run,flat good length on off; Ajinkya Rahane goes on the back foot and pulls to deep mid-wicket; just one,2026-05-04 13:38:06.871737
22_CSKvsKKR,May 04,13:29:25,MA Chidambaram Stadium,6,2,Noor Ahmad,Angkrish Raghuvanshi,1 run,attacks the stumps on middle; Angkrish Raghuvanshi goes on the back foot and punches after making room; wide of cover,2026-05-04 13:38:06.871849
22_CSKvsKKR,May 04,13:29:25,MA Chidambaram Stadium,6,3,Noor Ahmad,Ajinkya Rahane,1 run,the googly and wide outside off; turns away; Ajinkya Rahane reaches for it and mistimes the cut to backward point for one,2026-05-04 13:38:06.871964
22_CSKvsKKR,May 04,13:29:25,MA Chidambaram Stadium,6,4,Noor Ahmad,Angkrish Raghuvanshi,FOUR,good reverse-sweep. The googly again; turns away; from off; Angkrish Raghuvanshi with premeditation; turns around and reverse-sweeps; gets it over Khaleel at short third man,2026-05-04 13:38:06.872081
22_CSKvsKKR,May 04,13:29:25,MA Chidambaram Stadium,6,5,Noor Ahmad,Angkrish Raghuvanshi,1 run,again premeditation. Angkrish Raghuvanshi down so early for the sweep; flat good length and well outside off; swept to deep mid-wicket,2026-05-04 13:38:06.872195
22_CSKvsKKR,May 04,13:29:25,MA Chidambaram Stadium,6,6,Noor Ahmad,Ajinkya Rahane,2 runs,full outside the leg-stump; Angkrish Raghuvanshi gets forward and flicks to deep square-leg; they take on Kamboj and come back for the 2nd,2026-05-04 13:38:06.872314
22_CSKvsKKR,May 04,13:29:25,MA Chidambaram Stadium,7,1,Akeal Hosein,Angkrish Raghuvanshi,1 run,the one-finger inswinger and it cramps Angkrish Raghuvanshi on leg-stump; he backs away and punches it through vacant point,2026-05-04 13:38:06.872431
22_CSKvsKKR,May 04,13:29:25,MA Chidambaram Stadium,7,2,Akeal Hosein,Ajinkya Rahane,1 run,tossed up full outside off; from wide of the crease; Ajinkya Rahane gets forward to slog; thick inside-edge goes to deep mid-wicket,2026-05-04 13:38:06.872609
22_CSKvsKKR,May 04,13:29:25,MA Chidambaram Stadium,7,3,Akeal Hosein,Angkrish Raghuvanshi,SIX,dropped and it's gone for six. Brevis the man at long-on. He was on the run. And it was not an easy catch as well. Angkrish Raghuvanshi goes on the back foot to pull; was a back of a length delivery and he miscues it; Brevis on the run to his right; gets two hands; it hits them hard and due to that; it goes over the fence. Was he put off by Sarfaraz coming near him from deep mid-wicket?,2026-05-04 13:38:06.873295
22_CSKvsKKR,May 04,13:29:25,MA Chidambaram Stadium,7,4,Akeal Hosein,Angkrish Raghuvanshi,2 runs,flat good length and sliding into leg-stump; Angkrish Raghuvanshi goes on the back foot and pulls hard; wide of deep mid-wicket and it's two more,2026-05-04 13:38:06.874017
22_CSKvsKKR,May 04,13:29:25,MA Chidambaram Stadium,7,5,Akeal Hosein,Angkrish Raghuvanshi,1 run,good length and cramps Angkrish Raghuvanshi on off; he backs away and cuts hard and straight to deep point,2026-05-04 13:38:06.874343
22_CSKvsKKR,May 04,13:29:25,MA Chidambaram Stadium,7,6,Akeal Hosein,Ajinkya Rahane,1 run,flat good length on off; Ajinkya Rahane gets forward and closes the face of the bat to flick to backward square-leg,2026-05-04 13:38:06.874841
22_CSKvsKKR,May 04,13:29:25,MA Chidambaram Stadium,8,1,Gurjapneet Singh,Ajinkya Rahane,wide,starts with a wide down leg; Ajinkya Rahane goes on the back foot to pull and misses; Sanju Samson does well as he dives to his left to collect; saves runs,2026-05-04 13:38:06.875380
22_CSKvsKKR,May 04,13:29:25,MA Chidambaram Stadium,8,1,Gurjapneet Singh,Ajinkya Rahane,SIX,Ajinkya Rahane gets going with this one. It's a clever shot. Premeditation as short fine was inside the ring. It's a length delivery outside off; Rahane gets low and scoops all the way for six over short fine,2026-05-04 13:38:06.875726
22_CSKvsKKR,May 04,13:29:25,MA Chidambaram Stadium,8,2,Gurjapneet Singh,Ajinkya Rahane,no run,a slower-ball and on a short of length outside off; Ajinkya Rahane gets forward and then dabs with an open-face to backward point. Sanju Samson applauds that delivery from Gurjapneet Singh,2026-05-04 13:38:06.875961
22_CSKvsKKR,May 04,13:29:25,MA Chidambaram Stadium,8,3,Gurjapneet Singh,Ajinkya Rahane,SIX,beautiful shot. Ajinkya Rahane breaking the shackles. It's a short of length delivery on middle; thigh-high; Rahane goes on the back foot and pulls; has the elevation to clear deep square-leg. Hint of a top-edge in that and that helped Rahane,2026-05-04 13:38:06.876276
22_CSKvsKKR,May 04,13:29:25,MA Chidambaram Stadium,8,4,Gurjapneet Singh,Ajinkya Rahane,1 run,a slower-ball on a good length on leg-stump; Ajinkya Rahane gets forward and closes the face of the bat to glance it to short fine,2026-05-04 13:38:06.877025
22_CSKvsKKR,May 04,13:29:25,MA Chidambaram Stadium,8,5,Gurjapneet Singh,Angkrish Raghuvanshi,FOUR,nice shot. Big over this. A short of length delivery on off; Angkrish Raghuvanshi makes room slightly and uses the pace on that delivery to guide it between backward point and short third man. No fuss; just clever batting,2026-05-04 13:38:06.877463
22_CSKvsKKR,May 04,13:29:25,MA Chidambaram Stadium,8,6,Gurjapneet Singh,Angkrish Raghuvanshi,1 run,short of length and tight on middle; Angkrish Raghuvanshi drops and runs in front of cover,2026-05-04 13:38:06.877593
22_CSKvsKKR,May 04,13:29:25,MA Chidambaram Stadium,9,1,Akeal Hosein,Angkrish Raghuvanshi,1 run,full on leg-stump; Angkrish Raghuvanshi gets forward to defend; the ball hits the leg and rolls in front of backward point for one,2026-05-04 13:38:06.877745
22_CSKvsKKR,May 04,13:29:25,MA Chidambaram Stadium,9,2,Akeal Hosein,Ajinkya Rahane,1 run,now Sarfaraz drops it from deep mid-wicket. He was charging in and perhaps too quickly for his own good. Gets both hands and drops it. Similar to Brevis' earlier. Hard hands and down it goes. It's a flat good length on off; Ajinkya Rahane tries to swipe across the line; the top-edge flies high and Sarfaraz did all the hard work by running in; but then fails to hang on,2026-05-04 13:38:06.877887
22_CSKvsKKR,May 04,13:29:25,MA Chidambaram Stadium,9,3,Akeal Hosein,Angkrish Raghuvanshi,out Caught by Dewald Brevis!! Finally Akeal Hosein gets a wicket. After two drops. Angkrish Raghuvanshi fails to cash in on the earlier drop. It's a flat length delivery on leg-stump,he goes on the back foot and makes room slightly; pulls but there's no power or timing behind that hit. Easy catch for long-on and Brevis reverse-cups with ease. CSK tightening the screws here. Angkrish Raghuvanshi c Dewald Brevis b Akeal Hosein 27(19) [4s-3 6s-1],2026-05-04 13:38:06.878048
22_CSKvsKKR,May 04,13:29:25,MA Chidambaram Stadium,9,4,Akeal Hosein,Rinku Singh,no run,down leg; turning in; Rinku Singh goes on the back foot to glance and looks like he got a bit of an inside-edge on to thigh pad; finds short fine,2026-05-04 13:38:06.878235
22_CSKvsKKR,May 04,13:29:25,MA Chidambaram Stadium,9,5,Akeal Hosein,Rinku Singh,1 run,good length and flat on leg-stump; Rinku Singh gets forward and nudges it down to long-on to get off the mark,2026-05-04 13:38:06.878343
22_CSKvsKKR,May 04,13:29:25,MA Chidambaram Stadium,9,6,Akeal Hosein,Ajinkya Rahane,1 run,good length on off; Ajinkya Rahane gets forward and calmly nudges one to the vacant mid-wicket area to retain the strike,2026-05-04 13:38:06.878447
22_CSKvsKKR,May 04,13:29:25,MA Chidambaram Stadium,10,1,Noor Ahmad,Ajinkya Rahane,1 run,googly and flat outside off; good length; Ajinkya Rahane gets forward and opens the face of the bat to punch to sweeper cover,2026-05-04 13:38:06.878553
22_CSKvsKKR,May 04,13:29:25,MA Chidambaram Stadium,10,2,Noor Ahmad,Rinku Singh,1 run,flat good length outside off; Rinku Singh goes on the back foot and makes room to punch to deep point,2026-05-04 13:38:06.878745
22_CSKvsKKR,May 04,13:29:25,MA Chidambaram Stadium,10,3,Noor Ahmad,Ajinkya Rahane,1 run,tossed up full on leg-stump; Ajinkya Rahane gets forward to drive to long-on,2026-05-04 13:38:06.878926
22_CSKvsKKR,May 04,13:29:25,MA Chidambaram Stadium,10,4,Noor Ahmad,Rinku Singh,1 run,tossed up full outside off; Rinku Singh gets forward to drive it straight down the ground; past the left boot of Noor Ahmad who tried to stop it,2026-05-04 13:38:06.879034
22_CSKvsKKR,May 04,13:29:25,MA Chidambaram Stadium,10,5,Noor Ahmad,Ajinkya Rahane,out Caught by Ruturaj Gaikwad!! Noor Ahmad celebrates by closing his eyes with both hands. KKR fans are downcast. It's tossed up full on middle,Ajinkya Rahane gets forward to loft over extra-cover; inside-out; but he miscues it and that's a simple catch for Rutu who's has gone a few paces outside the 30-yard mark at extra-cover. The bat turned on impact and that's why Rahane miscued that. 50th IPL wicket for Noor. Ajinkya Rahane c Ruturaj Gaikwad b Noor Ahmad 28(22) [6s-2],2026-05-04 13:38:06.879145
22_CSKvsKKR,May 04,13:29:25,MA Chidambaram Stadium,10,6,Noor Ahmad,Cameron Green,out Bowled!! Two in two and the Chepauk crowd are jumping up and down with whistles tooting in their lips. This is bowled from round the wicket. Noor Ahmad changed the angle and pushed it through quicker on middle and leg,good length and Cameron Green backs away to access the off-side; the ball rushes through and misses the bat; falls on the stumps. Green disappoints once again this season with the bat. CSK well on top here. Noor leaps and punches the air as he celebrates. Cameron Green b Noor Ahmad 0(1),2026-05-04 13:38:06.879256
22_CSKvsKKR,May 04,13:29:25,MA Chidambaram Stadium,11,1,Akeal Hosein,Rinku Singh,1 run,flat good length on leg-stump; skids on; Rinku Singh goes on the back foot and pulls to deep backward square-leg; more of a short-arm jab,2026-05-04 13:38:06.879415
22_CSKvsKKR,May 04,13:29:25,MA Chidambaram Stadium,11,2,Akeal Hosein,Rovman Powell,1 run,tossed up full on leg-stump as a slip waits. Rovman Powell gets forward to flick to the vacant mid-wicket area,2026-05-04 13:38:06.879536
22_CSKvsKKR,May 04,13:29:25,MA Chidambaram Stadium,11,3,Akeal Hosein,Rinku Singh,1 run,flat good length and across Rinku Singh outside off; he goes on the back foot and cuts to deep point,2026-05-04 13:38:06.879716
22_CSKvsKKR,May 04,13:29:25,MA Chidambaram Stadium,11,4,Akeal Hosein,Rovman Powell,no run,tossed up full on leg-stump; Rovman Powell gets forward to defend to the right of Akeal Hosein,2026-05-04 13:38:06.879827
