match,date,time,venue,over,ball,bowler,batsman,ball_event,event_info,extract_time
24_MIvsPK,May 04,13:29:25,Wankhede Stadium,0,1,Arshdeep Singh,Ryan Rickelton,no run,swing on offer for Arshdeep. Shapes away past the poke from Rickelton. Just away from the outside edge through to the keeper,2026-05-04 13:39:46.869234
24_MIvsPK,May 04,13:29:25,Wankhede Stadium,0,2,Arshdeep Singh,Ryan Rickelton,no run,outswinger outside off; Rickelton waits for the ball and plays it late. Dabs it down to short third man,2026-05-04 13:39:46.869519
24_MIvsPK,May 04,13:29:25,Wankhede Stadium,0,3,Arshdeep Singh,Ryan Rickelton,no run,peach of a delivery from Arshdeep. The seam presentation was so good. Swings away and beats the outside edge of Rickelton; who looks to defend on the front foot,2026-05-04 13:39:46.869880
24_MIvsPK,May 04,13:29:25,Wankhede Stadium,0,4,Arshdeep Singh,Ryan Rickelton,no run,make that another play and miss. Rickelton goes for the drive; the ball swings further away from outside off and makes it hard to get bat on ball. Past the outside edge for the third time this over,2026-05-04 13:39:46.870146
24_MIvsPK,May 04,13:29:25,Wankhede Stadium,0,5,Arshdeep Singh,Ryan Rickelton,no run,finally Rickelton gets good amount of bat on ball. Presses forward and defends it to cover,2026-05-04 13:39:46.870402
24_MIvsPK,May 04,13:29:25,Wankhede Stadium,0,6,Arshdeep Singh,Ryan Rickelton,1 run,excellent first over from Arshdeep. Rickelton stays inside the line of the ball and steers it down to third man for a single. Gets off the mark,2026-05-04 13:39:46.870676
24_MIvsPK,May 04,13:29:25,Wankhede Stadium,1,1,Marco Jansen,Ryan Rickelton,1 run,just a hint of swing from Jansen. Rickelton drops it in front of mid-off for a quick single,2026-05-04 13:39:46.870874
24_MIvsPK,May 04,13:29:25,Wankhede Stadium,1,2,Marco Jansen,Quinton de Kock,SIX,what a way to get off the mark from QDK. Reaches out for the wide delivery outside off and goes through the line. Pumps it over cover and it goes all the way,2026-05-04 13:39:46.871067
24_MIvsPK,May 04,13:29:25,Wankhede Stadium,1,3,Marco Jansen,Quinton de Kock,leg byes,FOUR; more runs. Sprayed down the line. Quinton de Kock misses the tuck and the ball clips the pad and runs down to fine leg fence for four leg-byes,2026-05-04 13:39:46.871261
24_MIvsPK,May 04,13:29:25,Wankhede Stadium,1,4,Marco Jansen,Quinton de Kock,no run,good length delivery on middle and off. Defended solidly off the front foot,2026-05-04 13:39:46.871448
24_MIvsPK,May 04,13:29:25,Wankhede Stadium,1,5,Marco Jansen,Quinton de Kock,no run,excellent delivery from Jansen. Hits the turf and nips back in sharply to beat the inside edge of the bat. Goes through bat-pad gap and flies over the stumps,2026-05-04 13:39:46.871638
24_MIvsPK,May 04,13:29:25,Wankhede Stadium,1,6,Marco Jansen,Quinton de Kock,no run,good length delivery outside off; Quinton de Kock chops the cut to gully,2026-05-04 13:39:46.871855
24_MIvsPK,May 04,13:29:25,Wankhede Stadium,2,1,Arshdeep Singh,Ryan Rickelton,out Caught by Shashank Singh!! 100 wickets for Arshdeep Singh in IPL. Arshdeep has a big smile on his face,he knows this wasn't a great delivery. Sprayed down the leg; Rickelton picks it up off this pads and hits it straight to Shashank Singh at deep square leg. Taken just inside the boundary ropes above his head. Rickelton struck that well but found Shashank perfectly. Ryan Rickelton c Shashank Singh b Arshdeep Singh 2(8),2026-05-04 13:39:46.872063
24_MIvsPK,May 04,13:29:25,Wankhede Stadium,2,2,Arshdeep Singh,Suryakumar Yadav,out Caught by Yuzvendra Chahal!! Two in two. Arshdeep Singh is on a roll. Arshdeep gets the ball to shape away from the right-hander. Suryakumar Yadav goes for the drive straightaway. The swing takes the outside edge and flies to short third man. Chahal the fielder,moves to his left and takes a sharp catch. Punjab fans are dancing in the crowd. Hat-trick ball coming up for Arshdeep Singh. Suryakumar Yadav c Yuzvendra Chahal b Arshdeep Singh 0(1),2026-05-04 13:39:46.872265
24_MIvsPK,May 04,13:29:25,Wankhede Stadium,2,3,Arshdeep Singh,Naman Dhir,no run,attacks the stumps with a length delivery on middle. Naman Dhir tucks it to mid-wicket,2026-05-04 13:39:46.872427
24_MIvsPK,May 04,13:29:25,Wankhede Stadium,2,4,Arshdeep Singh,Naman Dhir,2 runs,Naman Dhir pushes the length delivery outside off to backward point,2026-05-04 13:39:46.872627
24_MIvsPK,May 04,13:29:25,Wankhede Stadium,2,5,Arshdeep Singh,Naman Dhir,no run,good length delivery outside off; Naman Dhir leans on the front foot and drives it to cover,2026-05-04 13:39:46.872948
24_MIvsPK,May 04,13:29:25,Wankhede Stadium,2,6,Arshdeep Singh,Naman Dhir,1 run,hint of shape into the right-hander. Naman Dhir tucks it to mid-wicket and sprints for a quick single. Had to put in a dive to make it to the other end as the throw came in at the bowler's end. Connolly is the fielder; he misses the direct-hit and Naman Dhir makes his ground. Would have been tight had he hit,2026-05-04 13:39:46.873135
24_MIvsPK,May 04,13:29:25,Wankhede Stadium,3,1,Xavier Bartlett,Naman Dhir,no run,Xavier Bartlett starts with a yorker. Naman Dhir digs it out to mid-on,2026-05-04 13:39:46.873261
24_MIvsPK,May 04,13:29:25,Wankhede Stadium,3,2,Xavier Bartlett,Naman Dhir,FOUR,full and on the pads; asking to be hit. Naman Dhir accepts gleefully and tucks it through mid-wicket. Raced away along the ground for four. Vyshak dives near mid-wicket but gets a bad bounce and hence can't make the stop,2026-05-04 13:39:46.873371
24_MIvsPK,May 04,13:29:25,Wankhede Stadium,3,3,Xavier Bartlett,Naman Dhir,1 run,in the air and falls short of the man at sweeper cover. Naman Dhir goes for the shot inside out over cover. He gets a thick outside edge that flies towards the fielder. Goes on the bounce,2026-05-04 13:39:46.873476
24_MIvsPK,May 04,13:29:25,Wankhede Stadium,3,4,Xavier Bartlett,Quinton de Kock,2 runs,full and angling across the left-hander. Quinton de Kock drags the ball off the inner half of the blade to deep mid-wicket. Fielder slides and pulls it back inside the boundary,2026-05-04 13:39:46.873578
24_MIvsPK,May 04,13:29:25,Wankhede Stadium,3,5,Xavier Bartlett,Quinton de Kock,1 run,slower delivery on leg-stump; Quinton de Kock tucks it to the on-side and gets to the other end,2026-05-04 13:39:46.873733
24_MIvsPK,May 04,13:29:25,Wankhede Stadium,3,6,Xavier Bartlett,Naman Dhir,2 runs,angling in on the pads; tucked to deep square leg. Shashank Singh runs to his left and puts in a full length dive to save two. Excellent piece of fielding,2026-05-04 13:39:46.873842
24_MIvsPK,May 04,13:29:25,Wankhede Stadium,4,1,Marco Jansen,Quinton de Kock,1 run,back of a length delivery outside off; dabbed down to short third man,2026-05-04 13:39:46.873947
24_MIvsPK,May 04,13:29:25,Wankhede Stadium,4,2,Marco Jansen,Naman Dhir,1 run,dropped! That was a sitter. Chahal is the fielder; he hints that the light came in his way. Naman Dhir walks across and scoops the length delivery from outside off. Doesn't hit it well; the ball lobs to short fine leg and is shelled,2026-05-04 13:39:46.874053
24_MIvsPK,May 04,13:29:25,Wankhede Stadium,4,3,Marco Jansen,Quinton de Kock,no run,half-volley outside off; driven down to mid-off,2026-05-04 13:39:46.874158
24_MIvsPK,May 04,13:29:25,Wankhede Stadium,4,4,Marco Jansen,Quinton de Kock,FOUR,one bounce and over the ropes. Quinton de Kock stands tall and flats the length delivery over mid-off. Not timed well; but has enough to race away,2026-05-04 13:39:46.874263
24_MIvsPK,May 04,13:29:25,Wankhede Stadium,4,5,Marco Jansen,Quinton de Kock,1 run,shortish length delivery outside off; Quinton de Kock cuts it wide of point,2026-05-04 13:39:46.874366
24_MIvsPK,May 04,13:29:25,Wankhede Stadium,4,6,Marco Jansen,Naman Dhir,1 run,short and wide outside off; Naman Dhir gets across and cuts it to deep point. Hangs onto the strike with a single,2026-05-04 13:39:46.874469
24_MIvsPK,May 04,13:29:25,Wankhede Stadium,5,1,Vijaykumar Vyshak,Naman Dhir,no run,chance of a run-out. Direct-hit would have got QDK. He had given up. Naman Dhir drives it to mid-off and calls 'yes' initially. Shreyas Iyer got to the ball quickly and Naman Dhir had to change his mind. QDK was halfway down by the time he sends him back. Shreyas Iyer misses and QDK gets away,2026-05-04 13:39:46.874574
24_MIvsPK,May 04,13:29:25,Wankhede Stadium,5,2,Vijaykumar Vyshak,Naman Dhir,FOUR,shortish in length on middle; Naman Dhir rocks on the back foot and pulls it over mid-wicket. Few bounces and over the fence,2026-05-04 13:39:46.874828
24_MIvsPK,May 04,13:29:25,Wankhede Stadium,5,3,Vijaykumar Vyshak,Naman Dhir,no run,good length delivery outside off; pushed to the off-side,2026-05-04 13:39:46.874933
24_MIvsPK,May 04,13:29:25,Wankhede Stadium,5,4,Vijaykumar Vyshak,Naman Dhir,FOUR,swung away. Into the pads; Naman Dhir heaves it to the on-side. It was a tad short; which made Naman Dhir pick the length and put it away. Beats deep square leg fielder for four,2026-05-04 13:39:46.875040
24_MIvsPK,May 04,13:29:25,Wankhede Stadium,5,5,Vijaykumar Vyshak,Naman Dhir,SIX,just the kind of over MI was looking for. Length delivery gets pumped up. Naman Dhir clears his front foot and thumps it over long-on for a maximum,2026-05-04 13:39:46.875231
24_MIvsPK,May 04,13:29:25,Wankhede Stadium,5,6,Vijaykumar Vyshak,Naman Dhir,1 run,another run-out opportunity for Shreyas Iyer. Naman Dhir drives it straight to mid-off and sets off for a quick single. Shreyas Iyer was hanging on the edge of the circle; he picks the ball and fires at the non-strikers end. Misses and Naman Dhir makes his ground,2026-05-04 13:39:46.875350
24_MIvsPK,May 04,13:29:25,Wankhede Stadium,6,1,Yuzvendra Chahal,Naman Dhir,SIX,efforless from Naman Dhir. Welcomes Yuzvendra Chahal with a huge hit. Gets a loopy delivery on middle; Naman Dhir gets under the ball and smokes it over long-off,2026-05-04 13:39:46.875469
24_MIvsPK,May 04,13:29:25,Wankhede Stadium,6,2,Yuzvendra Chahal,Naman Dhir,1 run,tucks to the on-side for a run,2026-05-04 13:39:46.875573
24_MIvsPK,May 04,13:29:25,Wankhede Stadium,6,3,Yuzvendra Chahal,Quinton de Kock,SIX,this time it is QDK. Right in the slot; QDK gets low and slog sweeps the flighted delivery over cow corner fence. Not a great start from Chahal,2026-05-04 13:39:46.875704
24_MIvsPK,May 04,13:29:25,Wankhede Stadium,6,4,Yuzvendra Chahal,Quinton de Kock,FOUR,50-run stand comes up with this boundary. Chahal drags the length half way down well outside off; QDK rocks on the back foot and pulls it wide of long-on. No chance for the fielder as it was hit with power,2026-05-04 13:39:46.875821
24_MIvsPK,May 04,13:29:25,Wankhede Stadium,6,5,Yuzvendra Chahal,Quinton de Kock,wide,pushed through well outside off; wided,2026-05-04 13:39:46.875936
24_MIvsPK,May 04,13:29:25,Wankhede Stadium,6,5,Yuzvendra Chahal,Quinton de Kock,no run,googly outside off; QDK shoulders arms thinking the ball was outside the tramline. Given wide by the umpire. PKBS review and end up with a successful review,2026-05-04 13:39:46.876103
24_MIvsPK,May 04,13:29:25,Wankhede Stadium,6,6,Yuzvendra Chahal,Quinton de Kock,1 run,cut wide of cover-point for a quick single,2026-05-04 13:39:46.876253
24_MIvsPK,May 04,13:29:25,Wankhede Stadium,7,1,Xavier Bartlett,Quinton de Kock,1 run,half-volley outside off; driven along the ground down to long-on,2026-05-04 13:39:46.876361
24_MIvsPK,May 04,13:29:25,Wankhede Stadium,7,2,Xavier Bartlett,Naman Dhir,1 run,very full on middle; Naman Dhir digs it out to long-on,2026-05-04 13:39:46.876468
24_MIvsPK,May 04,13:29:25,Wankhede Stadium,7,3,Xavier Bartlett,Quinton de Kock,2 runs,slower delivery on middle; Quinton de Kock drops it to vacant mid-wicket region and sprint for a brace. Excellent running from the duo,2026-05-04 13:39:46.876573
24_MIvsPK,May 04,13:29:25,Wankhede Stadium,7,4,Xavier Bartlett,Quinton de Kock,1 run,much fuller outside off; Quinton de Kock squeezes it out to deep point,2026-05-04 13:39:46.876712
24_MIvsPK,May 04,13:29:25,Wankhede Stadium,7,5,Xavier Bartlett,Naman Dhir,1 run,slower delivery from Bartlett. Naman waits for the ball and cuts it to sweeper cover,2026-05-04 13:39:46.876818
24_MIvsPK,May 04,13:29:25,Wankhede Stadium,7,6,Xavier Bartlett,Quinton de Kock,1 run,good over from Bartlett. It's been slower ones or just short of yorker length this over. Quinton de Kock opens the bat face and dabs it to deep point to a wide yorker,2026-05-04 13:39:46.876918
24_MIvsPK,May 04,13:29:25,Wankhede Stadium,8,1,Vijaykumar Vyshak,Quinton de Kock,FOUR,Vyshak is into the attack and is put away. Fuller in length and has plenty of width on offer; Quinton de Kock gets under the ball and pumps it over backward point. No protection behind square and the ball raced away,2026-05-04 13:39:46.877024
24_MIvsPK,May 04,13:29:25,Wankhede Stadium,8,2,Vijaykumar Vyshak,Quinton de Kock,wide,slower delivery well outside the tramline. Wided,2026-05-04 13:39:46.877131
24_MIvsPK,May 04,13:29:25,Wankhede Stadium,8,2,Vijaykumar Vyshak,Quinton de Kock,no run,de Kock tries to be cheeky. Goes for the reverse scoop and misses. The ball hits his glove and rolls to the on-side,2026-05-04 13:39:46.877230
24_MIvsPK,May 04,13:29:25,Wankhede Stadium,8,3,Vijaykumar Vyshak,Quinton de Kock,FOUR,excellently placed. Angled across the left-hander; de Kock waits for the ball and cuts it late to pick the gap. Through backward point and short third man for four more,2026-05-04 13:39:46.877333
24_MIvsPK,May 04,13:29:25,Wankhede Stadium,8,4,Vijaykumar Vyshak,Quinton de Kock,1 run,yorker outside off; Quinton de Kock pushes it to cover-point and sets off. Had to settle down for a single,2026-05-04 13:39:46.877433
24_MIvsPK,May 04,13:29:25,Wankhede Stadium,8,5,Vijaykumar Vyshak,Naman Dhir,1 run,full toss and Naman Dhir misses out on the opportunity to put it away. Hits it straight to deep mid-wicket. Just a single,2026-05-04 13:39:46.877537
24_MIvsPK,May 04,13:29:25,Wankhede Stadium,8,6,Vijaykumar Vyshak,Quinton de Kock,1 run,wide yorker from Vyshak. de Kock square drives it to deep point,2026-05-04 13:39:46.877805
24_MIvsPK,May 04,13:29:25,Wankhede Stadium,9,1,Yuzvendra Chahal,Quinton de Kock,2 runs,leg-break on the pads; Quinton de Kock drops it to mid-wicket and calls for two straightaway. Gets it comfortably with some good running,2026-05-04 13:39:46.877931
24_MIvsPK,May 04,13:29:25,Wankhede Stadium,9,2,Yuzvendra Chahal,Quinton de Kock,no run,tossed up down the leg; de Kock sinks low and sweeps it fine. Straight to the fielder,2026-05-04 13:39:46.878044
24_MIvsPK,May 04,13:29:25,Wankhede Stadium,9,3,Yuzvendra Chahal,Quinton de Kock,SIX,well tossed up on leg-stump. Quinton de Kock skips down the ground and nails it over deep mid-wicket. Got to the pitch of the ball in a flash and put it away,2026-05-04 13:39:46.878261
24_MIvsPK,May 04,13:29:25,Wankhede Stadium,9,4,Yuzvendra Chahal,Quinton de Kock,1 run,driven down to long-on and gets to his 25th IPL fifty. Raises his bat to the crowd and soaks in the applause,2026-05-04 13:39:46.878457
24_MIvsPK,May 04,13:29:25,Wankhede Stadium,9,5,Yuzvendra Chahal,Naman Dhir,1 run,tucked to the on-side,2026-05-04 13:39:46.878597
24_MIvsPK,May 04,13:29:25,Wankhede Stadium,9,6,Yuzvendra Chahal,Quinton de Kock,1 run,wrong 'un on middle. Quinton de Kock gets squared up as he looks to work it on the on-side. Drops it to cover and gets to the other end,2026-05-04 13:39:46.878734
24_MIvsPK,May 04,13:29:25,Wankhede Stadium,10,1,Xavier Bartlett,Quinton de Kock,no run,how did that miss the stumps? It was full and around off. Quinton de Kock clears his front foot and misses the big slog. The ball sneaks past the off-pole through to the keeper,2026-05-04 13:39:46.878837
24_MIvsPK,May 04,13:29:25,Wankhede Stadium,10,2,Xavier Bartlett,Quinton de Kock,FOUR,smart batting from QDK. Gets the width he needs and he steers it wide of backward point. Hurried to the fence,2026-05-04 13:39:46.878943
24_MIvsPK,May 04,13:29:25,Wankhede Stadium,10,3,Xavier Bartlett,Quinton de Kock,SIX,cross seam delivery and in the slot. Quinton de Kock gets in a strong position and heaves it over mid-wicket. Gets it right of the screws and the ball sailed deep into the stands,2026-05-04 13:39:46.879048
24_MIvsPK,May 04,13:29:25,Wankhede Stadium,10,4,Xavier Bartlett,Quinton de Kock,1 run,good length delivery outside off; cut wide of backward point,2026-05-04 13:39:46.879154
24_MIvsPK,May 04,13:29:25,Wankhede Stadium,10,5,Xavier Bartlett,Naman Dhir,1 run,another full toss missed by Naman Dhir. This time it was the low full toss. Tucked to mid-wicket,2026-05-04 13:39:46.879259
24_MIvsPK,May 04,13:29:25,Wankhede Stadium,10,6,Xavier Bartlett,Quinton de Kock,1 run,yorker outside off; squeezed to point for a run,2026-05-04 13:39:46.879361
24_MIvsPK,May 04,13:29:25,Wankhede Stadium,11,1,Yuzvendra Chahal,Quinton de Kock,no run,flighted delivery well outside off; de Kock goes for the reverse sweep and misses. Couldn't get anywhere close to the ball,2026-05-04 13:39:46.879463
24_MIvsPK,May 04,13:29:25,Wankhede Stadium,11,2,Yuzvendra Chahal,Quinton de Kock,SIX,100-run stand comes up with this monstor. Tossed up wrong'un from Chahal. Quinton de Kock picks it and deposits it over deep square leg with a slog sweep,2026-05-04 13:39:46.879571
24_MIvsPK,May 04,13:29:25,Wankhede Stadium,11,3,Yuzvendra Chahal,Quinton de Kock,1 run,full and wide outside off; dragged to long-on,2026-05-04 13:39:46.879711
24_MIvsPK,May 04,13:29:25,Wankhede Stadium,11,4,Yuzvendra Chahal,Naman Dhir,SIX,now it's Naman Dhir. Skips down the track and gets to the pitch of the ball to hit it inside out over cover. Goes through with the shot and the timing takes the ball well over the boundary rope,2026-05-04 13:39:46.879817
24_MIvsPK,May 04,13:29:25,Wankhede Stadium,11,5,Yuzvendra Chahal,Naman Dhir,1 run,looks to charge yet again; Naman Dhir gets too close to the ball. Can't get elevation and he hits it one bounce to long-on,2026-05-04 13:39:46.879919
24_MIvsPK,May 04,13:29:25,Wankhede Stadium,11,6,Yuzvendra Chahal,Quinton de Kock,1 run,slower through the air; Quinton de Kock hangs on the back foot and pushes it to cover,2026-05-04 13:39:46.880022
24_MIvsPK,May 04,13:29:25,Wankhede Stadium,12,1,Marco Jansen,Quinton de Kock,1 run,slower delivery outside off; cut wide of backward point,2026-05-04 13:39:46.880122
24_MIvsPK,May 04,13:29:25,Wankhede Stadium,12,2,Marco Jansen,Naman Dhir,1 run,banged in short at the batter's badge. Pulled to deep square leg,2026-05-04 13:39:46.880225
24_MIvsPK,May 04,13:29:25,Wankhede Stadium,12,3,Marco Jansen,Quinton de Kock,1 run,goes for the full delivery on the pads; Quinton de Kock tucks it between deep mid-wicket and square leg. Duo settle for a single,2026-05-04 13:39:46.880330
24_MIvsPK,May 04,13:29:25,Wankhede Stadium,12,4,Marco Jansen,Naman Dhir,1 run,full and angling across. Naman Dhir drags the ball down to long-on,2026-05-04 13:39:46.880435
24_MIvsPK,May 04,13:29:25,Wankhede Stadium,12,5,Marco Jansen,Quinton de Kock,wide,Jansen gets away and a poor delivery down the leg. Comes round the wicket and bowls a full toss outside leg. de Kock fails to get bat on ball,2026-05-04 13:39:46.880541
24_MIvsPK,May 04,13:29:25,Wankhede Stadium,12,5,Marco Jansen,Quinton de Kock,1 run,goes for the wide yorker. Quinton de Kock has to drag it from well outside off and hits it to mid-wicket,2026-05-04 13:39:46.880668
24_MIvsPK,May 04,13:29:25,Wankhede Stadium,12,6,Marco Jansen,Naman Dhir,1 run,fullish in length on middle; driven hard down to long-off. Just a single for Naman Dhir,2026-05-04 13:39:46.880785
24_MIvsPK,May 04,13:29:25,Wankhede Stadium,13,1,Shashank Singh,Naman Dhir,1 run,fifty for Naman Dhir. This has been excellent knock. Promoted up the order after Mumbai Indians lost couple of quick wickets; he was the aggressor in this partnership but now has taken a backseat. He raises his bat and acknowledges the applause of the home crowd. Fullish delivery around off; Dhir drags the drive off the inner half to long-on,2026-05-04 13:39:46.880897
24_MIvsPK,May 04,13:29:25,Wankhede Stadium,13,2,Shashank Singh,Quinton de Kock,1 run,in the air and safe. Slower ball bowled into the surface; Quinton de Kock has to reach for it and toe-ends the flat-batted hit straight up. Stoinis starts to go for the catch from extra cover but loses sight of the ball because of the light. The ball lands safely behind the non-striker,2026-05-04 13:39:46.881001
24_MIvsPK,May 04,13:29:25,Wankhede Stadium,13,3,Shashank Singh,Naman Dhir,no run,fuller and outside off; Dhir drives sans timing to extra cover,2026-05-04 13:39:46.881103
24_MIvsPK,May 04,13:29:25,Wankhede Stadium,13,4,Shashank Singh,Naman Dhir,out Caught by Xavier Bartlett!! Shashank has this knack of picking wickets. He did it in the previous game against SRH where he picked up Abhishek and Head in the same over. Now breaks this partnership by sending back a well-set Naman Dhir. On a length and outside off,Dhir looks to loft on the up; meets the ball on top of the bounce and creams it flat towards long-off. He did not get the elevation and Bartlett does well to jump up; stretches his hands up and take it over his head. That ball was travelling but Bartlett had it under control. Naman Dhir c Xavier Bartlett b Shashank Singh 50(31) [4s-3 6s-3],2026-05-04 13:39:46.881214
24_MIvsPK,May 04,13:29:25,Wankhede Stadium,13,5,Shashank Singh,Hardik Pandya,1 run,back of a length around off; Hardik drops it beside the pitch on the off-side and crosses over,2026-05-04 13:39:46.881318
24_MIvsPK,May 04,13:29:25,Wankhede Stadium,13,6,Shashank Singh,Quinton de Kock,1 run,angled across the left-hander; Quinton drives square and retains strike,2026-05-04 13:39:46.881422
24_MIvsPK,May 04,13:29:25,Wankhede Stadium,14,1,Arshdeep Singh,Quinton de Kock,FOUR,just eludes the sweeper's run. Full toss outside off; Quinton opens the bat face and slices it square. Priyansh sprints to his right from sweeper but the ball lands wide of him and goes over the rope. There were two fielders in the deep - backward point and sweeper cover. Quinton split them perfectly..,2026-05-04 13:39:46.881534
24_MIvsPK,May 04,13:29:25,Wankhede Stadium,14,2,Arshdeep Singh,Quinton de Kock,wide,slower ball outside off; not within the marker and Quinton lets it pass; collects the wide,2026-05-04 13:39:46.881661
24_MIvsPK,May 04,13:29:25,Wankhede Stadium,14,2,Arshdeep Singh,Quinton de Kock,1 run,low full toss angled across; Quinton drags the drive towards deep mid-wicket,2026-05-04 13:39:46.881863
24_MIvsPK,May 04,13:29:25,Wankhede Stadium,14,3,Arshdeep Singh,Hardik Pandya,1 run,short of length at the body; Hardik does not have the space to free his hands; gets cramped and mistimes the pull to the vacant mid-wicket region,2026-05-04 13:39:46.881968
24_MIvsPK,May 04,13:29:25,Wankhede Stadium,14,4,Arshdeep Singh,Quinton de Kock,no run,full toss slanted across; Quinton winds up for the big mow - moves around in the crease and stays deep; crouches his back knee and swings to the leg-side; the ball sneaks under his bat. He knows he's missed out..,2026-05-04 13:39:46.882085
24_MIvsPK,May 04,13:29:25,Wankhede Stadium,14,5,Arshdeep Singh,Quinton de Kock,1 run,very full delivery outside off; Quinton opens the bat face and slices it over point; just a single,2026-05-04 13:39:46.882199
24_MIvsPK,May 04,13:29:25,Wankhede Stadium,14,6,Arshdeep Singh,Hardik Pandya,1 run,short of length delivery; Hardik does not quite middle the pull but gets it away to deep square leg,2026-05-04 13:39:46.882312
24_MIvsPK,May 04,13:29:25,Wankhede Stadium,15,1,Shashank Singh,Hardik Pandya,no run,fuller and outside off; Hardik drives towards extra cover and Stoinis makes a diving stop,2026-05-04 13:39:46.882425
24_MIvsPK,May 04,13:29:25,Wankhede Stadium,15,2,Shashank Singh,Hardik Pandya,1 run,short and bowled into the wicket; Hardik rides the bounce and chops it to extra cover,2026-05-04 13:39:46.882537
24_MIvsPK,May 04,13:29:25,Wankhede Stadium,15,3,Shashank Singh,Quinton de Kock,SIX,much needed hit for Quinton and Mumbai Indians. There was a quiet period and they needed a move on. Slower ball outside off; plenty of width and Quinton slams it flat over long-off. Flat but high enough to beat a tall Jansen on the rope,2026-05-04 13:39:46.882681
24_MIvsPK,May 04,13:29:25,Wankhede Stadium,15,4,Shashank Singh,Quinton de Kock,SIX,back to back sixes. Was it right to give Shashank an extra over? He had broken the partnership. Length delivery around off; Quinton moves across his stumps and gets under it; heaves it high and well over the deep square leg fence,2026-05-04 13:39:46.882861
24_MIvsPK,May 04,13:29:25,Wankhede Stadium,15,5,Shashank Singh,Quinton de Kock,1 run,on a length and angled across; Quinton drives to deep backward point,2026-05-04 13:39:46.883149
24_MIvsPK,May 04,13:29:25,Wankhede Stadium,15,6,Shashank Singh,Hardik Pandya,1 run,back of a length outside off; Hardik flat-bats it to long-off and retains strike,2026-05-04 13:39:46.883719
24_MIvsPK,May 04,13:29:25,Wankhede Stadium,16,1,Xavier Bartlett,Hardik Pandya,1 run,short of length outside off; does not quite come on and Hardik checks his cut; sends it to sweeper cover,2026-05-04 13:39:46.884076
24_MIvsPK,May 04,13:29:25,Wankhede Stadium,16,2,Xavier Bartlett,Quinton de Kock,1 run,yorker outside off; Quinton can only squeeze it out to sweeper cover,2026-05-04 13:39:46.884305
24_MIvsPK,May 04,13:29:25,Wankhede Stadium,16,3,Xavier Bartlett,Hardik Pandya,1 run,95.5ks off-pace delivery banged into the wicket; Hardik gives everything behind the slap but only toe-ends it towards extra cover. So far so good from Bartlett; just 3 runs,2026-05-04 13:39:46.884436
24_MIvsPK,May 04,13:29:25,Wankhede Stadium,16,4,Xavier Bartlett,Quinton de Kock,1 run,low full toss outside off; Quinton moves across and drives to long-off,2026-05-04 13:39:46.884577
24_MIvsPK,May 04,13:29:25,Wankhede Stadium,16,5,Xavier Bartlett,Hardik Pandya,1 run,nice juicy full toss around knee height; Hardik miscues the heave to deep mid-wicket. He missed out there..,2026-05-04 13:39:46.884829
