match,date,time,venue,over,ball,bowler,batsman,ball_event,event_info,extract_time
24_MIvsPK,May 04,13:29:25,Wankhede Stadium,12,2,Jasprit Bumrah,Prabhsimran Singh,FOUR,and next ball is a a juicy low full-toss outside off; Prabhsimran Singh has it easy as he gets forward and drives it hard and wide of extra-cover; to his left; races away,2026-05-04 13:39:46.900182
24_MIvsPK,May 04,13:29:25,Wankhede Stadium,12,3,Jasprit Bumrah,Prabhsimran Singh,1 run,another low full-toss; was the attempted yorker on off; Prabhsimran Singh gets forward and drives straight to the fielder at sweeper cover,2026-05-04 13:39:46.900285
24_MIvsPK,May 04,13:29:25,Wankhede Stadium,12,4,Jasprit Bumrah,Shreyas Iyer,SIX,what a shot that is. Look at the faces in the crowd. It's short outside off; Shreyas Iyer goes on the back foot and nails the pull over deep mid-wicket; went 10 rows back into the crowd. The faces in the crowd tell a story - they can't believe what is happening,2026-05-04 13:39:46.900393
24_MIvsPK,May 04,13:29:25,Wankhede Stadium,12,5,Jasprit Bumrah,Shreyas Iyer,wide,slower-ball and short outside off; too high as Shreyas Iyer lets it go. Over the head,2026-05-04 13:39:46.900501
24_MIvsPK,May 04,13:29:25,Wankhede Stadium,12,5,Jasprit Bumrah,Shreyas Iyer,1 run,seam-up and full outside off; Shreyas Iyer gets forward to drive; the thick outside-edge could've been a catch to short third man but he is back and it's one even as Deepak Chahar slides to his left; he fumbles but it's just one,2026-05-04 13:39:46.900604
24_MIvsPK,May 04,13:29:25,Wankhede Stadium,12,6,Jasprit Bumrah,Prabhsimran Singh,1 run,low full-toss on middle; Prabhsimran Singh gets forward and flicks to deep square-leg,2026-05-04 13:39:46.900726
24_MIvsPK,May 04,13:29:25,Wankhede Stadium,13,1,Hardik Pandya,Prabhsimran Singh,FOUR,it's a half-volley and Prabhsimran Singh is in the mood tonight. He gets forward and smashes it straight down the ground. Always four there,2026-05-04 13:39:46.900831
24_MIvsPK,May 04,13:29:25,Wankhede Stadium,13,2,Hardik Pandya,Prabhsimran Singh,SIX,into the crowd. Full outside off; Prabhsimran Singh gets forward and lofts through the line; it flies all the way over long-off. Into the crowd. He just relied on timing,2026-05-04 13:39:46.900936
24_MIvsPK,May 04,13:29:25,Wankhede Stadium,13,3,Hardik Pandya,Prabhsimran Singh,wide,good short delivery. It's a wide. It's over the head of Prabhsimran Singh as he tries to pull; flies over the head and it's a wide,2026-05-04 13:39:46.901204
24_MIvsPK,May 04,13:29:25,Wankhede Stadium,13,3,Hardik Pandya,Prabhsimran Singh,1 run,full on off; Prabhsimran Singh gets forward and drives it hard and straight to long-off,2026-05-04 13:39:46.901423
24_MIvsPK,May 04,13:29:25,Wankhede Stadium,13,4,Hardik Pandya,Shreyas Iyer,1 run,good yorker on off; Shreyas Iyer gets forward and digs it out; to the vacant cover-point area. Easy single,2026-05-04 13:39:46.901580
24_MIvsPK,May 04,13:29:25,Wankhede Stadium,13,5,Hardik Pandya,Prabhsimran Singh,1 run,full on off; Prabhsimran Singh wants to drive through extra-cover; but the ball comes off a thick inside half and rolls to long-on,2026-05-04 13:39:46.901720
24_MIvsPK,May 04,13:29:25,Wankhede Stadium,13,6,Hardik Pandya,Shreyas Iyer,1 run,yorker length and just outside off; Shreyas Iyer digs it out to long-on,2026-05-04 13:39:46.901826
24_MIvsPK,May 04,13:29:25,Wankhede Stadium,14,1,Jasprit Bumrah,Shreyas Iyer,FOUR,slower-ball and short of length outside off; Shreyas Iyer goes on the back foot and pulls it wide of deep square-leg; there was a fielder on the fence but it was well wide of the man,2026-05-04 13:39:46.901964
24_MIvsPK,May 04,13:29:25,Wankhede Stadium,14,2,Jasprit Bumrah,Shreyas Iyer,1 run,yorker length and sliding down leg; Shreyas Iyer flicks to deep backward square-leg; straight to the fielder,2026-05-04 13:39:46.902070
24_MIvsPK,May 04,13:29:25,Wankhede Stadium,14,3,Jasprit Bumrah,Prabhsimran Singh,1 run,slower-ball and short outside off; Prabhsimran Singh goes on the back foot and opens the face of the bat to glide it; Chahar runs in from fine third man to catch but it falls short,2026-05-04 13:39:46.902171
24_MIvsPK,May 04,13:29:25,Wankhede Stadium,14,4,Jasprit Bumrah,Shreyas Iyer,FOUR,low full-toss on middle; Shreyas Iyer is on fire. 50 for him. He gets forward and flicks wide of mid-wicket; runs away for four. Any erring in line and length; and it's four,2026-05-04 13:39:46.902303
24_MIvsPK,May 04,13:29:25,Wankhede Stadium,14,5,Jasprit Bumrah,Shreyas Iyer,1 run,short of length and nips back in to middle; Shreyas Iyer goes on the back foot and nudges it; on to the thigh pad as the thick inside-edge; rolls to the vacant forward short-leg area,2026-05-04 13:39:46.902408
24_MIvsPK,May 04,13:29:25,Wankhede Stadium,14,6,Jasprit Bumrah,Prabhsimran Singh,no run,slower-ball and short of length on the stumps; Prabhsimran Singh makes room to pull; misses. Bounces over the stumps. A rare dot,2026-05-04 13:39:46.902508
24_MIvsPK,May 04,13:29:25,Wankhede Stadium,15,1,Shardul Thakur,Shreyas Iyer,SIX,Naman Dhir the man at deep mid-wicket. He blames the lights. Sullen faces in the MI camp. They are shell-shocked. It's a catch and it's travelling at him with pace. He goes reverse-cup and the ball just about touches the fingertips and goes over. He was going back and should've caught that. Like the others; as the ball goes over; he has a look at the lights and gestures he didn't pick that,2026-05-04 13:39:46.902617
24_MIvsPK,May 04,13:29:25,Wankhede Stadium,15,2,Shardul Thakur,Shreyas Iyer,SIX,into the third-tier at deep mid-wicket. A half-volley on off; Shreyas Iyer with a clean clean loft. He gets forward and lofts; the ball sails over the fence. What a shot,2026-05-04 13:39:46.902756
24_MIvsPK,May 04,13:29:25,Wankhede Stadium,15,3,Shardul Thakur,Shreyas Iyer,out Caught by Naman Dhir!! Now Dhir makes amends for that drop. He dives forward at deep mid-wicket and catches this. The round the wicket angle works for Shardul Thakur. It's a half-volley on the legs,Shreyas Iyer shuffles across and flicks; it's flat and going down; Dhir dives forward and takes it with two hands. He doesn't celebrate. Some joy for MI. Shreyas Iyer c Naman Dhir b Shardul Thakur 66(35) [4s-5 6s-4],2026-05-04 13:39:46.902915
24_MIvsPK,May 04,13:29:25,Wankhede Stadium,15,4,Shardul Thakur,Marcus Stoinis,wide,way too high this short delivery and Marcus Stoinis lets it go. Called a wide,2026-05-04 13:39:46.903033
24_MIvsPK,May 04,13:29:25,Wankhede Stadium,15,4,Shardul Thakur,Marcus Stoinis,1 run,low full-toss on middle; Marcus Stoinis gets forward to drive to long-on,2026-05-04 13:39:46.903137
24_MIvsPK,May 04,13:29:25,Wankhede Stadium,15,5,Shardul Thakur,Prabhsimran Singh,1 run,low full-toss outside off; Prabhsimran Singh gets forward and drives it wide of long-off,2026-05-04 13:39:46.903240
24_MIvsPK,May 04,13:29:25,Wankhede Stadium,15,6,Shardul Thakur,Marcus Stoinis,1 run,full on middle; Stoinis gets forward and drills it hard and straight to long-on,2026-05-04 13:39:46.903430
24_MIvsPK,May 04,13:29:25,Wankhede Stadium,16,1,Deepak Chahar,Marcus Stoinis,wide,way outside off; the slower-ball and Marcus Stoinis cuts and misses; called a wide,2026-05-04 13:39:46.903587
24_MIvsPK,May 04,13:29:25,Wankhede Stadium,16,1,Deepak Chahar,Marcus Stoinis,no run,another slower-ball outside off; short of length and Marcus Stoinis goes on the back foot to cut; misses; this is well inside the tramline; so a dot,2026-05-04 13:39:46.903754
24_MIvsPK,May 04,13:29:25,Wankhede Stadium,16,2,Deepak Chahar,Marcus Stoinis,FOUR,low full-toss outside off; Marcus Stoinis gets forward to drive and the thick inside-edge misses off-stump and goes well wide of Quinton de Kock to his left; runs away fine for four,2026-05-04 13:39:46.903929
24_MIvsPK,May 04,13:29:25,Wankhede Stadium,16,3,Deepak Chahar,Marcus Stoinis,wide,way outside off; seam-up and past the tramline outside off; left alone and wide called,2026-05-04 13:39:46.904036
24_MIvsPK,May 04,13:29:25,Wankhede Stadium,16,3,Deepak Chahar,Marcus Stoinis,FOUR,PBKS thump MI at the Wankhede. Shreyas and the PBKS fans are so happy. This is a a juicy low full-toss outside off; Marcus Stoinis gets forward and drives; more off the thick inside half; beats long-on to his right; needed a dive but the fielder didn't put that,2026-05-04 13:39:46.904142
