match,date,time,venue,over,ball,bowler,batsman,ball_event,event_info,extract_time
03_RRvsCSK,May 04,13:07:56,Barsapara Cricket Stadium,0,1,Jofra Archer,Sanju Samson,no run,138.6kph; Samson backs away a bit to drive with hard hands. The full ball shapes in a bit and the batter ends up inside-edging it towards silly mid-on,2026-05-04 13:10:19.970441
03_RRvsCSK,May 04,13:07:56,Barsapara Cricket Stadium,0,2,Jofra Archer,Sanju Samson,leg byes,1 run; 140.1kph; another inswinger; pad-lined; Samson fails to make contact with his flick. The ball dribbles towards square leg off his pad and CSK get off the mark,2026-05-04 13:10:19.972750
03_RRvsCSK,May 04,13:07:56,Barsapara Cricket Stadium,0,3,Jofra Archer,Ruturaj Gaikwad,1 run,Ruturaj Gaikwad shuffles a bit; closes the bat-face to gently nudge this length ball towards midwicket,2026-05-04 13:10:19.972992
03_RRvsCSK,May 04,13:07:56,Barsapara Cricket Stadium,0,4,Jofra Archer,Sanju Samson,no run,beaten! Pitched up delivery outside off; not much feet movement from Samson who looks to drive through the covers. The ball whizzes past the outside edge,2026-05-04 13:10:19.973193
03_RRvsCSK,May 04,13:07:56,Barsapara Cricket Stadium,0,5,Jofra Archer,Sanju Samson,FOUR,edge and four! Full again around off; Samson - with cemented feet - drives hard. Gets a fat outside edge that goes between the keeper and the short third man fielder. Races away to the third man fence. No slip; but don't think it would have gone to first slip,2026-05-04 13:10:19.973386
03_RRvsCSK,May 04,13:07:56,Barsapara Cricket Stadium,0,6,Jofra Archer,Sanju Samson,1 run,139.6kph; decks in from a short of a good length; Samson turns it to backward square leg off the inner part of the bat,2026-05-04 13:10:19.973572
03_RRvsCSK,May 04,13:07:56,Barsapara Cricket Stadium,1,1,Nandre Burger,Sanju Samson,1 run,over the wicket; length ball on off; Samson plays with soft hands to tap it towards point,2026-05-04 13:10:19.973837
03_RRvsCSK,May 04,13:07:56,Barsapara Cricket Stadium,1,2,Nandre Burger,Ruturaj Gaikwad,no run,140.5kph; fullish ball on off; defensively pushed to cover-point,2026-05-04 13:10:19.974103
03_RRvsCSK,May 04,13:07:56,Barsapara Cricket Stadium,1,3,Nandre Burger,Ruturaj Gaikwad,leg byes,FOUR; 141.6kph; Burger errs with his line. Fraction short; hint of inswing; the line is too straight though. Gaikwad misses the glance and the ball runs away to the fine leg fence off the thigh,2026-05-04 13:10:19.974375
03_RRvsCSK,May 04,13:07:56,Barsapara Cricket Stadium,1,4,Nandre Burger,Ruturaj Gaikwad,no run,138.9kph; nips in a shade from a length; beats Gaikwad's defence on the inside edge and hits him on the pad,2026-05-04 13:10:19.974630
03_RRvsCSK,May 04,13:07:56,Barsapara Cricket Stadium,1,5,Nandre Burger,Ruturaj Gaikwad,wide,139.1kph; wayward from Burger. Inswinger alright but the full ball is down leg; Gaikwad swings and misses,2026-05-04 13:10:19.975945
03_RRvsCSK,May 04,13:07:56,Barsapara Cricket Stadium,1,5,Nandre Burger,Ruturaj Gaikwad,1 run,yes-no-yes. On a length and around off; nips in a bit; Gaikwad plays with soft hands. The ball dribbles gently towards the keeper off the inside edge and Samson calls his partner through for a quick single,2026-05-04 13:10:19.976147
03_RRvsCSK,May 04,13:07:56,Barsapara Cricket Stadium,1,6,Nandre Burger,Sanju Samson,out Bowled!! Knocked him over! The off-stump has been removed. Cracking delivery from Nandre Burger and he's rightly pumped. Jumps and punches the air in delight. 140.2kph,just a fraction fuller than a good length and he gets it to move away from the right-hander. Samson shapes to play across the line and misses it altogether as he doesn't account for the movement. The ball crashes into the off-stump and Samson departs for a low score on his debut for CSK. Sanju Samson b Nandre Burger 6(7) [4s-1],2026-05-04 13:10:19.976348
03_RRvsCSK,May 04,13:07:56,Barsapara Cricket Stadium,2,1,Jofra Archer,Ruturaj Gaikwad,no run,Gaikwad is half-forward to push-drive and inside-edges this length ball to the right of the bowler,2026-05-04 13:10:19.976537
03_RRvsCSK,May 04,13:07:56,Barsapara Cricket Stadium,2,2,Jofra Archer,Ruturaj Gaikwad,no run,fuller outside off; driven crisply off the front foot but he can't find the gap through the covers,2026-05-04 13:10:19.976749
03_RRvsCSK,May 04,13:07:56,Barsapara Cricket Stadium,2,3,Jofra Archer,Ruturaj Gaikwad,no run,full on off; knocked to mid-on,2026-05-04 13:10:19.976936
03_RRvsCSK,May 04,13:07:56,Barsapara Cricket Stadium,2,4,Jofra Archer,Ruturaj Gaikwad,no run,Gaikwad exposes all his stumps by backing away now. Jofra Archer targets the stumps from a short of length and that's been chopped to backward point off the under-edge. Four dots in a row,2026-05-04 13:10:19.977124
03_RRvsCSK,May 04,13:07:56,Barsapara Cricket Stadium,2,5,Jofra Archer,Ruturaj Gaikwad,FOUR,overpitched outside off and Ruturaj Gaikwad latches onto it. The CSK captain leans forward and caresses the drive through cover-point. First boundary for Gaikwad and that should get him going,2026-05-04 13:10:19.977329
03_RRvsCSK,May 04,13:07:56,Barsapara Cricket Stadium,2,6,Jofra Archer,Ruturaj Gaikwad,wide,137kph; inswinger that further seams down leg; Gaikwad heaves and misses. Dhruv Jurel dives to his left to make a good stop; saves four there,2026-05-04 13:10:19.977524
03_RRvsCSK,May 04,13:07:56,Barsapara Cricket Stadium,2,6,Jofra Archer,Ruturaj Gaikwad,out Bowled!! Gone! CSK lose both their openers cheaply. It's full,quick and on the stumps at 143.3kph; Gaikwad backs away to access the off-side. Moves a tad too much and misses a straight ball. Hears the death rattle and walks back to the dressing room. CSK rocked early. Ruturaj Gaikwad b Jofra Archer 6(11) [4s-1],2026-05-04 13:10:19.977753
03_RRvsCSK,May 04,13:07:56,Barsapara Cricket Stadium,3,1,Nandre Burger,Ayush Mhatre,out Caught by Dhruv Jurel!! Burger is celebrating,the umpire is unmoved and RR have reviewed it. Head-high bouncer from Burger. Gets big on the batter who pulls awkwardly. No room on offer as well. It's close to the gloves. Let's see what UltraEdge says. Big spike on UltraEdge when the ball is near the right thumb. So; it's off the glove. Successful review and Mohit Krishnadas has to overturn his decision. Ayush Mhatre departs for a golden duck and CSK are in a spot of bother. Ayush Mhatre c Dhruv Jurel b Nandre Burger 0(1),2026-05-04 13:10:19.978022
03_RRvsCSK,May 04,13:07:56,Barsapara Cricket Stadium,3,2,Nandre Burger,Sarfaraz Khan,no run,143.7kph; length ball on off; defended into off. No hat-trick for Burger,2026-05-04 13:10:19.978260
03_RRvsCSK,May 04,13:07:56,Barsapara Cricket Stadium,3,3,Nandre Burger,Sarfaraz Khan,no run,139.8kph; nip-backer; Sarfaraz Khan hangs back in the crease and is surprised by the inward movement. Gets beaten on the inside edge and is struck outside the line of the off-stump,2026-05-04 13:10:19.978532
03_RRvsCSK,May 04,13:07:56,Barsapara Cricket Stadium,3,4,Nandre Burger,Sarfaraz Khan,FOUR,Sarfaraz Khan gets off the mark with a confident pull shot! Short ball; hip-high; Sarfaraz spots the length early; swivels and pulls over midwicket,2026-05-04 13:10:19.979133
03_RRvsCSK,May 04,13:07:56,Barsapara Cricket Stadium,3,5,Nandre Burger,Sarfaraz Khan,SIX,wow! Sarfaraz Khan gives the charge to the bowler. Dances down the pitch; moves leg-side in the process and swings across the line to flick this length ball over backward square leg. The ball has the wings to go over the boundary rope,2026-05-04 13:10:19.980575
03_RRvsCSK,May 04,13:07:56,Barsapara Cricket Stadium,3,6,Nandre Burger,Sarfaraz Khan,wide,there's still some inward shape for Burger; the line is down leg though. Sarfaraz flicks and misses,2026-05-04 13:10:19.981830
03_RRvsCSK,May 04,13:07:56,Barsapara Cricket Stadium,3,6,Nandre Burger,Sarfaraz Khan,no run,RR appeal; turned down by the umpire and RR decide against the review. Another superb delivery from Burger. Pacy length ball; Sarfaraz Khan ends up playing outside the line of it as he's stuck in the crease. The ball beats the inside edge; hits the pad before going into the keeper's mitts. Ball-tracking shows it to be going over the off-stump,2026-05-04 13:10:19.982271
03_RRvsCSK,May 04,13:07:56,Barsapara Cricket Stadium,4,1,Brijesh Sharma,Matthew Short,no run,full ball; pushed back to the bowler,2026-05-04 13:10:19.982573
03_RRvsCSK,May 04,13:07:56,Barsapara Cricket Stadium,4,2,Brijesh Sharma,Matthew Short,wide,inswinger down leg; Short flicks and misses,2026-05-04 13:10:19.982848
03_RRvsCSK,May 04,13:07:56,Barsapara Cricket Stadium,4,2,Brijesh Sharma,Matthew Short,no run,117.2kph; full on off; Short pushes to cover,2026-05-04 13:10:19.983091
03_RRvsCSK,May 04,13:07:56,Barsapara Cricket Stadium,4,3,Brijesh Sharma,Matthew Short,no run,132.6kph; width on offer; Short cuts hard but straight to backward point,2026-05-04 13:10:19.983381
03_RRvsCSK,May 04,13:07:56,Barsapara Cricket Stadium,4,4,Brijesh Sharma,Matthew Short,no run,pace-off delivery; Short gets forward and pushes to cover-point,2026-05-04 13:10:19.983508
03_RRvsCSK,May 04,13:07:56,Barsapara Cricket Stadium,4,5,Brijesh Sharma,Matthew Short,1 run,short of length; Short pulls to deep backward square leg,2026-05-04 13:10:19.983616
03_RRvsCSK,May 04,13:07:56,Barsapara Cricket Stadium,4,6,Brijesh Sharma,Sarfaraz Khan,FOUR,130.6kph; short ball down leg; Sarfaraz Khan goes after it with a pull shot. Hits him high on the bat and bottom hand comes off the handle. But he's hit it well wide of the man at 45. Sarfaraz has come out all guns blazing,2026-05-04 13:10:19.983753
03_RRvsCSK,May 04,13:07:56,Barsapara Cricket Stadium,5,1,Sandeep Sharma,Matthew Short,1 run,102.6kph; Sandeep starts with a slower ball on the pads; Short flicks to backward square leg,2026-05-04 13:10:19.983866
03_RRvsCSK,May 04,13:07:56,Barsapara Cricket Stadium,5,2,Sandeep Sharma,Sarfaraz Khan,1 run,120.4kph; good length on the stumps; Sarfaraz Khan turns it to square leg,2026-05-04 13:10:19.983982
03_RRvsCSK,May 04,13:07:56,Barsapara Cricket Stadium,5,3,Sandeep Sharma,Matthew Short,out Caught by Yashasvi Jaiswal!! Soft dismissal. 122.6kph,innocuous length ball on leg; Short is early to clip and chips it straight to midwicket. Jaiswal takes the catch but he isn't happy with something - probably didn't spot it as well as he would have liked to. CSK lose their fourth wicket inside the 6th over. Matthew Short c Yashasvi Jaiswal b Sandeep Sharma 2(7),2026-05-04 13:10:19.984094
03_RRvsCSK,May 04,13:07:56,Barsapara Cricket Stadium,5,4,Sandeep Sharma,Kartik Sharma,2 runs,122.5kph; short ball; Kartik Sharma gets off the mark in IPL by walking across and pulling it to deep square leg,2026-05-04 13:10:19.984201
03_RRvsCSK,May 04,13:07:56,Barsapara Cricket Stadium,5,5,Sandeep Sharma,Kartik Sharma,1 run,121.3kph; full on off; Kartik Sharma knocks it along the ground to long-on,2026-05-04 13:10:19.984304
03_RRvsCSK,May 04,13:07:56,Barsapara Cricket Stadium,5,6,Sandeep Sharma,Sarfaraz Khan,no run,slower ball to end the over. Full on off; Sarfaraz spots it late and decides to defend it back to the bowler,2026-05-04 13:10:19.984408
03_RRvsCSK,May 04,13:07:56,Barsapara Cricket Stadium,6,1,Ravi Bishnoi,Kartik Sharma,no run,over the wicket; full delivery drifting in a bit; driven back to the bowler,2026-05-04 13:10:19.984514
03_RRvsCSK,May 04,13:07:56,Barsapara Cricket Stadium,6,2,Ravi Bishnoi,Kartik Sharma,1 run,102.8kph; quick and on a length; tapped towards cover for a quick single,2026-05-04 13:10:19.984625
03_RRvsCSK,May 04,13:07:56,Barsapara Cricket Stadium,6,3,Ravi Bishnoi,Sarfaraz Khan,1 run,102.3kph; fraction short; Sarfaraz Khan gets low and wristily pulls it to deep midwicket,2026-05-04 13:10:19.984763
03_RRvsCSK,May 04,13:07:56,Barsapara Cricket Stadium,6,4,Ravi Bishnoi,Kartik Sharma,1 run,101.7kph; darting in on a short of length; worked through midwicket,2026-05-04 13:10:19.984863
03_RRvsCSK,May 04,13:07:56,Barsapara Cricket Stadium,6,5,Ravi Bishnoi,Sarfaraz Khan,1 run,103.5kph; width on offer; Sarfaraz cuts to deep backward point,2026-05-04 13:10:19.984963
03_RRvsCSK,May 04,13:07:56,Barsapara Cricket Stadium,6,6,Ravi Bishnoi,Kartik Sharma,SIX,104.4kph; a drag down from Ravi Bishnoi and Kartik Sharma puts it away. On seeing the length on the shorter side; Kartik goes on the back foot to play an aerial pull shot. Gets a lot of height clears the fence as well as he dispatches it over deep square leg,2026-05-04 13:10:19.985067
03_RRvsCSK,May 04,13:07:56,Barsapara Cricket Stadium,7,1,Ravindra Jadeja,Sarfaraz Khan,no run,92.7kph; holds a bit on a length outside off; chopped to backward point,2026-05-04 13:10:19.985188
03_RRvsCSK,May 04,13:07:56,Barsapara Cricket Stadium,7,2,Ravindra Jadeja,Sarfaraz Khan,out Lbw!! Sarfaraz Khan has been adjudged lbw. He has a chat with Kartik Sharma and reviews. 89.3kph,a bit slower from Jadeja and Sarfaraz gets low to play a premeditated sweep shot. He gets really low and fails to make contact. Gets hit around the right arm - just below the shoulder. UltraEdge confirms no bat. Over to ball-tracking and it's three reds! Jadeja strikes with his second ball and he's removed Sarfaraz who was looking to be aggressive. It was bowled slower. The ball-tracking; however; predicted the ball go on straight. CSK have now lost half their side. Sarfaraz Khan lbw b Ravindra Jadeja 17(12) [4s-2 6s-1],2026-05-04 13:10:19.985427
03_RRvsCSK,May 04,13:07:56,Barsapara Cricket Stadium,7,3,Ravindra Jadeja,Shivam Dube,SIX,Dube needs no sighters. It's full and in the slot from over the wicket. Dube's eyes light up on seeing that. Gets under it as he bends his back leg and bludgeons it over long-on for a 75m six,2026-05-04 13:10:19.985628
03_RRvsCSK,May 04,13:07:56,Barsapara Cricket Stadium,7,4,Ravindra Jadeja,Shivam Dube,no run,Jadeja pulls his length back and the line is marginally outside off; Dube wafts and misses,2026-05-04 13:10:19.985809
03_RRvsCSK,May 04,13:07:56,Barsapara Cricket Stadium,7,5,Ravindra Jadeja,Shivam Dube,no run,dabbed to short third man,2026-05-04 13:10:19.985959
03_RRvsCSK,May 04,13:07:56,Barsapara Cricket Stadium,7,6,Ravindra Jadeja,Shivam Dube,out Caught by Ravi Bishnoi!! Ravindra Jadeja gets his man! Second wicket in the over for the former CSKian. 98.2kph,it's on a fullish length wide of off. Dube tries to go after it with a lofted hit but the timing goes awry. Hits it straight down long-off's throat and Dube is distraught as he walks back. Shivam Dube c Ravi Bishnoi b Ravindra Jadeja 6(4) [6s-1],2026-05-04 13:10:19.986142
03_RRvsCSK,May 04,13:07:56,Barsapara Cricket Stadium,8,1,Ravi Bishnoi,Kartik Sharma,2 runs,full outside off; driven along the ground to long-off,2026-05-04 13:10:19.986286
03_RRvsCSK,May 04,13:07:56,Barsapara Cricket Stadium,8,2,Ravi Bishnoi,Kartik Sharma,no run,googly; Kartik Sharma makes room to cut it straight to backward point,2026-05-04 13:10:19.986390
03_RRvsCSK,May 04,13:07:56,Barsapara Cricket Stadium,8,3,Ravi Bishnoi,Kartik Sharma,1 run,103.7kph; full outside off; pushed towards cover,2026-05-04 13:10:19.986491
03_RRvsCSK,May 04,13:07:56,Barsapara Cricket Stadium,8,4,Ravi Bishnoi,Jamie Overton,no run,94.3kph; flat ball on a length; defended back to the bowler,2026-05-04 13:10:19.986608
03_RRvsCSK,May 04,13:07:56,Barsapara Cricket Stadium,8,5,Ravi Bishnoi,Jamie Overton,1 run,94.7kph; full delivery; Jamie Overton gets off the mark by flicking it to midwicket,2026-05-04 13:10:19.986828
03_RRvsCSK,May 04,13:07:56,Barsapara Cricket Stadium,8,6,Ravi Bishnoi,Kartik Sharma,1 run,103.8kph; cut to the left of deep backward point where Vaibhav makes a sliding stop,2026-05-04 13:10:19.987039
03_RRvsCSK,May 04,13:07:56,Barsapara Cricket Stadium,9,1,Ravindra Jadeja,Kartik Sharma,no run,91.9kph; lands on a length around off-middle and spins past the defensive outside edge of Kartik,2026-05-04 13:10:19.987154
03_RRvsCSK,May 04,13:07:56,Barsapara Cricket Stadium,9,2,Ravindra Jadeja,Kartik Sharma,no run,92.3kph; straighter line and Kartik Sharma defends off the front foot,2026-05-04 13:10:19.987261
03_RRvsCSK,May 04,13:07:56,Barsapara Cricket Stadium,9,3,Ravindra Jadeja,Kartik Sharma,1 run,91.7kph; Kartik Sharma is half-forward to push this fullish ball towards backward point. Overton calls for a risky single and luckily for him; the throw isn't accurate,2026-05-04 13:10:19.987370
03_RRvsCSK,May 04,13:07:56,Barsapara Cricket Stadium,9,4,Ravindra Jadeja,Jamie Overton,no run,there's a slip in place now. 94.4kph; full on off; blocked,2026-05-04 13:10:19.987482
03_RRvsCSK,May 04,13:07:56,Barsapara Cricket Stadium,9,5,Ravindra Jadeja,Jamie Overton,SIX,95.6kph; Overton breaks the shackles with a maximum. He shimmies down the track; moves leg-side in the process and makes superb contact as he lofts this fullish ball over long-off,2026-05-04 13:10:19.987596
03_RRvsCSK,May 04,13:07:56,Barsapara Cricket Stadium,9,6,Ravindra Jadeja,Jamie Overton,1 run,quicker and shorter; turned to square leg,2026-05-04 13:10:19.987754
03_RRvsCSK,May 04,13:07:56,Barsapara Cricket Stadium,10,1,Brijesh Sharma,Jamie Overton,1 run,128ks short of length delivery; Overton ekes out an inside-edge as he attempts the tuck; the ball hits the back thigh and drops to the off-side. Overton suggests there was a bit of extra bounce,2026-05-04 13:10:19.987869
03_RRvsCSK,May 04,13:07:56,Barsapara Cricket Stadium,10,2,Brijesh Sharma,Kartik Sharma,wide,slower ball but sprayed down leg; Kartik tries to help it along but too far for him,2026-05-04 13:10:19.988028
03_RRvsCSK,May 04,13:07:56,Barsapara Cricket Stadium,10,2,Brijesh Sharma,Kartik Sharma,2 runs,off-pace delivery; Kartik nudges it into the vacant mid-wicket pocket and races back for the second,2026-05-04 13:10:19.988259
03_RRvsCSK,May 04,13:07:56,Barsapara Cricket Stadium,10,3,Brijesh Sharma,Kartik Sharma,out Lbw!! CSK slip further. Maiden IPL wicket for Brijesh Sharma. Riyan Parag can do no wrong today. He brings back Brijesh and gets a wicket. Full and straight delivery,Kartik falls over as he attempts the flick and fails to make contact; struck in line with the stumps and ball-tracking showed it to be smashing into leg-stump. We are into the bowlers now.. Kartik Sharma lbw b Brijesh Sharma 18(15) [6s-1],2026-05-04 13:10:19.988408
03_RRvsCSK,May 04,13:07:56,Barsapara Cricket Stadium,10,4,Brijesh Sharma,Noor Ahmad,no run,132.4ks short of length delivery; Noor rides the bounce and fends it down the pitch,2026-05-04 13:10:19.988520
03_RRvsCSK,May 04,13:07:56,Barsapara Cricket Stadium,10,5,Brijesh Sharma,Noor Ahmad,no run,131.1ks bouncer and Noor decides to take it on; but the ball keeps climbing and flies over the top-edge`,2026-05-04 13:10:19.988629
03_RRvsCSK,May 04,13:07:56,Barsapara Cricket Stadium,10,6,Brijesh Sharma,Noor Ahmad,no run,105.7ks slower ball around off; Noor carefully defends to point,2026-05-04 13:10:19.988773
03_RRvsCSK,May 04,13:07:56,Barsapara Cricket Stadium,11,1,Ravindra Jadeja,Jamie Overton,1 run,95.6ks fullish delivery around off; Overton drives to long-off,2026-05-04 13:10:19.988878
03_RRvsCSK,May 04,13:07:56,Barsapara Cricket Stadium,11,2,Ravindra Jadeja,Noor Ahmad,1 run,91.7ks tossed up on off; Noor eases it to long-off,2026-05-04 13:10:19.988979
03_RRvsCSK,May 04,13:07:56,Barsapara Cricket Stadium,11,3,Ravindra Jadeja,Jamie Overton,no run,sliding in with the angle; Overton misses the tuck and is struck on the under side of the thigh pad,2026-05-04 13:10:19.989080
03_RRvsCSK,May 04,13:07:56,Barsapara Cricket Stadium,11,4,Ravindra Jadeja,Jamie Overton,2 runs,drifting in as Overton moves away; worked in front of square on the leg-side and the pair scamper back for the second,2026-05-04 13:10:19.989181
03_RRvsCSK,May 04,13:07:56,Barsapara Cricket Stadium,11,5,Ravindra Jadeja,Jamie Overton,leg byes,1 run; darted down leg; Overton misses the pull and the ball deflects off the thigh pad to short fine,2026-05-04 13:10:19.989283
03_RRvsCSK,May 04,13:07:56,Barsapara Cricket Stadium,11,6,Ravindra Jadeja,Noor Ahmad,no run,83ks very slow and bit of away turn; Noor reaches out and pokes it towards short third,2026-05-04 13:10:19.989383
03_RRvsCSK,May 04,13:07:56,Barsapara Cricket Stadium,12,1,Jofra Archer,Jamie Overton,3 runs,fullish delivery outside off; Overton leans forward and eases it through extra cover. Nothing but a push and the ball is racing towards the fence. Parag hunts it down from mid-off and saves a run,2026-05-04 13:10:19.989485
03_RRvsCSK,May 04,13:07:56,Barsapara Cricket Stadium,12,2,Jofra Archer,Noor Ahmad,no run,full pitcher close to off; Noor pushes it firmly to mid-off,2026-05-04 13:10:19.989585
03_RRvsCSK,May 04,13:07:56,Barsapara Cricket Stadium,12,3,Jofra Archer,Noor Ahmad,no run,shortens the length and gets it to move away; Noor is nowhere close to connecting with the pull shot,2026-05-04 13:10:19.989719
03_RRvsCSK,May 04,13:07:56,Barsapara Cricket Stadium,12,4,Jofra Archer,Noor Ahmad,no run,pacy short ball - 141.8ks banged into the pitch; Noor takes it on and goes for the pull instinctively; but the ball flies over the top-edge and Dhruv Jurel has to leap full stretch to glove that,2026-05-04 13:10:19.989821
03_RRvsCSK,May 04,13:07:56,Barsapara Cricket Stadium,12,5,Jofra Archer,Noor Ahmad,out Caught by Dhruv Jurel!! CSK are eight down. Archer comes back and picks up his second. He set-up Noor smartly there. One full pitcher,couple of short balls and now the sucker delivery - full and outside off; Noor goes for a booming drive but he's not close to the ball; stays leg-side and has to reach; only manages an outside-edge and Jurel does the rest behind the stumps. CSK in danger of being bowled out inside 20 overs. Noor Ahmad c Dhruv Jurel b Jofra Archer 1(9),2026-05-04 13:10:19.989931
03_RRvsCSK,May 04,13:07:56,Barsapara Cricket Stadium,12,6,Jofra Archer,Matt Henry,no run,144.6ks back of a length delivery outside off; Henry throws his bat and is beaten on the outside-edge,2026-05-04 13:10:19.990037
03_RRvsCSK,May 04,13:07:56,Barsapara Cricket Stadium,13,1,Nandre Burger,Jamie Overton,2 runs,137.3ks angled in from round the wicket; Overton works it with soft hands to mid-wicket and Henry rushes back for the second,2026-05-04 13:10:19.990140
03_RRvsCSK,May 04,13:07:56,Barsapara Cricket Stadium,13,2,Nandre Burger,Jamie Overton,no run,backs away and Burger follows him with a back of a length delivery; defended back to Burger,2026-05-04 13:10:19.990241
03_RRvsCSK,May 04,13:07:56,Barsapara Cricket Stadium,13,3,Nandre Burger,Jamie Overton,no run,137.5ks back of a length outside off; Overton sees the width and throws the kitchen sink; loses his grip on the bat and also does not make contact,2026-05-04 13:10:19.990341
03_RRvsCSK,May 04,13:07:56,Barsapara Cricket Stadium,13,4,Nandre Burger,Jamie Overton,no run,uhhh! 138.2ks back of a length delivery and rears up sharply; Overton is surprised by the extra bounce; the ball goes past the bat and hits the back arm. That's going to hurt..,2026-05-04 13:10:19.990443
03_RRvsCSK,May 04,13:07:56,Barsapara Cricket Stadium,13,5,Nandre Burger,Jamie Overton,wide,sprays the short ball down leg; Overton swivels and does not connect with the pull,2026-05-04 13:10:19.990543
03_RRvsCSK,May 04,13:07:56,Barsapara Cricket Stadium,13,5,Nandre Burger,Jamie Overton,no run,140.5ks good length ball on off; Overton defends towards cover and does not risk a quick single,2026-05-04 13:10:19.990693
03_RRvsCSK,May 04,13:07:56,Barsapara Cricket Stadium,13,6,Nandre Burger,Jamie Overton,1 run,short and banged into the surface; Overton toe-ends the pull through mid-wicket and retains strike,2026-05-04 13:10:19.990844
03_RRvsCSK,May 04,13:07:56,Barsapara Cricket Stadium,14,1,Brijesh Sharma,Jamie Overton,1 run,117.2ks slower delivery around off; Overton eases it to sweeper cover,2026-05-04 13:10:19.990950
03_RRvsCSK,May 04,13:07:56,Barsapara Cricket Stadium,14,2,Brijesh Sharma,Matt Henry,no run,126.6ks bouncer outside off; Henry goes for the pull and has to fetch it; misses and the ball flies over the top-edge,2026-05-04 13:10:19.991049
03_RRvsCSK,May 04,13:07:56,Barsapara Cricket Stadium,14,3,Brijesh Sharma,Matt Henry,no run,111ks high full toss below the waist; Henry tucks it to mid-wicket. He missed out there..,2026-05-04 13:10:19.991148
03_RRvsCSK,May 04,13:07:56,Barsapara Cricket Stadium,14,4,Brijesh Sharma,Matt Henry,FOUR,streaky! 115.2ks off-pace back of a length delivery; Henry has a swipe across the line and gets a thick top-edge; the ball flies over a leaping Jurel and races to third man,2026-05-04 13:10:19.991255
03_RRvsCSK,May 04,13:07:56,Barsapara Cricket Stadium,14,5,Brijesh Sharma,Matt Henry,1 run,105.3ks slower ball outside off; Henry drags it off the inner half to long-on,2026-05-04 13:10:19.991358
03_RRvsCSK,May 04,13:07:56,Barsapara Cricket Stadium,14,6,Brijesh Sharma,Jamie Overton,1 run,106.4ks off-pace delivery dug in; Overton waits and pulls towards deep mid-wicket; Jaiswal makes a diving stop,2026-05-04 13:10:19.991460
03_RRvsCSK,May 04,13:07:56,Barsapara Cricket Stadium,15,1,Ravi Bishnoi,Jamie Overton,1 run,quicker and attacking the stumps; Overton stays back and squeezes it off the inside-edge to square leg,2026-05-04 13:10:19.991559
03_RRvsCSK,May 04,13:07:56,Barsapara Cricket Stadium,15,2,Ravi Bishnoi,Matt Henry,no run,googly around leg; Henry misses the glance and is struck on the thigh pad,2026-05-04 13:10:19.991685
03_RRvsCSK,May 04,13:07:56,Barsapara Cricket Stadium,15,3,Ravi Bishnoi,Matt Henry,out Caught&Bowled!! Bishnoi has his first. Soft dismissal. Henry stands there with his head down. CSK are nine down. Another wrong 'un but this is slower and dips on the batter,Henry wanted to drive but ends up chipping it straight back; Bishnoi reverse cups it safely and lands on his back. Matt Henry c and b Ravi Bishnoi 5(7) [4s-1],2026-05-04 13:10:19.991802
03_RRvsCSK,May 04,13:07:56,Barsapara Cricket Stadium,15,4,Ravi Bishnoi,Anshul Kamboj,no run,102.6ks flatter delivery outside off; Kamboj knocks it to cover,2026-05-04 13:10:19.991903
