match,date,time,venue,over,ball,bowler,batsman,ball_event,event_info,extract_time
03_RRvsCSK,May 04,13:07:56,Barsapara Cricket Stadium,15,5,Ravi Bishnoi,Anshul Kamboj,no run,strays down leg; Kamboj misses the glance and the ball brushes the pad on the way to Jurel,2026-05-04 13:10:19.992002
03_RRvsCSK,May 04,13:07:56,Barsapara Cricket Stadium,15,6,Ravi Bishnoi,Anshul Kamboj,no run,googly that spins in; Kamboj leans forward and helps it along towards short fine,2026-05-04 13:10:19.992100
03_RRvsCSK,May 04,13:07:56,Barsapara Cricket Stadium,16,1,Jofra Archer,Jamie Overton,no run,140.2ks short ball outside off; Overton pulls and misses. The extra bounce takes it over the top-edge,2026-05-04 13:10:19.992215
03_RRvsCSK,May 04,13:07:56,Barsapara Cricket Stadium,16,2,Jofra Archer,Jamie Overton,no run,once more short and banged into the pitch; Overton moves away and attempts the pull this time; but still can't make contact,2026-05-04 13:10:19.992334
03_RRvsCSK,May 04,13:07:56,Barsapara Cricket Stadium,16,3,Jofra Archer,Jamie Overton,no run,uhhh! That was close. High full toss but below the waist; Overton shuffles across and tries to scoop; misses and the ball wasn't far from clipping the bails,2026-05-04 13:10:19.992531
03_RRvsCSK,May 04,13:07:56,Barsapara Cricket Stadium,16,4,Jofra Archer,Jamie Overton,no run,138.6ks goes back to the short stuff and Overton is once again missing the pull. Archer has something to say to his England team mate. But Overton checks with the square leg umpire for height; it is a legal delivery,2026-05-04 13:10:19.992794
03_RRvsCSK,May 04,13:07:56,Barsapara Cricket Stadium,16,5,Jofra Archer,Jamie Overton,FOUR,full and attacking the stumps; Overton moves away and throws his bat on the big shot; slices it over backward point and the ball has enough to trickle into the rope,2026-05-04 13:10:19.992921
03_RRvsCSK,May 04,13:07:56,Barsapara Cricket Stadium,16,6,Jofra Archer,Jamie Overton,1 run,speared into the blockhole; Overton digs it out to mid-off and retains strike,2026-05-04 13:10:19.993034
03_RRvsCSK,May 04,13:07:56,Barsapara Cricket Stadium,17,1,Sandeep Sharma,Jamie Overton,FOUR,CSK go past 100. Slower ball dug into the surface; Overton missed a few pull shots off Archer but not off Sandeep; the top-edge flies over short fine and races to the fence,2026-05-04 13:10:19.993146
03_RRvsCSK,May 04,13:07:56,Barsapara Cricket Stadium,17,2,Sandeep Sharma,Jamie Overton,1 run,floaty delivery outside off; Overton drags the heave to long-on and decides to take the single,2026-05-04 13:10:19.993256
03_RRvsCSK,May 04,13:07:56,Barsapara Cricket Stadium,17,3,Sandeep Sharma,Anshul Kamboj,leg byes,1 run; strays down leg; Kamboj misses the glance and the ball deflects off the pad; Jurel dives to his left and parries it away; just a single,2026-05-04 13:10:19.993365
03_RRvsCSK,May 04,13:07:56,Barsapara Cricket Stadium,17,4,Sandeep Sharma,Jamie Overton,1 run,in the air and over Sandeep. Off-pace delivery and Overton is deceived completely; he is through the shot early and chips it straight back. Sandeep leaps to his right but the ball evades his grasp,2026-05-04 13:10:19.993478
03_RRvsCSK,May 04,13:07:56,Barsapara Cricket Stadium,17,5,Sandeep Sharma,Anshul Kamboj,1 run,122.4ks back of a length delivery; Kamboj knocks it in front of long-on and crosses over,2026-05-04 13:10:19.993619
03_RRvsCSK,May 04,13:07:56,Barsapara Cricket Stadium,17,6,Sandeep Sharma,Jamie Overton,1 run,123.8ks fullish delivery on leg; Overton flicks to deep mid-wicket and keeps strike,2026-05-04 13:10:19.993780
03_RRvsCSK,May 04,13:07:56,Barsapara Cricket Stadium,18,1,Nandre Burger,Jamie Overton,1 run,118.7ks slower short of length delivery; Overton chops the cut to sweeper cover,2026-05-04 13:10:19.993898
03_RRvsCSK,May 04,13:07:56,Barsapara Cricket Stadium,18,2,Nandre Burger,Anshul Kamboj,no ball,141.7ks back of a length delivery; Kamboj defends down the pitch. Burger has overstepped. Free-hit coming up..,2026-05-04 13:10:19.994168
03_RRvsCSK,May 04,13:07:56,Barsapara Cricket Stadium,18,2,Nandre Burger,Anshul Kamboj,FOUR,slower ball angling down leg; Kamboj swings even as the bottom hand comes off the bat handle; but the pull is good enough to clear backward square and race away,2026-05-04 13:10:19.994439
03_RRvsCSK,May 04,13:07:56,Barsapara Cricket Stadium,18,3,Nandre Burger,Anshul Kamboj,leg byes,1 run; slanted in; Kamboj is hurried on the flick and misses; the ball drops off the thigh pad to the off-side,2026-05-04 13:10:19.994863
03_RRvsCSK,May 04,13:07:56,Barsapara Cricket Stadium,18,4,Nandre Burger,Jamie Overton,1 run,on a length and outside off; Overton drives to long-off,2026-05-04 13:10:19.995723
03_RRvsCSK,May 04,13:07:56,Barsapara Cricket Stadium,18,5,Nandre Burger,Anshul Kamboj,1 run,140.5ks back of a length delivery; Kamboj has a tentative poke and the outside-edge flies through the vacant slip cordon. Third man is pretty fine and hence only a single,2026-05-04 13:10:19.996388
03_RRvsCSK,May 04,13:07:56,Barsapara Cricket Stadium,18,6,Nandre Burger,Jamie Overton,leg byes,1 run; short ball angled in; Overton takes it on and misses the pull. The ball hits the helmet and lobs towards short fine. This has been a fighting effort from Overton,2026-05-04 13:10:19.996792
03_RRvsCSK,May 04,13:07:56,Barsapara Cricket Stadium,19,1,Sandeep Sharma,Jamie Overton,SIX,smashed! He's nailed that. Sandeep goes short and into the pitch; sits up nicely as Overton backs away; gets it right in the arc and he does not hold back - hammers the pull flat and all the way over deep mid-wicket,2026-05-04 13:10:19.997078
03_RRvsCSK,May 04,13:07:56,Barsapara Cricket Stadium,19,2,Sandeep Sharma,Jamie Overton,1 run,122.5ks full and close to yorker length; Overton digs the drive out to long-off and has to settle with a single,2026-05-04 13:10:19.997347
03_RRvsCSK,May 04,13:07:56,Barsapara Cricket Stadium,19,3,Sandeep Sharma,Anshul Kamboj,1 run,off-pace delivery; Kamboj works it into the mid-wicket and brings Overton back on strike,2026-05-04 13:10:19.997528
03_RRvsCSK,May 04,13:07:56,Barsapara Cricket Stadium,19,4,Sandeep Sharma,Jamie Overton,out Jamie Overton Run Out!! 1 run completed. CSK are bowled out for 127. Complete confusion from Overton. He miscues the heave straight to deep mid-wicket and was reluctant to go for the single,but responds as Kamboj was more than halfway down. He's then not sure to go for the second or not as he ambles across for the first run; makes a late call to go for the second and is caught short. Hetmyer was a bit casual with getting to the ball and releasing it; which might have prompted Overton to go for the second; but the throw was good to Jurel and he catches Overton well short of the crease. Jamie Overton run out (Shimron Hetmyer/Dhruv Jurel) 43(36) [4s-2 6s-2],2026-05-04 13:10:19.997824
03_RRvsCSK,May 04,13:07:56,Barsapara Cricket Stadium,0,1,Matt Henry,Yashasvi Jaiswal,2 runs,130.1kph; over the wicket; short of length outside off; cut to backward point. A misfield from Sarfaraz allows Jaiswal to get off the mark with a couple of runs,2026-05-04 13:10:19.997995
03_RRvsCSK,May 04,13:07:56,Barsapara Cricket Stadium,0,2,Matt Henry,Yashasvi Jaiswal,1 run,132.1kph; back of a length delivery; leg-lined; tucked to backward square leg,2026-05-04 13:10:19.998136
03_RRvsCSK,May 04,13:07:56,Barsapara Cricket Stadium,0,3,Matt Henry,Vaibhav Sooryavanshi,FOUR,dropped! Shortish ball; Vaibhav Sooryavanshi wants to go after it with a pull shot. Miscues off the bottom part of the bat. Kartik turns around and runs back from midwicket; outstretches and gets both hands on it but fails to hold onto it. He then chases the dribbling ball; slips and ends up kicking the ball to the fence. Sloppy!,2026-05-04 13:10:19.998284
03_RRvsCSK,May 04,13:07:56,Barsapara Cricket Stadium,0,4,Matt Henry,Vaibhav Sooryavanshi,SIX,there you go! Henry bowls another one on the shorter side. Vaibhav Sooryavanshi gets into a better position to slam the pull over deep midwicket. This is how he's going to bat,2026-05-04 13:10:19.998432
03_RRvsCSK,May 04,13:07:56,Barsapara Cricket Stadium,0,5,Matt Henry,Vaibhav Sooryavanshi,1 run,same length but it's a slower one; Vaibhav Sooryavanshi doesn't spot it and swings hard across the line. Splices up in the air but luckily for him; the ball falls wide of backward point,2026-05-04 13:10:19.998575
03_RRvsCSK,May 04,13:07:56,Barsapara Cricket Stadium,0,6,Matt Henry,Yashasvi Jaiswal,FOUR,18 runs off the opening over! Henry errs with his line and ends up straying this length ball onto the pads and Jaiswal glances it to fine leg,2026-05-04 13:10:19.998792
03_RRvsCSK,May 04,13:07:56,Barsapara Cricket Stadium,1,1,Khaleel Ahmed,Vaibhav Sooryavanshi,leg byes,1 run; big shout for lbw; Khaleel is almost pleading; Kumar Dharmasena is unmoved. Ruturaj has a wry smile as he reviews. Pacy inswinger from over the wicket; Vaibhav Sooryavanshi doesn't account for the inward movement as he looks to flick. Beaten on the inside edge and is rapped on the back thigh. Ball-tracking shows it to be going over the leg-stump. CSK burn a review,2026-05-04 13:10:19.998995
03_RRvsCSK,May 04,13:07:56,Barsapara Cricket Stadium,1,2,Khaleel Ahmed,Yashasvi Jaiswal,no run,fuller than a good length; Jaiswal gets forward to drive it to mid-on off the inner half of the bat,2026-05-04 13:10:19.999181
03_RRvsCSK,May 04,13:07:56,Barsapara Cricket Stadium,1,3,Khaleel Ahmed,Yashasvi Jaiswal,no run,nice ball from Khaleel. 136.7kph; good bounce from a length and the ball moves in off the deck as well. Jaiswal is half-forward for a tentative push and is lucky not to get an inside edge on it,2026-05-04 13:10:19.999400
03_RRvsCSK,May 04,13:07:56,Barsapara Cricket Stadium,1,4,Khaleel Ahmed,Yashasvi Jaiswal,no run,Khaleel goes fuller and the ball holds its line outside off; a watchful leave from Jaiswal follows,2026-05-04 13:10:19.999840
03_RRvsCSK,May 04,13:07:56,Barsapara Cricket Stadium,1,5,Khaleel Ahmed,Yashasvi Jaiswal,1 run,width on offer; chopped down to third man,2026-05-04 13:10:20.000296
03_RRvsCSK,May 04,13:07:56,Barsapara Cricket Stadium,1,6,Khaleel Ahmed,Vaibhav Sooryavanshi,FOUR,in the air; safe and four! On a length and just outside off; Vaibhav Sooryavanshi throws his arms at it and slices it over point for a one-bounce four,2026-05-04 13:10:20.000582
03_RRvsCSK,May 04,13:07:56,Barsapara Cricket Stadium,2,1,Matt Henry,Yashasvi Jaiswal,no run,135.6kph; short of length; punched to extra cover,2026-05-04 13:10:20.001049
03_RRvsCSK,May 04,13:07:56,Barsapara Cricket Stadium,2,2,Matt Henry,Yashasvi Jaiswal,1 run,short of length outside off; 134.7kph; scythed to deep backward point,2026-05-04 13:10:20.001197
03_RRvsCSK,May 04,13:07:56,Barsapara Cricket Stadium,2,3,Matt Henry,Vaibhav Sooryavanshi,1 run,118.9kph; pace off and on the shorter side outside off; Vaibhav Sooryavanshi flays it over backward point. The man in the deep takes it on the bounce,2026-05-04 13:10:20.001359
03_RRvsCSK,May 04,13:07:56,Barsapara Cricket Stadium,2,4,Matt Henry,Yashasvi Jaiswal,1 run,133.6kph; Henry offers width and Jaiswal chops it down to third man,2026-05-04 13:10:20.001517
03_RRvsCSK,May 04,13:07:56,Barsapara Cricket Stadium,2,5,Matt Henry,Vaibhav Sooryavanshi,SIX,121.1kph; slower ball on a length outside off. Vaibhav Sooryavanshi sees it coming. Clears his front leg; waits for it and there come his quick hands to superbly slash it over deep backward point. Incredible the way he could generate so much power. The man at deep backward point meanwhile is a mere spectator,2026-05-04 13:10:20.001670
03_RRvsCSK,May 04,13:07:56,Barsapara Cricket Stadium,2,6,Matt Henry,Vaibhav Sooryavanshi,1 run,guided behind square on the off-side and Vaibhav Sooryavanshi will keep the strike,2026-05-04 13:10:20.001806
03_RRvsCSK,May 04,13:07:56,Barsapara Cricket Stadium,3,1,Khaleel Ahmed,Vaibhav Sooryavanshi,1 run,137.7kph; yorker length; Vaibhav Sooryavanshi shapes to flick and inside-halves to deep square leg,2026-05-04 13:10:20.001911
03_RRvsCSK,May 04,13:07:56,Barsapara Cricket Stadium,3,2,Khaleel Ahmed,Yashasvi Jaiswal,FOUR,Jaiswal wants to join the party as well. It's a length ball and Jaiswal decides to smack it downtown. Hits him high on the bat but he's muscled it over straight mid-off for a boundary,2026-05-04 13:10:20.002022
03_RRvsCSK,May 04,13:07:56,Barsapara Cricket Stadium,3,3,Khaleel Ahmed,Yashasvi Jaiswal,no run,fraction shorter and Jaiswal ends up inside-edging it onto his pad,2026-05-04 13:10:20.002125
03_RRvsCSK,May 04,13:07:56,Barsapara Cricket Stadium,3,4,Khaleel Ahmed,Yashasvi Jaiswal,no run,136.2kph; opens the bat-face and dabs this short of a good length ball straight to short third man,2026-05-04 13:10:20.002236
03_RRvsCSK,May 04,13:07:56,Barsapara Cricket Stadium,3,5,Khaleel Ahmed,Yashasvi Jaiswal,no run,136.6kph; in-angling back of a length delivery; a swivelling Jaiswal miscues the pull to midwicket,2026-05-04 13:10:20.002339
03_RRvsCSK,May 04,13:07:56,Barsapara Cricket Stadium,3,6,Khaleel Ahmed,Yashasvi Jaiswal,1 run,134.4kph; fuller ball attacking the stumps and Jaiswal flicks it away to deep square leg,2026-05-04 13:10:20.002441
03_RRvsCSK,May 04,13:07:56,Barsapara Cricket Stadium,4,1,Anshul Kamboj,Yashasvi Jaiswal,no run,134.9kph; Anshul Kamboj starts with a good ball. Lands it on a length around off and gets it to nip away. Jaiswal drives and even before his front foot gets into a proper position and ends up getting beaten on the outside edge,2026-05-04 13:10:20.002546
03_RRvsCSK,May 04,13:07:56,Barsapara Cricket Stadium,4,2,Anshul Kamboj,Yashasvi Jaiswal,1 run,130.4kph; Kamboj pulls his length back and that's been nudged to midwicket,2026-05-04 13:10:20.002727
03_RRvsCSK,May 04,13:07:56,Barsapara Cricket Stadium,4,3,Anshul Kamboj,Vaibhav Sooryavanshi,FOUR,134.1kph; nicely played by the youngster! Short and wide of off; Vaibhav Sooryavanshi arches back and uses the bowler's pace and angle to wristily elevate it over the short third man,2026-05-04 13:10:20.002844
03_RRvsCSK,May 04,13:07:56,Barsapara Cricket Stadium,4,4,Anshul Kamboj,Vaibhav Sooryavanshi,FOUR,134.8kph; the boundaries keep coming. Length ball outside off; Vaibhav Sooryavanshi clears his front leg to swing hard across the line. Thick inside edge eludes the leg-stump and runs away to fine leg for four more,2026-05-04 13:10:20.002970
03_RRvsCSK,May 04,13:07:56,Barsapara Cricket Stadium,4,5,Anshul Kamboj,Vaibhav Sooryavanshi,no run,135.5kph; short of length with no room on offer; bunted to mid-on,2026-05-04 13:10:20.003072
03_RRvsCSK,May 04,13:07:56,Barsapara Cricket Stadium,4,6,Anshul Kamboj,Vaibhav Sooryavanshi,SIX,he's hit that with disdain! 132kph; fuller than a good length; Vaibhav Sooryavanshi clears his front leg; sets a strong base and smashes it over long-on with a big backlift. Fifty up for RR in the fifth over,2026-05-04 13:10:20.003174
03_RRvsCSK,May 04,13:07:56,Barsapara Cricket Stadium,5,1,Noor Ahmad,Yashasvi Jaiswal,byes,FOUR; Jaiswal tries to reverse-sweep Noor first ball. The line is down leg; no contact made; the keeper can't stop it either and the ball runs away to the fence,2026-05-04 13:10:20.003277
03_RRvsCSK,May 04,13:07:56,Barsapara Cricket Stadium,5,2,Noor Ahmad,Yashasvi Jaiswal,no run,97.4kph; short of length; punched towards wide mid-off,2026-05-04 13:10:20.003404
03_RRvsCSK,May 04,13:07:56,Barsapara Cricket Stadium,5,3,Noor Ahmad,Yashasvi Jaiswal,1 run,95.7kph; quick googly; Jaiswal punches it to long-on,2026-05-04 13:10:20.003525
03_RRvsCSK,May 04,13:07:56,Barsapara Cricket Stadium,5,4,Noor Ahmad,Vaibhav Sooryavanshi,SIX,high and handsome! 97.9kph; length ball; looked like the googly. Sooryavanshi once again clears his front leg to bludgeon it over long-on,2026-05-04 13:10:20.003719
03_RRvsCSK,May 04,13:07:56,Barsapara Cricket Stadium,5,5,Noor Ahmad,Vaibhav Sooryavanshi,SIX,15-ball fifty for Vaibhav Sooryavanshi! Wow; this is incredible hitting from the 15-year-old. Noor goes fuller and Vaibhav brings his wrists into play as he launches it over long-on,2026-05-04 13:10:20.003951
03_RRvsCSK,May 04,13:07:56,Barsapara Cricket Stadium,5,6,Noor Ahmad,Vaibhav Sooryavanshi,2 runs,shorter; quicker and straighter; Vaibhav Sooryavanshi pulls behind square on the on-side for a couple of runs,2026-05-04 13:10:20.004158
03_RRvsCSK,May 04,13:07:56,Barsapara Cricket Stadium,6,1,Anshul Kamboj,Yashasvi Jaiswal,1 run,133.7kph; short of length; Jaiswal taps it towards backward point and gives the strike to the half-centurion,2026-05-04 13:10:20.004311
03_RRvsCSK,May 04,13:07:56,Barsapara Cricket Stadium,6,2,Anshul Kamboj,Vaibhav Sooryavanshi,out Caught by Sarfaraz Khan!! Vaibhav Sooryavanshi holes out! He stands in disbelief before taking the long walk back. End of a fantastic knock nevertheless from the left-handed opener. It's a length ball outside off and Vaibhav's quick hands come into play as he flays it over cover. Makes good contact but he's hit it flat. Sarfaraz,the man in the deep; runs in and collects with both hands as he dives. Makes a tough catch look easy. Vaibhav Sooryavanshi c Sarfaraz Khan b Anshul Kamboj 52(17) [4s-4 6s-5],2026-05-04 13:10:20.004437
03_RRvsCSK,May 04,13:07:56,Barsapara Cricket Stadium,6,3,Anshul Kamboj,Dhruv Jurel,1 run,length ball angled in; turned to midwicket,2026-05-04 13:10:20.004551
03_RRvsCSK,May 04,13:07:56,Barsapara Cricket Stadium,6,4,Anshul Kamboj,Yashasvi Jaiswal,no run,tries to steer this length ball to third man and gets beaten on the outside edge,2026-05-04 13:10:20.004696
03_RRvsCSK,May 04,13:07:56,Barsapara Cricket Stadium,6,5,Anshul Kamboj,Yashasvi Jaiswal,1 run,tucked through square leg,2026-05-04 13:10:20.004808
03_RRvsCSK,May 04,13:07:56,Barsapara Cricket Stadium,6,6,Anshul Kamboj,Dhruv Jurel,no run,133.8kph; length ball outside off; Jurel pushes at it and bottom-edges. The ball hits the turf and goes towards the keeper,2026-05-04 13:10:20.004922
03_RRvsCSK,May 04,13:07:56,Barsapara Cricket Stadium,7,1,Jamie Overton,Yashasvi Jaiswal,1 run,117.9kph; yorker length; pace off as well; Jaiswal jams it to cover,2026-05-04 13:10:20.005038
03_RRvsCSK,May 04,13:07:56,Barsapara Cricket Stadium,7,2,Jamie Overton,Dhruv Jurel,no run,back of a length; Dhruv Jurel shapes to pull and miscues it back to the bowler as it hits the splice of the bat,2026-05-04 13:10:20.005157
03_RRvsCSK,May 04,13:07:56,Barsapara Cricket Stadium,7,3,Jamie Overton,Dhruv Jurel,FOUR,shot! 143.1kph; full on leg and Dhruv Jurel flicks it beautifully through midwicket. The placement is perfect as well,2026-05-04 13:10:20.005275
03_RRvsCSK,May 04,13:07:56,Barsapara Cricket Stadium,7,4,Jamie Overton,Dhruv Jurel,FOUR,poor ball and punished. Shortened length; the line is down leg; Dhruv Jurel swivels and pulls hard to send it to the long leg fence. No chance for fine leg to even get close to it,2026-05-04 13:10:20.005403
03_RRvsCSK,May 04,13:07:56,Barsapara Cricket Stadium,7,5,Jamie Overton,Dhruv Jurel,1 run,137.6kph; short of length outside off; steered to third man,2026-05-04 13:10:20.005533
03_RRvsCSK,May 04,13:07:56,Barsapara Cricket Stadium,7,6,Jamie Overton,Yashasvi Jaiswal,FOUR,just past the keeper! 141.1kph; hard length angled across; Jaiswal arches back and uses the bowler's angle to cheekily steer it to the left of the leaping Samson. 14 runs off the over,2026-05-04 13:10:20.005692
03_RRvsCSK,May 04,13:07:56,Barsapara Cricket Stadium,8,1,Anshul Kamboj,Dhruv Jurel,FOUR,Rajasthan Royals want to finish this quickly. Boundaries continue to flow.. Kamboj misses his line - full delivery but on middle and leg; Jurel whips it with a strong bottom hand and almost sends it the distance; one bounce and over the wide long-on fence,2026-05-04 13:10:20.005869
03_RRvsCSK,May 04,13:07:56,Barsapara Cricket Stadium,8,2,Anshul Kamboj,Dhruv Jurel,FOUR,nothing going right for CSK. Fullish delivery around off; Jurel prods forward and squirts an inside-edge past short fine. Khaleel gives chase and drags the ball along with him into the rope,2026-05-04 13:10:20.006007
03_RRvsCSK,May 04,13:07:56,Barsapara Cricket Stadium,8,3,Anshul Kamboj,Dhruv Jurel,out Bowled!! Dragged on! But Kamboj is not complaining. He's pumped and celebrates the wicket with a fist pump. Jurel tried to be cheeky - shuffled across his stumps and tries to play the scoop,but only manages to drag it onto leg-stump. He had got a couple of fours and could have knocked it around; but RR are looking at the NRR. Dhruv Jurel b Anshul Kamboj 18(9) [4s-4],2026-05-04 13:10:20.006147
03_RRvsCSK,May 04,13:07:56,Barsapara Cricket Stadium,8,4,Anshul Kamboj,Riyan Parag,1 run,133.5ks fullish delivery around off; Parag plays it with soft hands and the outside-edge rolls to third man,2026-05-04 13:10:20.006278
03_RRvsCSK,May 04,13:07:56,Barsapara Cricket Stadium,8,5,Anshul Kamboj,Yashasvi Jaiswal,no run,132.2ks fuller and close to off; Jaiswal pushes it to mid-off,2026-05-04 13:10:20.006403
03_RRvsCSK,May 04,13:07:56,Barsapara Cricket Stadium,8,6,Anshul Kamboj,Yashasvi Jaiswal,no run,132ks good length ball on off; Jaiswal defends with an angled bat to backward point,2026-05-04 13:10:20.006532
03_RRvsCSK,May 04,13:07:56,Barsapara Cricket Stadium,9,1,Khaleel Ahmed,Riyan Parag,1 run,136ks back of a length around off; Parag guides it with an open bat face to third man,2026-05-04 13:10:20.006743
03_RRvsCSK,May 04,13:07:56,Barsapara Cricket Stadium,9,2,Khaleel Ahmed,Yashasvi Jaiswal,1 run,137.1ks angled into the left-hander; Jaiswal tucks it to mid-wicket and scampers across,2026-05-04 13:10:20.006948
03_RRvsCSK,May 04,13:07:56,Barsapara Cricket Stadium,9,3,Khaleel Ahmed,Riyan Parag,no run,132.4ks bouncer around off; Parag looks to ramp it over the keeper but does not make contact. One for the over signals the square leg umpire,2026-05-04 13:10:20.007085
03_RRvsCSK,May 04,13:07:56,Barsapara Cricket Stadium,9,4,Khaleel Ahmed,Riyan Parag,no run,fuller than good length; Parag drives on the rise and picks out mid-off,2026-05-04 13:10:20.007319
03_RRvsCSK,May 04,13:07:56,Barsapara Cricket Stadium,9,5,Khaleel Ahmed,Riyan Parag,FOUR,shot! Khaleel goes pace off and into the pitch; 121.4ks short and outside off; Parag reaches for it and slaps it over extra cover. Mid-off was inside the ring and he just had to clear it,2026-05-04 13:10:20.007561
03_RRvsCSK,May 04,13:07:56,Barsapara Cricket Stadium,9,6,Khaleel Ahmed,Riyan Parag,no run,just short of backward point. Fullish delivery angling in; Parag is drawn into the drive and slices it uppishly towards Kartik; he bends low and takes it on the half volley,2026-05-04 13:10:20.007849
03_RRvsCSK,May 04,13:07:56,Barsapara Cricket Stadium,10,1,Noor Ahmad,Yashasvi Jaiswal,1 run,96.1ks flighted outside off; Jaiswal drags it off the inner half to deep mid-wicket,2026-05-04 13:10:20.008085
03_RRvsCSK,May 04,13:07:56,Barsapara Cricket Stadium,10,2,Noor Ahmad,Riyan Parag,1 run,fraction short and spins away; Parag forces it down to long-off,2026-05-04 13:10:20.008318
03_RRvsCSK,May 04,13:07:56,Barsapara Cricket Stadium,10,3,Noor Ahmad,Yashasvi Jaiswal,no run,uhhh! Tossed up and Jaiswal winds up for the big shot; he looks to go straight but the ball spins away to beat the outside-edge. Just a hint of turn and that was enough to defeat Jaiswal,2026-05-04 13:10:20.008550
03_RRvsCSK,May 04,13:07:56,Barsapara Cricket Stadium,10,4,Noor Ahmad,Yashasvi Jaiswal,1 run,did that carry? Yes. Flighted delivery on off; Jaiswal sits down and sweeps; gets more of a top-edge and the ball skies towards deep backward square. Henry runs in; slides forward and gets fingertips to it. Tough chance and full marks for the effort,2026-05-04 13:10:20.008839
03_RRvsCSK,May 04,13:07:56,Barsapara Cricket Stadium,10,5,Noor Ahmad,Riyan Parag,no run,premeditates the reverse sweep and has to adjust to the shortened length; chops it towards short third,2026-05-04 13:10:20.009077
03_RRvsCSK,May 04,13:07:56,Barsapara Cricket Stadium,10,6,Noor Ahmad,Riyan Parag,SIX,whoa! He's nailed it this time. Parag once again for the reverse sweep and this one comes right off the screws. The line was around leg-stump and that played right into Parag's hands; not much followthrough of the bat but the ball sails over deep extra cover,2026-05-04 13:10:20.009322
03_RRvsCSK,May 04,13:07:56,Barsapara Cricket Stadium,11,1,Matt Henry,Yashasvi Jaiswal,SIX,back to back sixes. Jaiswal has struggled for timing today but not this time. He's got it off the middle and there's no catching that. Fullish delivery angled across; Jaiswal stays leg-side and gives himself the space to open his hands; thumps it over long-off and takes RR closer,2026-05-04 13:10:20.009562
03_RRvsCSK,May 04,13:07:56,Barsapara Cricket Stadium,11,2,Matt Henry,Yashasvi Jaiswal,2 runs,pushed wider of off-stump; Jaiswal goes hard and drags it off the inner half to mid-wicket; easy couple,2026-05-04 13:10:20.009720
03_RRvsCSK,May 04,13:07:56,Barsapara Cricket Stadium,11,3,Matt Henry,Yashasvi Jaiswal,1 run,shortens the length around off; Jaiswal pulls to deep mid-wicket and settles with a single,2026-05-04 13:10:20.009887
03_RRvsCSK,May 04,13:07:56,Barsapara Cricket Stadium,11,4,Matt Henry,Riyan Parag,1 run,full pitcher close to off; Parag drives it down to long-on,2026-05-04 13:10:20.010024
03_RRvsCSK,May 04,13:07:56,Barsapara Cricket Stadium,11,5,Matt Henry,Yashasvi Jaiswal,1 run,125.8ks dug into the surface; Jaiswal rides the bounce and pulls through mid-wicket,2026-05-04 13:10:20.010239
03_RRvsCSK,May 04,13:07:56,Barsapara Cricket Stadium,11,6,Matt Henry,Riyan Parag,wide,bouncer around off; Parag was on his toes as he attempts the ramp but can't make contact. The square leg umpire did not signal the wide but Parag got it overturned,2026-05-04 13:10:20.010397
03_RRvsCSK,May 04,13:07:56,Barsapara Cricket Stadium,11,6,Matt Henry,Riyan Parag,no run,speared into the blockhole; Parag is happy to dig it back to Henry,2026-05-04 13:10:20.010500
