match,date,time,venue,over,ball,bowler,batsman,ball_event,event_info,extract_time
44_CSKvsMI,May 04,16:33:57,MA Chidambaram Stadium,13,1,AM Ghazanfar,Ruturaj Gaikwad,1 run,back to back fifties for Gaikwad. He is slowly getting back to his best. Has looked more fluent in this knock than he did in the previous one. 100.3ks quicker and fuller; Gaikwad angles it with an open bat face towards point and crosses over. He is anchoring this chase beautifully,2026-05-04 16:41:18.244386
44_CSKvsMI,May 04,16:33:57,MA Chidambaram Stadium,13,2,AM Ghazanfar,Kartik Sharma,1 run,very full delivery on off; Kartik squeezes the drive towards sweeper cover,2026-05-04 16:41:18.245026
44_CSKvsMI,May 04,16:33:57,MA Chidambaram Stadium,13,3,AM Ghazanfar,Ruturaj Gaikwad,no run,slower and bit of inward turn; Gaikwad works it to mid-wicket,2026-05-04 16:41:18.245674
44_CSKvsMI,May 04,16:33:57,MA Chidambaram Stadium,13,4,AM Ghazanfar,Ruturaj Gaikwad,1 run,attacks the stumps; Gaikwad makes a bit of room and eases it square on the off-side,2026-05-04 16:41:18.246442
44_CSKvsMI,May 04,16:33:57,MA Chidambaram Stadium,13,5,AM Ghazanfar,Kartik Sharma,1 run,steps out and plays it with soft hands in front of cover. Gaikwad responds to the quick single,2026-05-04 16:41:18.247204
44_CSKvsMI,May 04,16:33:57,MA Chidambaram Stadium,13,6,AM Ghazanfar,Ruturaj Gaikwad,FOUR,shot! Overpitched and that ruins the over for Ghazanfar. Gaikwad was not going to miss out; fast hands by him and he creams the drive wide of cover. It was in the air but well wide of Hardik,2026-05-04 16:41:18.247896
44_CSKvsMI,May 04,16:33:57,MA Chidambaram Stadium,14,1,Jasprit Bumrah,Kartik Sharma,1 run,138.2ks back of a length delivery; Kartik drops it with soft hands in front of mid-wicket and crosses over,2026-05-04 16:41:18.248501
44_CSKvsMI,May 04,16:33:57,MA Chidambaram Stadium,14,2,Jasprit Bumrah,Ruturaj Gaikwad,FOUR,shot! 137.9ks short of length delivery and Gaikwad is quick to pounce; he picked the length early and transferred his weight back; pulled it in front of square and there's no one at deep mid-wicket. They need less than a run-a-ball now,2026-05-04 16:41:18.249150
44_CSKvsMI,May 04,16:33:57,MA Chidambaram Stadium,14,3,Jasprit Bumrah,Ruturaj Gaikwad,no run,sharp bouncer; well-directed as well; Gaikwad ducks and sways out of the line,2026-05-04 16:41:18.249739
44_CSKvsMI,May 04,16:33:57,MA Chidambaram Stadium,14,4,Jasprit Bumrah,Ruturaj Gaikwad,no run,120.8ks short of length delivery; Gaikwad rides the bounce and directs it towards point,2026-05-04 16:41:18.250405
44_CSKvsMI,May 04,16:33:57,MA Chidambaram Stadium,14,5,Jasprit Bumrah,Ruturaj Gaikwad,wide,another bouncer; angled in and Gaikwad sinks down. Allows it to sail over him. Umpire signals two for over and Gaikwad reviews the onfield call. He reckons that is a wide. Let's see.. It is high. But how high? It is a wide for height.. Successful review from CSK,2026-05-04 16:41:18.251101
44_CSKvsMI,May 04,16:33:57,MA Chidambaram Stadium,14,5,Jasprit Bumrah,Ruturaj Gaikwad,no run,full and slanting in; Gaikwad shimmies out and pushes it firmly to cover. There's a direct hit at the non-striker's end but Kartik had got back in comfortably,2026-05-04 16:41:18.251710
44_CSKvsMI,May 04,16:33:57,MA Chidambaram Stadium,14,6,Jasprit Bumrah,Ruturaj Gaikwad,1 run,another direct-hit but once again the batter is in. Gaikwad pushes it to mid-off and sets off straightaway. Hardik swoops down and hits the target at the non-striker's end. But Gaikwad was in..,2026-05-04 16:41:18.252268
44_CSKvsMI,May 04,16:33:57,MA Chidambaram Stadium,15,1,Trent Boult,Ruturaj Gaikwad,1 run,low full toss outside off; Gaikwad toe-ends the drive towards mid-off,2026-05-04 16:41:18.254057
44_CSKvsMI,May 04,16:33:57,MA Chidambaram Stadium,15,2,Trent Boult,Kartik Sharma,1 run,130.3ks low full toss at the stumps; Kartik digs it out to mid-off,2026-05-04 16:41:18.254938
44_CSKvsMI,May 04,16:33:57,MA Chidambaram Stadium,15,3,Trent Boult,Ruturaj Gaikwad,wide,108.3ks slower bouncer outside off; Gaikwad watches it sail over him. Called wide for height,2026-05-04 16:41:18.255429
44_CSKvsMI,May 04,16:33:57,MA Chidambaram Stadium,15,3,Trent Boult,Ruturaj Gaikwad,FOUR,lovely shot! Gaikwad shimmies down; stays leg-side and converts it into a ful pitcher; drives straight of mid-off and the ball races away. That's the best shot he's played in this knock..,2026-05-04 16:41:18.255923
44_CSKvsMI,May 04,16:33:57,MA Chidambaram Stadium,15,4,Trent Boult,Ruturaj Gaikwad,1 run,once again charges down and gets there on the full; cue-ends the drive to mid-off,2026-05-04 16:41:18.256411
44_CSKvsMI,May 04,16:33:57,MA Chidambaram Stadium,15,5,Trent Boult,Kartik Sharma,1 run,131.6ks full toss outside off; Kartik drives to deep extra cover,2026-05-04 16:41:18.256977
44_CSKvsMI,May 04,16:33:57,MA Chidambaram Stadium,15,6,Trent Boult,Ruturaj Gaikwad,no run,105.4ks slower short ball; Gaikwad almost jumps off the ground as he attempts the pull; he's deceived for pace and fails to connect; the ball goes on the bounce to Rickelton,2026-05-04 16:41:18.257659
44_CSKvsMI,May 04,16:33:57,MA Chidambaram Stadium,16,1,AM Ghazanfar,Kartik Sharma,FOUR,smashed! 94.8ks dragdown outside off; ample width for Kartik to capitalise; he goes on the back foot and slaps it in front of square. Tilak gets around and dives from long-off but had no chance to stop that,2026-05-04 16:41:18.258352
44_CSKvsMI,May 04,16:33:57,MA Chidambaram Stadium,16,2,AM Ghazanfar,Kartik Sharma,no run,drifting in with the arm; Kartik defends to the right of Ghazanfar,2026-05-04 16:41:18.258969
44_CSKvsMI,May 04,16:33:57,MA Chidambaram Stadium,16,3,AM Ghazanfar,Kartik Sharma,SIX,fabulous shot! It is not easy to use your feet against Ghazanfar as he does not give much flight. But Kartik runs down the wicket; converts it into a full delivery and whips it with a strong bottom hand over deep mid-wicket. They are couple of hits away..,2026-05-04 16:41:18.259520
44_CSKvsMI,May 04,16:33:57,MA Chidambaram Stadium,16,4,AM Ghazanfar,Kartik Sharma,no run,carrom ball that's slowed up; Kartik misses the dab and is beaten on the under-edge,2026-05-04 16:41:18.260166
44_CSKvsMI,May 04,16:33:57,MA Chidambaram Stadium,16,5,AM Ghazanfar,Kartik Sharma,FOUR,hammered! Tilak does not even bother this time. Overpitched outside off; Kartik generates incredible power on the drive and gives long-off no chance,2026-05-04 16:41:18.260762
44_CSKvsMI,May 04,16:33:57,MA Chidambaram Stadium,16,6,AM Ghazanfar,Kartik Sharma,no run,attacks the stumps; Kartik prods forward and defends to mid-wicket,2026-05-04 16:41:18.261385
44_CSKvsMI,May 04,16:33:57,MA Chidambaram Stadium,17,1,Krish Bhagat,Ruturaj Gaikwad,1 run,fullish delivery around off; Gaikwad chips it down the ground and is content with a single,2026-05-04 16:41:18.262583
44_CSKvsMI,May 04,16:33:57,MA Chidambaram Stadium,17,2,Krish Bhagat,Kartik Sharma,no run,slower ball around off; Kartik swings across the line and misses. He's on 47..,2026-05-04 16:41:18.264885
44_CSKvsMI,May 04,16:33:57,MA Chidambaram Stadium,17,3,Krish Bhagat,Kartik Sharma,no run,another off-pace delivery; Kartik does not pick it and is early into the heave; misses and it is another dot,2026-05-04 16:41:18.266881
44_CSKvsMI,May 04,16:33:57,MA Chidambaram Stadium,17,4,Krish Bhagat,Kartik Sharma,2 runs,full pitcher outside off; Kartik drills it back past Gaikwad and Tilak gets around from long-on; dives and stops the boundary,2026-05-04 16:41:18.269401
44_CSKvsMI,May 04,16:33:57,MA Chidambaram Stadium,17,5,Krish Bhagat,Kartik Sharma,1 run,maiden IPL fifty. This has been a fine knock. He has played the perfect second fiddle to his captain. Raises his bat and soaks in the applause of the home crowd. Short of length delivery; Kartik gets on top of the bounce and pulls backward of square leg,2026-05-04 16:41:18.270126
44_CSKvsMI,May 04,16:33:57,MA Chidambaram Stadium,17,6,Krish Bhagat,Ruturaj Gaikwad,no run,shimmies down and yorks himself; jams it off the toe-end back to Bhagat,2026-05-04 16:41:18.270884
44_CSKvsMI,May 04,16:33:57,MA Chidambaram Stadium,18,1,Trent Boult,Kartik Sharma,FOUR,CSK win by 8 wickets. Kartik is delighted as he walks across and is embraced by Gaikwad. This is another comprehensive win for CSK over MI this season. Full and angled outside off; Kartik shapes to scoop but since the line was outside off; he adjusted and reverse lapped it over short third. That was an incredible shot..,2026-05-04 16:41:18.271570
