match,date,time,venue,over,ball,bowler,batsman,ball_event,event_info,extract_time
44_CSKvsMI,May 04,16:33:57,MA Chidambaram Stadium,0,1,Mukesh Choudhary,Will Jacks,no run,139.5kph; play and miss! Extra bounce from a short of length outside off; Jacks looks to cut and the ball goes over his blade. Good carry-through to the keeper as well,2026-05-04 16:41:17.989071
44_CSKvsMI,May 04,16:33:57,MA Chidambaram Stadium,0,2,Mukesh Choudhary,Will Jacks,no run,137.3kph; full delivery swinging in; ends on the pads; Jacks flicks and misses to get hit on the pad,2026-05-04 16:41:17.989543
44_CSKvsMI,May 04,16:33:57,MA Chidambaram Stadium,0,3,Mukesh Choudhary,Will Jacks,1 run,143.3kph; Mukesh Choudhary pulls his length back; Jacks stays leg-side; opens the bat-face and steers it to third man to get off the mark,2026-05-04 16:41:17.990051
44_CSKvsMI,May 04,16:33:57,MA Chidambaram Stadium,0,4,Mukesh Choudhary,Ryan Rickelton,no run,full delivery that swings away late outside off; Rickelton watchfully defends it into the off-side,2026-05-04 16:41:17.990511
44_CSKvsMI,May 04,16:33:57,MA Chidambaram Stadium,0,5,Mukesh Choudhary,Ryan Rickelton,no run,141.6kph; short of a good length ball; slanting in towards leg; Rickelton knocks it to mid-on,2026-05-04 16:41:17.991016
44_CSKvsMI,May 04,16:33:57,MA Chidambaram Stadium,0,6,Mukesh Choudhary,Ryan Rickelton,no run,141.1kph; not that short to be cutting and Rickelton under-edges it towards cover. Tidy opening over from Mukesh - just 1 off it,2026-05-04 16:41:17.991534
44_CSKvsMI,May 04,16:33:57,MA Chidambaram Stadium,1,1,Anshul Kamboj,Will Jacks,no run,fullish delivery with a slip in place; Jacks shimmies down; moves leg-side in the process and throws his arms to slap it to extra cover,2026-05-04 16:41:17.992060
44_CSKvsMI,May 04,16:33:57,MA Chidambaram Stadium,1,2,Anshul Kamboj,Will Jacks,out Caught by Ramakrishna Ghosh!! In the air and taken! Ramakrishna Ghosh makes an impact in the field with a brilliant catch. 134.1kph,fullish delivery; Jacks steps out of his crease and backs away in the process to swing across the line. The ball moves away a bit off the deck and the ball flies over backward point off the outer part of the bat. Ghosh runs in from deep backward point; dives forward to snaffle it with both hands inches above the turn. Everything was right about that catch. Even after catching; he ensures that the ball doesn't pop out when his elbows hit the ground. CSK get the early breakthrough. Will Jacks c Ramakrishna Ghosh b Anshul Kamboj 1(5),2026-05-04 16:41:17.992613
44_CSKvsMI,May 04,16:33:57,MA Chidambaram Stadium,1,3,Anshul Kamboj,Naman Dhir,no run,good length that shapes away a bit; Naman Dhir defends it into the off-side,2026-05-04 16:41:17.993103
44_CSKvsMI,May 04,16:33:57,MA Chidambaram Stadium,1,4,Anshul Kamboj,Naman Dhir,FOUR,streaky boundary to get off the mark! Inswinging very full ball; Dhir hurriedly brings his bat down and gets a thick inside edge that runs away to fine leg for four,2026-05-04 16:41:17.993545
44_CSKvsMI,May 04,16:33:57,MA Chidambaram Stadium,1,5,Anshul Kamboj,Naman Dhir,no run,beaten! Seams back in from a length; Dhir looks to waft it through the off-side with an angled blade and gets beaten on the inside edge,2026-05-04 16:41:17.994163
44_CSKvsMI,May 04,16:33:57,MA Chidambaram Stadium,1,6,Anshul Kamboj,Naman Dhir,no run,beaten again! 135.4kph; good lift from a short of length; this one holds its line outside off. Dhir swings wildly across the line and the ball goes past his outside edge. Testing over from Anshul Kamboj,2026-05-04 16:41:17.994766
44_CSKvsMI,May 04,16:33:57,MA Chidambaram Stadium,2,1,Mukesh Choudhary,Ryan Rickelton,no run,139.7kph; another play and miss! Short of length; Rickelton looks to play across the line and misses as the ball sneaks past the inside edge,2026-05-04 16:41:17.995298
44_CSKvsMI,May 04,16:33:57,MA Chidambaram Stadium,2,2,Mukesh Choudhary,Ryan Rickelton,SIX,141.3kph; fuller ball; curls away as well. Rickelton stays leg-side even as he steps out; crouches low and reaches for it as he stylishly carves it over sweeper cover. The timing is exquisite,2026-05-04 16:41:17.996112
44_CSKvsMI,May 04,16:33:57,MA Chidambaram Stadium,2,3,Mukesh Choudhary,Ryan Rickelton,SIX,140.3kph; Mukesh Choudhary pulls his length back; Rickelton sees it coming. Stands tall and waits for the ball to come to him before dispatching it over deep midwicket with a thumping pull shot,2026-05-04 16:41:17.996727
44_CSKvsMI,May 04,16:33:57,MA Chidambaram Stadium,2,4,Mukesh Choudhary,Ryan Rickelton,no run,139.3kph; pushes this length ball towards cover and Rickelton sets off for a single; gets sent back by Naman Dhir who screams 'no',2026-05-04 16:41:17.997343
44_CSKvsMI,May 04,16:33:57,MA Chidambaram Stadium,2,5,Mukesh Choudhary,Ryan Rickelton,1 run,141.5kph; width on offer and Rickelton steers it to deep backward point,2026-05-04 16:41:17.997896
44_CSKvsMI,May 04,16:33:57,MA Chidambaram Stadium,2,6,Mukesh Choudhary,Naman Dhir,2 runs,138.7kph; back of a length; Dhir pulls hard. Hits him high on the bat and the timing is spot on. Ramakrishna Ghosh moves to his left in the deep to cut it off,2026-05-04 16:41:17.998519
44_CSKvsMI,May 04,16:33:57,MA Chidambaram Stadium,3,1,Anshul Kamboj,Ryan Rickelton,1 run,137kph; on a length and wide of off; Rickelton cuts it to deep backward point,2026-05-04 16:41:17.999087
44_CSKvsMI,May 04,16:33:57,MA Chidambaram Stadium,3,2,Anshul Kamboj,Naman Dhir,SIX,first six for Naman Dhir! 136kph; short of a good length ball on off-middle; Dhir rises as the ball comes to him; clears his front leg and swings through the line to tonk it over wide long-on for an 89m six,2026-05-04 16:41:17.999737
44_CSKvsMI,May 04,16:33:57,MA Chidambaram Stadium,3,3,Anshul Kamboj,Naman Dhir,1 run,138kph; short of length outside off; punched to deep point,2026-05-04 16:41:18.000370
44_CSKvsMI,May 04,16:33:57,MA Chidambaram Stadium,3,4,Anshul Kamboj,Ryan Rickelton,no run,136.6kph; beaten! Fuller than a length outside off; may have further moved away after pitching; Rickelton crouches a bit to swing it over midwicket and misses,2026-05-04 16:41:18.001044
44_CSKvsMI,May 04,16:33:57,MA Chidambaram Stadium,3,5,Anshul Kamboj,Ryan Rickelton,no run,run-out chance and Rickelton survives! 135.9kph; yorker length; Rickelton looks to squeeze it through the covers. He ends up jamming it into the pitch and Kamboj moves to his right to collect it. The bowler has a shy at the stumps at the keeper's end and misses the target. Rickelton had given up as he was well outside the crease. Luckily for him; there was no direct-hit. Kamboj has his hands on head,2026-05-04 16:41:18.001821
44_CSKvsMI,May 04,16:33:57,MA Chidambaram Stadium,3,6,Anshul Kamboj,Ryan Rickelton,1 run,short of length outside off; chopped to deep backward point,2026-05-04 16:41:18.002661
44_CSKvsMI,May 04,16:33:57,MA Chidambaram Stadium,4,1,Prashant Veer,Ryan Rickelton,no run,round the wicket; very full; in the blockhole and that's been jammed back at the bowler,2026-05-04 16:41:18.003476
44_CSKvsMI,May 04,16:33:57,MA Chidambaram Stadium,4,2,Prashant Veer,Ryan Rickelton,no run,94.3kph; overpitched outside off; Rickelton leans across and drills it straight to mid-off,2026-05-04 16:41:18.004215
44_CSKvsMI,May 04,16:33:57,MA Chidambaram Stadium,4,3,Prashant Veer,Ryan Rickelton,SIX,86kph; slower and on a length; Rickelton gets down on one leg to slogsweep it over long leg for a 76m six. It came right off the meat of the bat,2026-05-04 16:41:18.004894
44_CSKvsMI,May 04,16:33:57,MA Chidambaram Stadium,4,4,Prashant Veer,Ryan Rickelton,no run,94.7kph; quicker one outside off; Rickelton hurriedly cuts to extra cover,2026-05-04 16:41:18.005550
44_CSKvsMI,May 04,16:33:57,MA Chidambaram Stadium,4,5,Prashant Veer,Ryan Rickelton,SIX,95.6kph; Veer goes fuller and this one is closer to off. Rickelton brings out the slogsweep once again and clears the long-on fielder comfortably. Jamie Overton is a mere spectator,2026-05-04 16:41:18.006486
44_CSKvsMI,May 04,16:33:57,MA Chidambaram Stadium,4,6,Prashant Veer,Ryan Rickelton,SIX,3 sixes = 18 runs off the over! 102.5kph; even quicker and Veer tries to bowl this one wider. Rickelton expects it and shuffles a bit before kneeling down and dispatching it over long-on. Didn't time it as well as the previous one but cleared long-on easily once again,2026-05-04 16:41:18.007310
44_CSKvsMI,May 04,16:33:57,MA Chidambaram Stadium,5,1,Mukesh Choudhary,Naman Dhir,no run,140.5kph; pitched up; Dhir drives to mid-off,2026-05-04 16:41:18.008345
44_CSKvsMI,May 04,16:33:57,MA Chidambaram Stadium,5,2,Mukesh Choudhary,Naman Dhir,SIX,138.2kph; leg-lined full delivery and Naman Dhir brings his wrists to whip it away over deep midwicket. Brings up the fifty partnership. That's the 7th six of MI's innings,2026-05-04 16:41:18.009274
44_CSKvsMI,May 04,16:33:57,MA Chidambaram Stadium,5,3,Mukesh Choudhary,Naman Dhir,leg byes,1 run; 125.5kph; slower ball and Mukesh pulls his length back as well. Dhir is early to clip and misses. The ball rolls to backward point off the pad and the batters scamper across for a quick run via leg-byes,2026-05-04 16:41:18.010071
44_CSKvsMI,May 04,16:33:57,MA Chidambaram Stadium,5,4,Mukesh Choudhary,Ryan Rickelton,2 runs,144.4kph; very full and darted in; flicked to deep backward square leg,2026-05-04 16:41:18.010698
44_CSKvsMI,May 04,16:33:57,MA Chidambaram Stadium,5,5,Mukesh Choudhary,Ryan Rickelton,no run,141.8kph; low full toss; driven straight to mid-off,2026-05-04 16:41:18.011274
44_CSKvsMI,May 04,16:33:57,MA Chidambaram Stadium,5,6,Mukesh Choudhary,Ryan Rickelton,1 run,full on the stumps; Rickelton wristily drives it to long-on,2026-05-04 16:41:18.011770
44_CSKvsMI,May 04,16:33:57,MA Chidambaram Stadium,6,1,Noor Ahmad,Ryan Rickelton,1 run,92.3kph; over the wicket; legbreak well outside off; cut to deep backward point,2026-05-04 16:41:18.012439
44_CSKvsMI,May 04,16:33:57,MA Chidambaram Stadium,6,2,Noor Ahmad,Naman Dhir,1 run,95.2kph; in the air and dropped! Dhir goes on the back foot to cut; extra bounce and the edge goes straight to short third man. A dolly and Shivam Dube makes a mess of it,2026-05-04 16:41:18.012968
44_CSKvsMI,May 04,16:33:57,MA Chidambaram Stadium,6,3,Noor Ahmad,Ryan Rickelton,no run,94.3kph; fullish ball drifting in; reverse-swept straight to backward point,2026-05-04 16:41:18.013455
44_CSKvsMI,May 04,16:33:57,MA Chidambaram Stadium,6,4,Noor Ahmad,Ryan Rickelton,out Caught by Urvil Patel!! Noor strikes! The half-century partnership has been broken. 97.2kph,quick leggie on a length around off. Not much spin and Rickelton gets down low to slogsweep. Hits it flat and straight down deep backward square leg's throat. Ryan Rickelton c Urvil Patel b Noor Ahmad 37(24) [6s-5],2026-05-04 16:41:18.014051
44_CSKvsMI,May 04,16:33:57,MA Chidambaram Stadium,6,5,Noor Ahmad,Suryakumar Yadav,FOUR,96.9kph; Suryakumar Yadav gets off the mark with a boundary! Googly on a short of length outside off; Suryakumar spots it. Waits on the back foot and late-cuts it past the slip fielder. Runs away to third man for four,2026-05-04 16:41:18.015075
44_CSKvsMI,May 04,16:33:57,MA Chidambaram Stadium,6,6,Noor Ahmad,Suryakumar Yadav,no run,94.6kph; another googly; better length and it's just outside off; Suryakumar watchfully defends from the crease,2026-05-04 16:41:18.016159
44_CSKvsMI,May 04,16:33:57,MA Chidambaram Stadium,7,1,Prashant Veer,Naman Dhir,no run,93.2kph; full and darted in; Dhir backs away to drive it to the left of the bowler. Veer sticks his left hand out to stop it,2026-05-04 16:41:18.017387
44_CSKvsMI,May 04,16:33:57,MA Chidambaram Stadium,7,2,Prashant Veer,Naman Dhir,FOUR,shot! 94.5kph; flat; full and on the stumps; Dhir shimmies down; moves leg-side in the process and stylishly drives inside-out over extra cover. A couple of bounces and into the fence,2026-05-04 16:41:18.020315
44_CSKvsMI,May 04,16:33:57,MA Chidambaram Stadium,7,3,Prashant Veer,Naman Dhir,1 run,fullish delivery; knocked into the leg-side and the batters scamper across for a quick single,2026-05-04 16:41:18.021111
44_CSKvsMI,May 04,16:33:57,MA Chidambaram Stadium,7,4,Prashant Veer,Suryakumar Yadav,no run,92.8kph; full delivery; Suryakumar pushes it to extra cover,2026-05-04 16:41:18.021711
44_CSKvsMI,May 04,16:33:57,MA Chidambaram Stadium,7,5,Prashant Veer,Suryakumar Yadav,1 run,96.6kph; quick and full; driven along the ground to long-off,2026-05-04 16:41:18.022312
44_CSKvsMI,May 04,16:33:57,MA Chidambaram Stadium,7,6,Prashant Veer,Naman Dhir,1 run,96.8kph; Dhir jogs down the track to bunt this non-turning fullish ball to long-on,2026-05-04 16:41:18.022913
44_CSKvsMI,May 04,16:33:57,MA Chidambaram Stadium,8,1,Ramakrishna Ghosh,Naman Dhir,1 run,tumbles after he delivers; but it's a decent delivery. In-slanting length ball on off; Dhir taps it into the off-side for a quick single,2026-05-04 16:41:18.023458
44_CSKvsMI,May 04,16:33:57,MA Chidambaram Stadium,8,2,Ramakrishna Ghosh,Suryakumar Yadav,no run,133.4kph; hard length; comes in off the deck; Suryakumar stands tall to punch and inside-halves it to mid-on,2026-05-04 16:41:18.024042
44_CSKvsMI,May 04,16:33:57,MA Chidambaram Stadium,8,3,Ramakrishna Ghosh,Suryakumar Yadav,FOUR,135.2kph; full and wide of off; Suryakumar throws his arms at it to flay it over backward point. No chance for the man in the deep to cut it off,2026-05-04 16:41:18.024628
44_CSKvsMI,May 04,16:33:57,MA Chidambaram Stadium,8,4,Ramakrishna Ghosh,Suryakumar Yadav,no run,135.1kph; Ramakrishna Ghosh pulls his length back and targets the stumps. Comes a bit quicker than the batter expects and a hopping Suryakumar defends it back to the bowler,2026-05-04 16:41:18.025406
44_CSKvsMI,May 04,16:33:57,MA Chidambaram Stadium,8,5,Ramakrishna Ghosh,Suryakumar Yadav,1 run,131.3kph; short of length delivery around off; Suryakumar steers it to third man,2026-05-04 16:41:18.026119
44_CSKvsMI,May 04,16:33:57,MA Chidambaram Stadium,8,6,Ramakrishna Ghosh,Naman Dhir,1 run,130.4kph; fuller ball angling in; knocked down to long-on,2026-05-04 16:41:18.026825
44_CSKvsMI,May 04,16:33:57,MA Chidambaram Stadium,9,1,Noor Ahmad,Naman Dhir,1 run,93.2kph; full on off; Dhir taps it to point and the batters take a quick single,2026-05-04 16:41:18.027505
44_CSKvsMI,May 04,16:33:57,MA Chidambaram Stadium,9,2,Noor Ahmad,Suryakumar Yadav,FOUR,96.1kph; quick; fraction short and wide of off. Suryakumar goes on the back foot and cuts fiercely to the right of the diving backward point fielder. Third boundary for SKY,2026-05-04 16:41:18.028459
44_CSKvsMI,May 04,16:33:57,MA Chidambaram Stadium,9,3,Noor Ahmad,Suryakumar Yadav,SIX,SKY takes the aerial route now! 92.4kph; googly that's full and outside off; Suryakumar gets down on one leg; swings hard through the line to loft it over straight long-off,2026-05-04 16:41:18.030029
44_CSKvsMI,May 04,16:33:57,MA Chidambaram Stadium,9,4,Noor Ahmad,Suryakumar Yadav,1 run,96.5kph; quick and flat on leg; Suryakumar bunts it to long-on,2026-05-04 16:41:18.030613
44_CSKvsMI,May 04,16:33:57,MA Chidambaram Stadium,9,5,Noor Ahmad,Naman Dhir,no run,97.3kph; wrong 'un outside off; Naman Dhir heaves it straight back at the bowler who does well to stop it in his followthrough,2026-05-04 16:41:18.031289
44_CSKvsMI,May 04,16:33:57,MA Chidambaram Stadium,9,6,Noor Ahmad,Naman Dhir,1 run,Dhir goes back; makes room in the process and cuts through point. 13 runs off the over,2026-05-04 16:41:18.032001
44_CSKvsMI,May 04,16:33:57,MA Chidambaram Stadium,10,1,Ramakrishna Ghosh,Naman Dhir,FOUR,shot! Dhir shimmies down the wicket; gets a short of length delivery and he manages to flay it over extra cover. Not off the middle but with mid-off inside the ring; the ball trickles into the rope,2026-05-04 16:41:18.032690
44_CSKvsMI,May 04,16:33:57,MA Chidambaram Stadium,10,2,Ramakrishna Ghosh,Naman Dhir,FOUR,that's off the middle. This shot shows what a good surface this is. Back of a length delivery; not there in the slot but Dhir manages to play it on the rise; stands tall and pumps it wide of mid-off,2026-05-04 16:41:18.033409
44_CSKvsMI,May 04,16:33:57,MA Chidambaram Stadium,10,3,Ramakrishna Ghosh,Naman Dhir,1 run,slower ball around off; Dhir guides it towards backward point and the fielder makes the half stop,2026-05-04 16:41:18.034165
44_CSKvsMI,May 04,16:33:57,MA Chidambaram Stadium,10,4,Ramakrishna Ghosh,Suryakumar Yadav,out Caught by Dewald Brevis!! Maiden IPL wicket for Ramakrishna Ghosh. And what a wicket to get! He stands there with his finger pointing upwards. And another start from SKY that's all,nothing more. Short of length delivery; Suryakumar tries his best to get on top of the bounce and carve it over point; but hits it flat and straight to sweeper cover. Brevis barely had to move as the ball came at a nice height for him. Suryakumar Yadav c Dewald Brevis b Ramakrishna Ghosh 21(12) [4s-3 6s-1],2026-05-04 16:41:18.034877
44_CSKvsMI,May 04,16:33:57,MA Chidambaram Stadium,10,5,Ramakrishna Ghosh,Tilak Varma,1 run,short of length around off; Tilak gets on top of the bounce and punches wide of cover,2026-05-04 16:41:18.035445
44_CSKvsMI,May 04,16:33:57,MA Chidambaram Stadium,10,6,Ramakrishna Ghosh,Naman Dhir,no run,good comeback from Ghosh after going for fours off the first two balls. He only concedes 2 more runs and gets the wicket of SKY. Full pitcher close to off; Dhir drives and picks out extra cover,2026-05-04 16:41:18.036136
44_CSKvsMI,May 04,16:33:57,MA Chidambaram Stadium,11,1,Jamie Overton,Tilak Varma,no run,did that carry? Dube is not having a great time in the field. This was a chance and he was late to react. Back of a length delivery; Overton gets it to stop and Tilak checks his back foot punch; chips it towards cover and Dube runs around instead of charging forward - the ball lands just in front of him,2026-05-04 16:41:18.036731
44_CSKvsMI,May 04,16:33:57,MA Chidambaram Stadium,11,2,Jamie Overton,Tilak Varma,1 run,too straight - on middle and leg; Tilak tucks it backward of square,2026-05-04 16:41:18.037394
44_CSKvsMI,May 04,16:33:57,MA Chidambaram Stadium,11,3,Jamie Overton,Naman Dhir,3 runs,fullish delivery around off; Dhir drives through the line and Ruturaj dives full length near mid-off; gets a hand and then chases behind to haul the ball back in; saves a run,2026-05-04 16:41:18.037973
44_CSKvsMI,May 04,16:33:57,MA Chidambaram Stadium,11,4,Jamie Overton,Tilak Varma,no run,146.7ks back of a length angled across; Tilak looks to punch it through the off-side but the extra bounce takes it past the outside-edge,2026-05-04 16:41:18.038621
44_CSKvsMI,May 04,16:33:57,MA Chidambaram Stadium,11,5,Jamie Overton,Tilak Varma,2 runs,144.6ks leg-lined delivery; Tilak clips it in front of square and scampers back for the second,2026-05-04 16:41:18.039274
44_CSKvsMI,May 04,16:33:57,MA Chidambaram Stadium,11,6,Jamie Overton,Tilak Varma,no run,shuffles across and sits down to play the lap; Overton goes pace off and Tilak gets into a tangle; misses the scoop and is struck on the wrist. Overton checks if he is fine,2026-05-04 16:41:18.039967
44_CSKvsMI,May 04,16:33:57,MA Chidambaram Stadium,12,1,Noor Ahmad,Naman Dhir,no run,the change in angle almost worked for Noor. He goes round the wicket and slips in the googly; Dhir does not read it and looks to go down the ground. The ball spins past the outside-edge and Samson is quick to light up the stumps. Dhir was aware and quickly planted his right boot back into the crease,2026-05-04 16:41:18.040787
44_CSKvsMI,May 04,16:33:57,MA Chidambaram Stadium,12,2,Noor Ahmad,Naman Dhir,1 run,drifting into the right-hander; Dhir works it through mid-wicket,2026-05-04 16:41:18.041605
44_CSKvsMI,May 04,16:33:57,MA Chidambaram Stadium,12,3,Noor Ahmad,Tilak Varma,1 run,googly that turns in; Tilak gently nudges it to mid-wicket and crosses over,2026-05-04 16:41:18.042467
44_CSKvsMI,May 04,16:33:57,MA Chidambaram Stadium,12,4,Noor Ahmad,Naman Dhir,1 run,Dube having a horror time in the field. Short of length around off; Dhir slashes and the ball flies off the top-edge towards short third. Dube makes a mess off a easy stop and allows the pair to cross over,2026-05-04 16:41:18.043113
44_CSKvsMI,May 04,16:33:57,MA Chidambaram Stadium,12,5,Noor Ahmad,Tilak Varma,out Caught by Ruturaj Gaikwad!! Almost a collision between Ruturaj and Urvil,no harm done and more importantly the catch is taken. This is floated up invitingly by Noor; the conventional leg-break that turns away and Tilak looks to slog sweep against the spin; gets a thick top-edge and the ball skies towards cover. Ruturaj called for it but not sure Urvil heard him; they almost collide but it is Ruturaj who hangs on. Tilak Varma c Ruturaj Gaikwad b Noor Ahmad 5(8),2026-05-04 16:41:18.043790
44_CSKvsMI,May 04,16:33:57,MA Chidambaram Stadium,12,6,Noor Ahmad,Hardik Pandya,1 run,tossed up around off; Hardik eases it towards sweeper cover,2026-05-04 16:41:18.044334
44_CSKvsMI,May 04,16:33:57,MA Chidambaram Stadium,13,1,Jamie Overton,Hardik Pandya,byes,1 run; charges down first ball and Overton sees him coming; bangs it into the surface and gets it to climb sharply; Hardik lets go and Samson fumbles behind the wicket,2026-05-04 16:41:18.044860
44_CSKvsMI,May 04,16:33:57,MA Chidambaram Stadium,13,2,Jamie Overton,Naman Dhir,1 run,off-pace delivery; fraction short and Dhir shovels it along the ground to deep square leg,2026-05-04 16:41:18.045375
44_CSKvsMI,May 04,16:33:57,MA Chidambaram Stadium,13,3,Jamie Overton,Hardik Pandya,no run,145.5ks good length ball on off; Hardik defends to the right of the bowler and Overton uses his reach; grabs it with one hand and sends a throw to the striker's end. Hardik had to scramble and he gets in awkwardly - falling down; rolling over and somehow not injuring himself,2026-05-04 16:41:18.045924
44_CSKvsMI,May 04,16:33:57,MA Chidambaram Stadium,13,4,Jamie Overton,Hardik Pandya,no run,edged and safe. Back of a length delivery; in the channel around off; Hardik is rooted to the crease and defends with soft hands; hence the outside-edge does not carry to Samson - goes on the bounce,2026-05-04 16:41:18.047259
44_CSKvsMI,May 04,16:33:57,MA Chidambaram Stadium,13,5,Jamie Overton,Hardik Pandya,no run,uhhh! That's a peach. Seemed like there was a noise. But no appeal from Samson or Overton. Another delivery right in the corridor of uncertainty; it is short of length and Hardik has a tentative poke; the ball fizzes past the outside-edge. UltraEdge shows a flat-line..,2026-05-04 16:41:18.047854
44_CSKvsMI,May 04,16:33:57,MA Chidambaram Stadium,13,6,Jamie Overton,Hardik Pandya,1 run,slower ball that's fraction short; Hardik makes room and chops it square on the off-side,2026-05-04 16:41:18.048847
44_CSKvsMI,May 04,16:33:57,MA Chidambaram Stadium,14,1,Ramakrishna Ghosh,Hardik Pandya,FOUR,edged and four! 117.5ks slower ball outside off; Hardik saw the width and threw everything behind the shot; gets a thick outside-edge and the ball flies past a diving Samson,2026-05-04 16:41:18.051318
44_CSKvsMI,May 04,16:33:57,MA Chidambaram Stadium,14,2,Ramakrishna Ghosh,Hardik Pandya,no run,fuller and outside off; Hardik's weight is on the back leg and he still drills the drive to extra cover,2026-05-04 16:41:18.052602
44_CSKvsMI,May 04,16:33:57,MA Chidambaram Stadium,14,3,Ramakrishna Ghosh,Hardik Pandya,1 run,136.2ks back of a length delivery; Hardik punches it square and the sweeper tidies up,2026-05-04 16:41:18.053195
44_CSKvsMI,May 04,16:33:57,MA Chidambaram Stadium,14,4,Ramakrishna Ghosh,Naman Dhir,no run,122ks off-pace delivery; Naman aims to steer it behind square and is beaten by the lack of pace,2026-05-04 16:41:18.053770
44_CSKvsMI,May 04,16:33:57,MA Chidambaram Stadium,14,5,Ramakrishna Ghosh,Naman Dhir,1 run,135.1ks low full toss around off; Dhir jams it to long-on,2026-05-04 16:41:18.054402
44_CSKvsMI,May 04,16:33:57,MA Chidambaram Stadium,14,6,Ramakrishna Ghosh,Hardik Pandya,1 run,132.7ks fullish delivery close to off; Hardik eases it to long-off and retains strike,2026-05-04 16:41:18.054985
44_CSKvsMI,May 04,16:33:57,MA Chidambaram Stadium,15,1,Noor Ahmad,Hardik Pandya,leg byes,1 run; spinning down leg; Hardik misses the flick and the ball deflects off the pad,2026-05-04 16:41:18.055629
44_CSKvsMI,May 04,16:33:57,MA Chidambaram Stadium,15,2,Noor Ahmad,Naman Dhir,1 run,93.9ks flatter and drifting across; Dhir tucks it through mid-wicket,2026-05-04 16:41:18.056386
44_CSKvsMI,May 04,16:33:57,MA Chidambaram Stadium,15,3,Noor Ahmad,Hardik Pandya,no run,wrong 'un outside off; spins away as well; Hardik stays leg-side and attempts a drive through the off-side; beaten on the outside-edge and Samson is quick to whip the bails. There's a stumping check. First they are checking for a caught behind; nothing on UltraEdge. The right leg is firmly planted in the crease. Not Out..,2026-05-04 16:41:18.057081
44_CSKvsMI,May 04,16:33:57,MA Chidambaram Stadium,15,4,Noor Ahmad,Hardik Pandya,1 run,Krunalesque short ball; but does not get that kind of bounce; cramps Hardik for room though and the pull is mistimed to long-on,2026-05-04 16:41:18.057976
44_CSKvsMI,May 04,16:33:57,MA Chidambaram Stadium,15,5,Noor Ahmad,Naman Dhir,1 run,95.1ks dragged short; Dhir pulls and picks out deep mid-wicket,2026-05-04 16:41:18.058770
44_CSKvsMI,May 04,16:33:57,MA Chidambaram Stadium,15,6,Noor Ahmad,Hardik Pandya,no run,short of length around off; Hardik rides the bounce and knocks it to extra cover. Noor finishes a fine spell. His figures read - 4-0-26-2. He had a good game in the reverse fixture as well..,2026-05-04 16:41:18.059575
44_CSKvsMI,May 04,16:33:57,MA Chidambaram Stadium,16,1,Jamie Overton,Naman Dhir,2 runs,140.7ks sharp short ball and Dhir takes it on; but the ball keeps climbing and goes over the top-edge. Samson also fumbles and the pair scamper back for the second. It has been given as runs. So there was a thin top-edge. It will go down as a dropped catch by Samson. Fifty for Dhir.,2026-05-04 16:41:18.060294
