match,date,time,venue,over,ball,bowler,batsman,ball_event,event_info,extract_time
44_CSKvsMI,May 04,16:33:57,MA Chidambaram Stadium,16,2,Jamie Overton,Naman Dhir,1 run,short of length at the body; Dhir is rushed on the pull and gloves it towards short fine. He started well but his knock has come to a stall; needs a lift in the final four overs to get Mumbai Indians to a competitive total,2026-05-04 16:41:18.061719
44_CSKvsMI,May 04,16:33:57,MA Chidambaram Stadium,16,3,Jamie Overton,Hardik Pandya,1 run,slower ball and Hardik loses his shape; mistimes the heave to deep mid-wicket,2026-05-04 16:41:18.062548
44_CSKvsMI,May 04,16:33:57,MA Chidambaram Stadium,16,4,Jamie Overton,Naman Dhir,SIX,that's more like it. Overton goes pace on and loses his line - too straight - on middle and leg; Dhir maintains a solid base and swings it over backward square leg. Mumbai Indians need plenty more of this..,2026-05-04 16:41:18.063278
44_CSKvsMI,May 04,16:33:57,MA Chidambaram Stadium,16,5,Jamie Overton,Naman Dhir,out Caught by (sub)Sarfaraz Khan!! Excellent catch by Sarfaraz and Overton gets rid of the set batter. 123.8ks off-cutter that holds to the surface,Dhir backs away and is deceived for pace; does not get any timing on the drive and miscues it towards extra cover. Sarfaraz moves to his left; leaps and hangs on with both hands. A good knock from Dhir comes to an end. Naman Dhir c (sub)Sarfaraz Khan b Jamie Overton 57(37) [4s-4 6s-3],2026-05-04 16:41:18.064241
44_CSKvsMI,May 04,16:33:57,MA Chidambaram Stadium,16,6,Jamie Overton,Robin Minz,1 run,angled across the left-hander; Minz drives and the outside-edge flies down to third man,2026-05-04 16:41:18.065224
44_CSKvsMI,May 04,16:33:57,MA Chidambaram Stadium,17,1,Anshul Kamboj,Robin Minz,FOUR,shot! Full and outside off; right in the slot and Minz does well not to overhit the drive; he bends his back knee and lifts it over extra cover. The timing takes care of the rest,2026-05-04 16:41:18.066024
44_CSKvsMI,May 04,16:33:57,MA Chidambaram Stadium,17,2,Anshul Kamboj,Robin Minz,out Bowled!! Dragged on! Four and out for Minz. 132.5ks back of a length delivery,angled across the southpaw; Minz stands tall and tries to force it through the off-side; gets an inside-edge and the ball dislodges the bails. Mumbai Indians' innings coming apart. They are six down and into the bowlers. Only Hardik can save them from a below par total. Robin Minz b Anshul Kamboj 5(3) [4s-1],2026-05-04 16:41:18.067918
44_CSKvsMI,May 04,16:33:57,MA Chidambaram Stadium,17,3,Anshul Kamboj,Krish Bhagat,no run,130.5ks back of a length around the hips; Bhagat turns it gently to mid-wicket,2026-05-04 16:41:18.069044
44_CSKvsMI,May 04,16:33:57,MA Chidambaram Stadium,17,4,Anshul Kamboj,Krish Bhagat,1 run,fullish delivery on off; Bhagat eases it to long-on and gets Hardik on strike,2026-05-04 16:41:18.069825
44_CSKvsMI,May 04,16:33:57,MA Chidambaram Stadium,17,5,Anshul Kamboj,Hardik Pandya,1 run,141.5ks low full toss on off; Hardik clears his front leg and digs it out to deep mid-wicket,2026-05-04 16:41:18.070788
44_CSKvsMI,May 04,16:33:57,MA Chidambaram Stadium,17,6,Anshul Kamboj,Krish Bhagat,1 run,full and at the stumps; Bhagat pushes it to long-on and retains strike,2026-05-04 16:41:18.071494
44_CSKvsMI,May 04,16:33:57,MA Chidambaram Stadium,18,1,Jamie Overton,Krish Bhagat,no run,that's to quick for Bhagat. 149.2ks short of length delivery; Bhagat moves away and is nowhere close to making contact. That ball thudded into Samson's gloves,2026-05-04 16:41:18.072223
44_CSKvsMI,May 04,16:33:57,MA Chidambaram Stadium,18,2,Jamie Overton,Krish Bhagat,1 run,145.6ks back of a length delivery; Bhagat directs it square of the wicket and brings Hardik on strike,2026-05-04 16:41:18.072955
44_CSKvsMI,May 04,16:33:57,MA Chidambaram Stadium,18,3,Jamie Overton,Hardik Pandya,no run,uffff! 147.2ks quick and short; following Hardik and giving him no room; he gets into a tangle and almost gloves it to the off-side. Almost took a blow on the body,2026-05-04 16:41:18.073692
44_CSKvsMI,May 04,16:33:57,MA Chidambaram Stadium,18,4,Jamie Overton,Hardik Pandya,no run,now a pacy short ball outside off; keeps bouncing and does not give Hardik a chance to connect with the slash,2026-05-04 16:41:18.074384
44_CSKvsMI,May 04,16:33:57,MA Chidambaram Stadium,18,5,Jamie Overton,Hardik Pandya,2 runs,slower ball outside off; Hardik drives towards extra cover and the fielder makes a diving stop; the duo scamper back for the second,2026-05-04 16:41:18.077846
44_CSKvsMI,May 04,16:33:57,MA Chidambaram Stadium,18,6,Jamie Overton,Hardik Pandya,1 run,142.4ks back of a length delivery; Hardik tucks it to deep backward square and the ball almost carried to Mukesh. He overruns it but does well to make the stop,2026-05-04 16:41:18.078775
44_CSKvsMI,May 04,16:33:57,MA Chidambaram Stadium,19,1,Anshul Kamboj,Hardik Pandya,FOUR,Kamboj comes round the wicket - does not quite nail the yorker; 137.7ks full delivery on the pads; Hardik flicks it in front of square; right between deep square leg and deep mid-wicket. Noor gets around and allows the ball to slip past his grasp,2026-05-04 16:41:18.079483
44_CSKvsMI,May 04,16:33:57,MA Chidambaram Stadium,19,2,Anshul Kamboj,Hardik Pandya,wide,sprays the yorker down leg; Hardik does not bother and collects the wide,2026-05-04 16:41:18.080190
44_CSKvsMI,May 04,16:33:57,MA Chidambaram Stadium,19,2,Anshul Kamboj,Hardik Pandya,no run,138ks yorker outside off; Hardik is standing deep in the crease and digs it out to long-off; denies the single,2026-05-04 16:41:18.085423
44_CSKvsMI,May 04,16:33:57,MA Chidambaram Stadium,19,3,Anshul Kamboj,Hardik Pandya,out Caught by Dewald Brevis!! Hardik's struggles come to an end. He never got his rhythm or timing. 137.1ks fullish delivery on leg,Hardik does not quite get under the length as he attempts the straight-batted loft; gets more height than distance and Brevis settles under it near deep mid-wicket. Third wicket for Kamboj and he levels with Bhuvneshwar as the leading wicket-taker. Hardik Pandya c Dewald Brevis b Anshul Kamboj 18(23) [4s-2],2026-05-04 16:41:18.086136
44_CSKvsMI,May 04,16:33:57,MA Chidambaram Stadium,19,4,Anshul Kamboj,Trent Boult,SIX,why wasn't he sent above Krish Bhagat? Boult has smoked his first ball over the rope. Kamboj went over the wicket and offered a slot ball; Boult clears his front leg and heaves it into the deep mid-wicket stand,2026-05-04 16:41:18.086774
44_CSKvsMI,May 04,16:33:57,MA Chidambaram Stadium,19,5,Anshul Kamboj,Trent Boult,1 run,missed out there. Full toss at the stumps; Boult backs away and slashes it towards square third man,2026-05-04 16:41:18.089952
44_CSKvsMI,May 04,16:33:57,MA Chidambaram Stadium,19,6,Anshul Kamboj,Krish Bhagat,byes,1 run; nails the yorker outside off; Bhagat fails to dig it out and Boult races across to the other end. Samson under arms the ball to Kamboj and he has a shy at the non-striker's end; hits Bhagat on the back instead,2026-05-04 16:41:18.093938
44_CSKvsMI,May 04,16:33:57,MA Chidambaram Stadium,0,1,Trent Boult,Sanju Samson,1 run,135.9kph; over the wicket; back of a length; Samson walks forward to tuck it to backward square leg,2026-05-04 16:41:18.094938
44_CSKvsMI,May 04,16:33:57,MA Chidambaram Stadium,0,2,Trent Boult,Ruturaj Gaikwad,no run,inswinger; middle-stump line; Gaikwad watchfully defends from the crease,2026-05-04 16:41:18.096447
44_CSKvsMI,May 04,16:33:57,MA Chidambaram Stadium,0,3,Trent Boult,Ruturaj Gaikwad,1 run,fraction short; Gaikwad looks to force it through the off-side; the ball shapes in though. Off the inner edge and the ball rolls behind square on the leg-side,2026-05-04 16:41:18.099856
44_CSKvsMI,May 04,16:33:57,MA Chidambaram Stadium,0,4,Trent Boult,Sanju Samson,no run,straight line from Boult; Samson stays in his crease to knock it to mid-on,2026-05-04 16:41:18.100467
44_CSKvsMI,May 04,16:33:57,MA Chidambaram Stadium,0,5,Trent Boult,Sanju Samson,FOUR,138.6kph; first boundary for Samson! Boult serves width outside off; quick hands from Samson to scythe it through the gap between backward point and point,2026-05-04 16:41:18.101129
44_CSKvsMI,May 04,16:33:57,MA Chidambaram Stadium,0,6,Trent Boult,Sanju Samson,1 run,128.3kph; short of length; pushed to mid-off for a single,2026-05-04 16:41:18.101865
44_CSKvsMI,May 04,16:33:57,MA Chidambaram Stadium,1,1,Jasprit Bumrah,Sanju Samson,no run,edged and dropped! Jasprit Bumrah turns around and walks back with a smile on his face. Seam-up delivery; good bounce on a length outside off. Samson stays leg-side and tentatively fiddles his bat at it. Guides it straight to first slip off the outside edge. An absolute dolly and Jacks puts it down,2026-05-04 16:41:18.102530
44_CSKvsMI,May 04,16:33:57,MA Chidambaram Stadium,1,2,Jasprit Bumrah,Sanju Samson,1 run,in-seamer; Samson pushes from the crease; inside-edges onto his pad and the ball rolls towards point,2026-05-04 16:41:18.103174
44_CSKvsMI,May 04,16:33:57,MA Chidambaram Stadium,1,3,Jasprit Bumrah,Ruturaj Gaikwad,1 run,full and swinging away outside off; Gaikwad throws his arms at it and outside-edges it over and wide of slip. A single to third man,2026-05-04 16:41:18.103894
44_CSKvsMI,May 04,16:33:57,MA Chidambaram Stadium,1,4,Jasprit Bumrah,Sanju Samson,no run,low bounce on this occasion; decks in as well; Samson has a wild waft at it and gets beaten on the inside edge,2026-05-04 16:41:18.104821
44_CSKvsMI,May 04,16:33:57,MA Chidambaram Stadium,1,5,Jasprit Bumrah,Sanju Samson,FOUR,141kph; Bumrah pulls his length back; there's a bit of width and Samson puts it away. Stands tall on the back foot to punch it behind square on the off-side. Races away to the fence,2026-05-04 16:41:18.105560
44_CSKvsMI,May 04,16:33:57,MA Chidambaram Stadium,1,6,Jasprit Bumrah,Sanju Samson,out Caught by Ryan Rickelton!! Bumrah gets his man! 138.7kph,it's the outswinger outside off; extra bounce from a length outside off. Samson slashes hard for a cut with no feet movement and gets a fat outside edge. Ryan Rickelton; the man with the mitts; leaps to his right to take a two-handed catch. No heroics from Samson tonight. Jacks will be a relieved man. Bumrah strikes in his first over. Sanju Samson c Ryan Rickelton b Jasprit Bumrah 11(9) [4s-2],2026-05-04 16:41:18.106298
44_CSKvsMI,May 04,16:33:57,MA Chidambaram Stadium,2,1,Trent Boult,Ruturaj Gaikwad,FOUR,135.4kph; that's a glorious stroke from the CSK captain! Pitched up by Boult; Gaikwad presses forward and shows the maker's name to push-drive it between the bowler and the non-striker. Beautifully timed,2026-05-04 16:41:18.107005
44_CSKvsMI,May 04,16:33:57,MA Chidambaram Stadium,2,2,Trent Boult,Ruturaj Gaikwad,2 runs,137.3kph; shortened length; the line is a bit too straight; Gaikwad works it behind square on the on-side for a couple more,2026-05-04 16:41:18.107602
44_CSKvsMI,May 04,16:33:57,MA Chidambaram Stadium,2,3,Trent Boult,Ruturaj Gaikwad,no run,135.1kph; this isn't short enough to be cutting and Gaikwad under-edges it towards cover-point,2026-05-04 16:41:18.108310
44_CSKvsMI,May 04,16:33:57,MA Chidambaram Stadium,2,4,Trent Boult,Ruturaj Gaikwad,wide,138.7kph; banged in short by Boult and that's way over the ducking batter. Wided for height,2026-05-04 16:41:18.112252
44_CSKvsMI,May 04,16:33:57,MA Chidambaram Stadium,2,4,Trent Boult,Ruturaj Gaikwad,no run,137.7kph; short of length; Gaikwad stands tall and watchfully knocks it to mid-on,2026-05-04 16:41:18.113122
44_CSKvsMI,May 04,16:33:57,MA Chidambaram Stadium,2,5,Trent Boult,Ruturaj Gaikwad,FOUR,139.7kph; in the air; safe and four! No half measures from Gaikwad. Short ball that's below shoulder-high. Gaikwad spots the length early and slams the pull in front of square on the leg-side. Deep backward square leg runs to his left but to no avail. A couple of bounces into the fence,2026-05-04 16:41:18.114002
44_CSKvsMI,May 04,16:33:57,MA Chidambaram Stadium,2,6,Trent Boult,Ruturaj Gaikwad,SIX,beautifully timed! 134.4kph; Boult's line too straight on this occasion and Gaikwad nonchalantly flicks it over deep backward square leg. Doesn't bother to keep it down and off she goes. 17 runs off the over,2026-05-04 16:41:18.118491
44_CSKvsMI,May 04,16:33:57,MA Chidambaram Stadium,3,1,Jasprit Bumrah,Urvil Patel,2 runs,140.6kph; leg-lined length ball; Urvil closes the bat-face to glance it through square leg and gets off the mark,2026-05-04 16:41:18.119337
44_CSKvsMI,May 04,16:33:57,MA Chidambaram Stadium,3,2,Jasprit Bumrah,Urvil Patel,no run,137.4kph; short of length delivery on the stumps; Urvil watchfully defends from the crease,2026-05-04 16:41:18.119967
44_CSKvsMI,May 04,16:33:57,MA Chidambaram Stadium,3,3,Jasprit Bumrah,Urvil Patel,FOUR,138.7kph; shortish ball down leg; Urvil walks across to get inside the line and try to hook it away. Off the batter's glove and the ball runs away to fine leg for four runs,2026-05-04 16:41:18.120517
44_CSKvsMI,May 04,16:33:57,MA Chidambaram Stadium,3,4,Jasprit Bumrah,Urvil Patel,no run,in-seamer; Urvil shapes to heave across the line and misses this short of length ball to get hit on the hip,2026-05-04 16:41:18.127991
44_CSKvsMI,May 04,16:33:57,MA Chidambaram Stadium,3,5,Jasprit Bumrah,Urvil Patel,no run,another play and miss! 140.7kph; fuller than a good length; Urvil swings wildly across the line and gets beaten on the outside edge. Bounces over the off-stump,2026-05-04 16:41:18.128824
44_CSKvsMI,May 04,16:33:57,MA Chidambaram Stadium,3,6,Jasprit Bumrah,Urvil Patel,1 run,pad-lined ball to end the over and Urvil helps it on its way to fine leg,2026-05-04 16:41:18.133904
44_CSKvsMI,May 04,16:33:57,MA Chidambaram Stadium,4,1,Krish Bhagat,Urvil Patel,SIX,top-edge and six! 131.4kph; in-slanbting short of length delivery; Urvil looks to swing it over backward square leg. Fat edge and the ball flies over fine leg for an 84m six,2026-05-04 16:41:18.134574
44_CSKvsMI,May 04,16:33:57,MA Chidambaram Stadium,4,2,Krish Bhagat,Urvil Patel,FOUR,133.9kph; goes over mid-on now! Short of a good length; Urvil stands tall and swings hard to thump it over mid-on. Not quite off the middle of the bat but he's muscled it,2026-05-04 16:41:18.135300
44_CSKvsMI,May 04,16:33:57,MA Chidambaram Stadium,4,3,Krish Bhagat,Urvil Patel,1 run,107.4kph; off-speed full delivery and Urvil knocks it to long-on,2026-05-04 16:41:18.136444
44_CSKvsMI,May 04,16:33:57,MA Chidambaram Stadium,4,4,Krish Bhagat,Ruturaj Gaikwad,1 run,132kph; short of length on off; Gaikwad plays with soft hands to tap it to point,2026-05-04 16:41:18.137502
44_CSKvsMI,May 04,16:33:57,MA Chidambaram Stadium,4,5,Krish Bhagat,Urvil Patel,no run,107.3kph; pace off; looked like the leg-cutter; Urvil waits to heave and finds midwicket,2026-05-04 16:41:18.139058
44_CSKvsMI,May 04,16:33:57,MA Chidambaram Stadium,4,6,Krish Bhagat,Urvil Patel,SIX,134.6kph; wow! The batter backs away and Bhagat follows him with a full delivery. Urvil brings his wrists into play to powerfully flick it over square leg. Superb contact and it's six more for Urvil. 18 runs off the over,2026-05-04 16:41:18.140134
44_CSKvsMI,May 04,16:33:57,MA Chidambaram Stadium,5,1,AM Ghazanfar,Ruturaj Gaikwad,no run,90.6kph; length ball on off; pushed to the left of cover where Hardik makes a diving stop,2026-05-04 16:41:18.141120
44_CSKvsMI,May 04,16:33:57,MA Chidambaram Stadium,5,2,AM Ghazanfar,Ruturaj Gaikwad,SIX,101.5kph; quick but it's a drag down from Ghazanfar. Gaikwad sees that; kneels down and swat-pulls it over deep backward square leg. Hardik watches the proceedings in disbelief,2026-05-04 16:41:18.145679
44_CSKvsMI,May 04,16:33:57,MA Chidambaram Stadium,5,3,AM Ghazanfar,Ruturaj Gaikwad,1 run,90.6kph; fuller ball and Gaikwad knocks it to long-on,2026-05-04 16:41:18.151427
44_CSKvsMI,May 04,16:33:57,MA Chidambaram Stadium,5,4,AM Ghazanfar,Urvil Patel,out Bowled!! Chopped on! 94.5kph,carrom ball; fullish outside off; Urvil Patel gets down on one leg to slog it across the line and ends up dragging it onto his stumps off the toe-end of the bat. End of Urvil's cameo. MI badly needed that breakthrough and Ghazanfar strikes in his opening over. Urvil Patel b AM Ghazanfar 24(12) [4s-2 6s-2],2026-05-04 16:41:18.153225
44_CSKvsMI,May 04,16:33:57,MA Chidambaram Stadium,5,5,AM Ghazanfar,Kartik Sharma,no run,short of length; Kartik goes on the back foot to knock it to mid-on,2026-05-04 16:41:18.156912
44_CSKvsMI,May 04,16:33:57,MA Chidambaram Stadium,5,6,AM Ghazanfar,Kartik Sharma,no run,the length is once again on the shorter side and Kartik cuts to point,2026-05-04 16:41:18.162806
44_CSKvsMI,May 04,16:33:57,MA Chidambaram Stadium,6,1,Raghu Sharma,Ruturaj Gaikwad,1 run,starts with a shortish leggie that keeps a shade low; Gaikwad cuts to deep point,2026-05-04 16:41:18.168682
44_CSKvsMI,May 04,16:33:57,MA Chidambaram Stadium,6,2,Raghu Sharma,Kartik Sharma,no run,87.3kph; skids off the deck on a good length; Kartik pushes it to cover off the back foot,2026-05-04 16:41:18.170918
44_CSKvsMI,May 04,16:33:57,MA Chidambaram Stadium,6,3,Raghu Sharma,Kartik Sharma,FOUR,88.7kph; Kartik shimmies down the track; converts it into a half-volley and smashes it over the non-striker's head for a one-bounce four. Opens his account in style,2026-05-04 16:41:18.172016
44_CSKvsMI,May 04,16:33:57,MA Chidambaram Stadium,6,4,Raghu Sharma,Kartik Sharma,1 run,legbreak; Kartik pushes to cover,2026-05-04 16:41:18.172850
44_CSKvsMI,May 04,16:33:57,MA Chidambaram Stadium,6,5,Raghu Sharma,Ruturaj Gaikwad,1 run,89.3kph; shortened length; cut to deep point,2026-05-04 16:41:18.174196
44_CSKvsMI,May 04,16:33:57,MA Chidambaram Stadium,6,6,Raghu Sharma,Kartik Sharma,no run,this one slides on and cramps the batter for room. Kartik hangs back to blunt it into the leg-side and Raghu is quick to get to the ball,2026-05-04 16:41:18.180776
44_CSKvsMI,May 04,16:33:57,MA Chidambaram Stadium,7,1,AM Ghazanfar,Ruturaj Gaikwad,1 run,99.3kph; short ball; spinning in; pulled away to deep midwicket,2026-05-04 16:41:18.185849
44_CSKvsMI,May 04,16:33:57,MA Chidambaram Stadium,7,2,AM Ghazanfar,Kartik Sharma,1 run,91.2kph; fullish ball on the stumps; Kartik gets forward and nudges it into the mid-on region for a single,2026-05-04 16:41:18.187014
44_CSKvsMI,May 04,16:33:57,MA Chidambaram Stadium,7,3,AM Ghazanfar,Ruturaj Gaikwad,2 runs,94.4kph; low full toss on the pads; nudged to square leg and the batters take two,2026-05-04 16:41:18.189194
44_CSKvsMI,May 04,16:33:57,MA Chidambaram Stadium,7,4,AM Ghazanfar,Ruturaj Gaikwad,1 run,90.3kph; pad-lined; worked into the midwicket pocket,2026-05-04 16:41:18.190744
44_CSKvsMI,May 04,16:33:57,MA Chidambaram Stadium,7,5,AM Ghazanfar,Kartik Sharma,no run,skips down the pitch and defensively pushes to the left of the bowler. Ghazanfar makes a good stop in his followthrough,2026-05-04 16:41:18.199853
44_CSKvsMI,May 04,16:33:57,MA Chidambaram Stadium,7,6,AM Ghazanfar,Kartik Sharma,SIX,89.3kph; Kartik clears deep midwicket. Half-tracker from Ghazanfar and Kartik goes on the back foot to powerfully heave it over deep midwicket for a 77m six. Will Jacks; a few yards in front of the boundary rope; jumps to try and take a one-handed catch but the ball goes over his hand. It would have been catchable had he stayed back,2026-05-04 16:41:18.201166
44_CSKvsMI,May 04,16:33:57,MA Chidambaram Stadium,8,1,Raghu Sharma,Ruturaj Gaikwad,no run,90.8kph; legbreak that spins a bit; Gaikwad dinks it towards mid-off from the crease,2026-05-04 16:41:18.202576
44_CSKvsMI,May 04,16:33:57,MA Chidambaram Stadium,8,2,Raghu Sharma,Ruturaj Gaikwad,2 runs,86.6kph; fraction short; Gaikwad jabs it between long-on and deep midwicket. Tilak runs to his left and tries to flick it towards the converging long-on fielder (Dhir). Not a clean tag-team effort and it's an easy two for the CSK captain,2026-05-04 16:41:18.205383
44_CSKvsMI,May 04,16:33:57,MA Chidambaram Stadium,8,3,Raghu Sharma,Ruturaj Gaikwad,1 run,the length is once again on the shorter side and Gaikwad pulls to deep midwicket,2026-05-04 16:41:18.210313
44_CSKvsMI,May 04,16:33:57,MA Chidambaram Stadium,8,4,Raghu Sharma,Kartik Sharma,no run,89.8kph; full leggie; Kartik pushes it back to the bowler,2026-05-04 16:41:18.215934
44_CSKvsMI,May 04,16:33:57,MA Chidambaram Stadium,8,5,Raghu Sharma,Kartik Sharma,1 run,90.1kph; quicker one that slides on; Kartik goes on the back foot to bunt it to long-on,2026-05-04 16:41:18.219441
44_CSKvsMI,May 04,16:33:57,MA Chidambaram Stadium,8,6,Raghu Sharma,Ruturaj Gaikwad,1 run,92.5kph; eases this length ball to long-off for a single,2026-05-04 16:41:18.221066
44_CSKvsMI,May 04,16:33:57,MA Chidambaram Stadium,9,1,Hardik Pandya,Ruturaj Gaikwad,1 run,120.2kph; off-speed short of length delivery; Gaikwad closes the bat-face early; gets a leading edge towards cover-point,2026-05-04 16:41:18.221928
44_CSKvsMI,May 04,16:33:57,MA Chidambaram Stadium,9,2,Hardik Pandya,Kartik Sharma,1 run,slower ball into the deck; Kartik waits on the back foot and cuts over point for a single,2026-05-04 16:41:18.222919
44_CSKvsMI,May 04,16:33:57,MA Chidambaram Stadium,9,3,Hardik Pandya,Ruturaj Gaikwad,wide,121.7kph; slow bouncer but it's way over the batter's head. Nothing doing from the batter,2026-05-04 16:41:18.223919
44_CSKvsMI,May 04,16:33:57,MA Chidambaram Stadium,9,3,Hardik Pandya,Ruturaj Gaikwad,1 run,124.5kph; opens the bat-face to punch this length ball to deep point,2026-05-04 16:41:18.224870
44_CSKvsMI,May 04,16:33:57,MA Chidambaram Stadium,9,4,Hardik Pandya,Kartik Sharma,1 run,128kph; back of a length; pulled to deep midwicket,2026-05-04 16:41:18.225818
44_CSKvsMI,May 04,16:33:57,MA Chidambaram Stadium,9,5,Hardik Pandya,Ruturaj Gaikwad,1 run,118.4kph; short of length; Gaikwad allows the ball to come to him and punches to long-on,2026-05-04 16:41:18.226757
44_CSKvsMI,May 04,16:33:57,MA Chidambaram Stadium,9,6,Hardik Pandya,Kartik Sharma,1 run,125.8kph; short ball; leg-lined; pulled along the ground to deep backward square leg,2026-05-04 16:41:18.227869
44_CSKvsMI,May 04,16:33:57,MA Chidambaram Stadium,10,1,Raghu Sharma,Kartik Sharma,no run,91.2ks fraction short on off; Kartik chops it towards cover-point,2026-05-04 16:41:18.228677
44_CSKvsMI,May 04,16:33:57,MA Chidambaram Stadium,10,2,Raghu Sharma,Kartik Sharma,no run,85.9ks tossed up around off; Kartik eases it towards cover,2026-05-04 16:41:18.229421
44_CSKvsMI,May 04,16:33:57,MA Chidambaram Stadium,10,3,Raghu Sharma,Kartik Sharma,1 run,92.6ks flatter and touch quicker; Kartik knocks it to cover and quickly crosses over,2026-05-04 16:41:18.230389
44_CSKvsMI,May 04,16:33:57,MA Chidambaram Stadium,10,4,Raghu Sharma,Ruturaj Gaikwad,1 run,88.9ks shortens the length; Gaikwad flicks it through mid-wicket,2026-05-04 16:41:18.231088
44_CSKvsMI,May 04,16:33:57,MA Chidambaram Stadium,10,5,Raghu Sharma,Kartik Sharma,1 run,90.5ks flighted delivery and Kartik winds for the big mow; moves away and drags it to long-on,2026-05-04 16:41:18.232494
44_CSKvsMI,May 04,16:33:57,MA Chidambaram Stadium,10,6,Raghu Sharma,Ruturaj Gaikwad,2 runs,drifting into leg; Gaikwad leans forward and works it into the vast open spaces on the leg-side; easy two,2026-05-04 16:41:18.233935
44_CSKvsMI,May 04,16:33:57,MA Chidambaram Stadium,11,1,Hardik Pandya,Kartik Sharma,SIX,that breaks the shackles. Couple of quiet overs and something had to give. 133.2ks length delivery; right in the slot and Kartik swings hard; gets enough for the ball to sail over the long-on fielder,2026-05-04 16:41:18.235593
44_CSKvsMI,May 04,16:33:57,MA Chidambaram Stadium,11,2,Hardik Pandya,Kartik Sharma,1 run,back of a length outside off; Kartik steers it on the bounce to third man,2026-05-04 16:41:18.236931
44_CSKvsMI,May 04,16:33:57,MA Chidambaram Stadium,11,3,Hardik Pandya,Ruturaj Gaikwad,1 run,128.4ks on a length and outside off; Gaikwad pats it to point and crosses over,2026-05-04 16:41:18.237754
44_CSKvsMI,May 04,16:33:57,MA Chidambaram Stadium,11,4,Hardik Pandya,Kartik Sharma,1 run,116.9ks short and banged into the wicket; Kartik hops and toe-ends the upper cut to third man,2026-05-04 16:41:18.238250
44_CSKvsMI,May 04,16:33:57,MA Chidambaram Stadium,11,5,Hardik Pandya,Ruturaj Gaikwad,1 run,124.7ks back of a length close to off; Gaikwad knocks it to long-on,2026-05-04 16:41:18.238758
44_CSKvsMI,May 04,16:33:57,MA Chidambaram Stadium,11,6,Hardik Pandya,Kartik Sharma,no run,119.9ks off-pace short ball outside off; Kartik is through the upper cut early and misses it completely,2026-05-04 16:41:18.239988
44_CSKvsMI,May 04,16:33:57,MA Chidambaram Stadium,12,1,Raghu Sharma,Ruturaj Gaikwad,2 runs,89.7ks tossed up; Gaikwad nudges it to mid-wicket and calls for two. Kartik had to hurry as the throw came to his end. It is not on target and Kartik survives,2026-05-04 16:41:18.241029
44_CSKvsMI,May 04,16:33:57,MA Chidambaram Stadium,12,2,Raghu Sharma,Ruturaj Gaikwad,1 run,89.3ks flighted delivery; Gaikwad defends to the vacant cover region,2026-05-04 16:41:18.241544
44_CSKvsMI,May 04,16:33:57,MA Chidambaram Stadium,12,3,Raghu Sharma,Kartik Sharma,1 run,90.3ks touch quicker; Kartik shimmies out and does not get to the pitch; settles with a push to long-on,2026-05-04 16:41:18.242018
44_CSKvsMI,May 04,16:33:57,MA Chidambaram Stadium,12,4,Raghu Sharma,Ruturaj Gaikwad,1 run,drifting into leg; Gaikwad leans forward and nurdles it round the corner - square leg,2026-05-04 16:41:18.242499
44_CSKvsMI,May 04,16:33:57,MA Chidambaram Stadium,12,5,Raghu Sharma,Kartik Sharma,1 run,92.5ks flatter and fraction short; Kartik punches to long-off,2026-05-04 16:41:18.243080
44_CSKvsMI,May 04,16:33:57,MA Chidambaram Stadium,12,6,Raghu Sharma,Ruturaj Gaikwad,1 run,92.1ks tad short and around off; Gaikwad chops it square of the wicket and retains strike. Economical spell from Raghu Sharma on debut. But he and Mumbai Indians would have loved a wicket. His figures - 4-0-24-0,2026-05-04 16:41:18.243584
